root@ubuntu-s-1vcpu-1gb-tor1-01:~# tcpdump -n -i eth0
tcpdump: verbose output suppressed, use -v or -vv for full protocol decode
listening on eth0, link-type EN10MB (Ethernet), capture size 262144 bytes
20:34:39.081953 IP 159.203.29.37.22 > 198.96.85.21.65355: Flags [P.], seq 2052167134:2052167242, ack 3366061974, win 313, length 108
20:34:39.082047 IP 159.203.29.37.22 > 198.96.85.21.65355: Flags [P.], seq 108:144, ack 1, win 313, length 36
20:34:39.082141 IP 159.203.29.37.22 > 198.96.85.21.65355: Flags [P.], seq 144:252, ack 1, win 313, length 108
20:34:39.082209 IP 159.203.29.37.22 > 198.96.85.21.65355: Flags [P.], seq 252:288, ack 1, win 313, length 36
20:34:39.082407 IP 159.203.29.37.22 > 198.96.85.21.65355: Flags [P.], seq 288:460, ack 1, win 313, length 172
20:34:39.082479 IP 159.203.29.37.22 > 198.96.85.21.65355: Flags [P.], seq 460:496, ack 1, win 313, length 36
20:34:39.082573 IP 159.203.29.37.22 > 198.96.85.21.65355: Flags [P.], seq 496:644, ack 1, win 313, length 148
20:34:39.083179 IP 159.203.29.37.22 > 198.96.85.21.65355: Flags [P.], seq 644:680, ack 1, win 313, length 36
20:34:39.083292 IP 159.203.29.37.22 > 198.96.85.21.65355: Flags [P.], seq 680:828, ack 1, win 313, length 148
20:34:39.084717 IP 198.96.85.21.65355 > 159.203.29.37.22: Flags [.], ack 108, win 3835, length 0
20:34:39.084750 IP 159.203.29.37.22 > 198.96.85.21.65355: Flags [P.], seq 828:1968, ack 1, win 313, length 1140
20:34:39.084775 IP 198.96.85.21.65355 > 159.203.29.37.22: Flags [.], ack 252, win 3834, length 0
20:34:39.084897 IP 159.203.29.37.22 > 198.96.85.21.65355: Flags [P.], seq 1968:2100, ack 1, win 313, length 132
20:34:39.084979 IP 159.203.29.37.22 > 198.96.85.21.65355: Flags [P.], seq 2100:2136, ack 1, win 313, length 36
20:34:39.085075 IP 159.203.29.37.22 > 198.96.85.21.65355: Flags [P.], seq 2136:2284, ack 1, win 313, length 148
20:34:39.085143 IP 159.203.29.37.22 > 198.96.85.21.65355: Flags [P.], seq 2284:2320, ack 1, win 313, length 36
20:34:39.085232 IP 159.203.29.37.22 > 198.96.85.21.65355: Flags [P.], seq 2320:2452, ack 1, win 313, length 132
20:34:39.085297 IP 159.203.29.37.22 > 198.96.85.21.65355: Flags [P.], seq 2452:2488, ack 1, win 313, length 36
20:34:39.085360 IP 198.96.85.21.65355 > 159.203.29.37.22: Flags [.], ack 460, win 3839, length 0
20:34:39.085601 IP 159.203.29.37.22 > 198.96.85.21.65355: Flags [P.], seq 2672:2820, ack 1, win 313, length 148
20:34:39.085757 IP 159.203.29.37.22 > 198.96.85.21.65355: Flags [P.], seq 2856:3004, ack 1, win 313, length 148
20:34:39.085913 IP 159.203.29.37.22 > 198.96.85.21.65355: Flags [P.], seq 3040:3188, ack 1, win 313, length 148
20:34:39.086031 IP 198.96.85.21.65355 > 159.203.29.37.22: Flags [.], ack 828, win 3837, length 0
20:34:39.086269 IP 159.203.29.37.22 > 198.96.85.21.65355: Flags [P.], seq 3408:3556, ack 1, win 313, length 148
20:34:39.086429 IP 159.203.29.37.22 > 198.96.85.21.65355: Flags [P.], seq 3592:3724, ack 1, win 313, length 132
20:34:39.089120 IP 198.96.85.21.65355 > 159.203.29.37.22: Flags [.], ack 2100, win 3839, length 0
20:34:39.089145 IP 159.203.29.37.22 > 198.96.85.21.65355: Flags [P.], seq 3724:4848, ack 1, win 313, length 1124
20:34:39.089167 IP 198.96.85.21.65355 > 159.203.29.37.22: Flags [.], ack 2284, win 3838, length 0
20:34:39.089172 IP 198.96.85.21.65355 > 159.203.29.37.22: Flags [.], ack 2452, win 3837, length 0
20:34:39.089177 IP 198.96.85.21.65355 > 159.203.29.37.22: Flags [.], ack 2636, win 3836, length 0
20:34:39.089181 IP 198.96.85.21.65355 > 159.203.29.37.22: Flags [.], ack 2820, win 3836, length 0
20:34:39.089306 IP 159.203.29.37.22 > 198.96.85.21.65355: Flags [P.], seq 4848:4980, ack 1, win 313, length 132
20:34:39.089588 IP 159.203.29.37.22 > 198.96.85.21.65355: Flags [P.], seq 5016:5164, ack 1, win 313, length 148
20:34:39.089792 IP 159.203.29.37.22 > 198.96.85.21.65355: Flags [P.], seq 5200:5332, ack 1, win 313, length 132
20:34:39.089964 IP 159.203.29.37.22 > 198.96.85.21.65355: Flags [P.], seq 5368:5500, ack 1, win 313, length 132
20:34:39.090118 IP 159.203.29.37.22 > 198.96.85.21.65355: Flags [P.], seq 5536:5668, ack 1, win 313, length 132
20:34:39.090273 IP 159.203.29.37.22 > 198.96.85.21.65355: Flags [P.], seq 5704:5836, ack 1, win 313, length 132
20:34:39.090492 IP 159.203.29.37.22 > 198.96.85.21.65355: Flags [P.], seq 5872:6020, ack 1, win 313, length 148
20:34:39.090900 IP 159.203.29.37.22 > 198.96.85.21.65355: Flags [P.], seq 6056:6204, ack 1, win 313, length 148
20:34:39.091163 IP 159.203.29.37.22 > 198.96.85.21.65355: Flags [P.], seq 6240:6388, ack 1, win 313, length 148
20:34:39.091395 IP 159.203.29.37.22 > 198.96.85.21.65355: Flags [P.], seq 6424:6572, ack 1, win 313, length 148
20:34:39.091629 IP 159.203.29.37.22 > 198.96.85.21.65355: Flags [P.], seq 6608:6756, ack 1, win 313, length 148
20:34:39.091737 IP 159.203.29.37.22 > 198.96.85.21.65355: Flags [P.], seq 6756:6904, ack 1, win 313, length 148
20:34:39.091920 IP 159.203.29.37.22 > 198.96.85.21.65355: Flags [P.], seq 6904:7508, ack 1, win 313, length 604
20:34:39.092071 IP 159.203.29.37.22 > 198.96.85.21.65355: Flags [P.], seq 7508:7776, ack 1, win 313, length 268
20:34:39.092178 IP 159.203.29.37.22 > 198.96.85.21.65355: Flags [P.], seq 7776:7924, ack 1, win 313, length 148
20:34:39.092281 IP 159.203.29.37.22 > 198.96.85.21.65355: Flags [P.], seq 7924:8072, ack 1, win 313, length 148
20:34:39.092415 IP 159.203.29.37.22 > 198.96.85.21.65355: Flags [P.], seq 8072:8220, ack 1, win 313, length 148
20:34:39.092576 IP 159.203.29.37.22 > 198.96.85.21.65355: Flags [P.], seq 8220:8368, ack 1, win 313, length 148
20:34:39.092689 IP 159.203.29.37.22 > 198.96.85.21.65355: Flags [P.], seq 8368:8516, ack 1, win 313, length 148
20:34:39.092792 IP 159.203.29.37.22 > 198.96.85.21.65355: Flags [P.], seq 8516:8664, ack 1, win 313, length 148
20:34:39.092892 IP 159.203.29.37.22 > 198.96.85.21.65355: Flags [P.], seq 8664:8812, ack 1, win 313, length 148
20:34:39.092992 IP 159.203.29.37.22 > 198.96.85.21.65355: Flags [P.], seq 8812:8960, ack 1, win 313, length 148
20:34:39.093091 IP 159.203.29.37.22 > 198.96.85.21.65355: Flags [P.], seq 8960:9108, ack 1, win 313, length 148
20:34:39.093189 IP 159.203.29.37.22 > 198.96.85.21.65355: Flags [P.], seq 9108:9256, ack 1, win 313, length 148
20:34:39.093287 IP 159.203.29.37.22 > 198.96.85.21.65355: Flags [P.], seq 9256:9404, ack 1, win 313, length 148
20:34:39.093411 IP 159.203.29.37.22 > 198.96.85.21.65355: Flags [P.], seq 9404:9552, ack 1, win 313, length 148
20:34:39.093515 IP 159.203.29.37.22 > 198.96.85.21.65355: Flags [P.], seq 9552:9700, ack 1, win 313, length 148
20:34:39.093614 IP 159.203.29.37.22 > 198.96.85.21.65355: Flags [P.], seq 9700:9848, ack 1, win 313, length 148
20:34:39.093713 IP 159.203.29.37.22 > 198.96.85.21.65355: Flags [P.], seq 9848:9996, ack 1, win 313, length 148
20:34:39.093863 IP 198.96.85.21.65355 > 159.203.29.37.22: Flags [.], ack 4980, win 3839, length 0
20:34:39.093884 IP 159.203.29.37.22 > 198.96.85.21.65355: Flags [P.], seq 9996:10144, ack 1, win 313, length 148
20:34:39.093904 IP 198.96.85.21.65355 > 159.203.29.37.22: Flags [.], ack 5164, win 3838, length 0
20:34:39.093909 IP 198.96.85.21.65355 > 159.203.29.37.22: Flags [.], ack 5332, win 3837, length 0
20:34:39.094072 IP 159.203.29.37.22 > 198.96.85.21.65355: Flags [P.], seq 10144:10596, ack 1, win 313, length 452
20:34:39.094137 IP 198.96.85.21.65355 > 159.203.29.37.22: Flags [.], ack 5500, win 3837, length 0
20:34:39.094148 IP 198.96.85.21.65355 > 159.203.29.37.22: Flags [.], ack 5668, win 3836, length 0
20:34:39.094153 IP 198.96.85.21.65355 > 159.203.29.37.22: Flags [.], ack 5836, win 3835, length 0
20:34:39.094157 IP 198.96.85.21.65355 > 159.203.29.37.22: Flags [.], ack 6020, win 3835, length 0
20:34:39.094245 IP 198.96.85.21.65355 > 159.203.29.37.22: Flags [.], ack 6204, win 3834, length 0
20:34:39.094252 IP 198.96.85.21.65355 > 159.203.29.37.22: Flags [.], ack 6388, win 3839, length 0
20:34:39.094374 IP 159.203.29.37.22 > 198.96.85.21.65355: Flags [P.], seq 10596:11344, ack 1, win 313, length 748
20:34:39.094486 IP 159.203.29.37.22 > 198.96.85.21.65355: Flags [P.], seq 11344:11500, ack 1, win 313, length 156
20:34:39.094629 IP 159.203.29.37.22 > 198.96.85.21.65355: Flags [P.], seq 11500:11656, ack 1, win 313, length 156
20:34:39.094742 IP 159.203.29.37.22 > 198.96.85.21.65355: Flags [P.], seq 11656:11812, ack 1, win 313, length 156
20:34:39.094843 IP 159.203.29.37.22 > 198.96.85.21.65355: Flags [P.], seq 11812:11968, ack 1, win 313, length 156
20:34:39.094945 IP 159.203.29.37.22 > 198.96.85.21.65355: Flags [P.], seq 11968:12124, ack 1, win 313, length 156
20:34:39.095046 IP 159.203.29.37.22 > 198.96.85.21.65355: Flags [P.], seq 12124:12280, ack 1, win 313, length 156
20:34:39.095145 IP 159.203.29.37.22 > 198.96.85.21.65355: Flags [P.], seq 12280:12436, ack 1, win 313, length 156
20:34:39.095244 IP 159.203.29.37.22 > 198.96.85.21.65355: Flags [P.], seq 12436:12592, ack 1, win 313, length 156
20:34:39.095388 IP 159.203.29.37.22 > 198.96.85.21.65355: Flags [P.], seq 12592:12748, ack 1, win 313, length 156
20:34:39.095494 IP 159.203.29.37.22 > 198.96.85.21.65355: Flags [P.], seq 12748:12904, ack 1, win 313, length 156
20:34:39.095594 IP 159.203.29.37.22 > 198.96.85.21.65355: Flags [P.], seq 12904:13060, ack 1, win 313, length 156
20:34:39.095692 IP 159.203.29.37.22 > 198.96.85.21.65355: Flags [P.], seq 13060:13216, ack 1, win 313, length 156
20:34:39.095790 IP 159.203.29.37.22 > 198.96.85.21.65355: Flags [P.], seq 13216:13372, ack 1, win 313, length 156
20:34:39.095887 IP 159.203.29.37.22 > 198.96.85.21.65355: Flags [P.], seq 13372:13528, ack 1, win 313, length 156
20:34:39.095983 IP 159.203.29.37.22 > 198.96.85.21.65355: Flags [P.], seq 13528:13684, ack 1, win 313, length 156
20:34:39.096078 IP 159.203.29.37.22 > 198.96.85.21.65355: Flags [P.], seq 13684:13840, ack 1, win 313, length 156
20:34:39.096172 IP 159.203.29.37.22 > 198.96.85.21.65355: Flags [P.], seq 13840:13996, ack 1, win 313, length 156
20:34:39.096268 IP 159.203.29.37.22 > 198.96.85.21.65355: Flags [P.], seq 13996:14152, ack 1, win 313, length 156
20:34:39.096369 IP 159.203.29.37.22 > 198.96.85.21.65355: Flags [P.], seq 14152:14308, ack 1, win 313, length 156
20:34:39.096492 IP 159.203.29.37.22 > 198.96.85.21.65355: Flags [P.], seq 14308:14464, ack 1, win 313, length 156
20:34:39.096567 IP 198.96.85.21.65355 > 159.203.29.37.22: Flags [.], ack 6572, win 3838, length 0
20:34:39.096580 IP 198.96.85.21.65355 > 159.203.29.37.22: Flags [.], ack 6756, win 3837, length 0
20:34:39.096584 IP 198.96.85.21.65355 > 159.203.29.37.22: Flags [.], ack 7508, win 3834, length 0
20:34:39.096603 IP 198.96.85.21.65355 > 159.203.29.37.22: Flags [.], ack 7924, win 3839, length 0
20:34:39.096771 IP 159.203.29.37.22 > 198.96.85.21.65355: Flags [P.], seq 14464:15012, ack 1, win 313, length 548
20:34:39.096893 IP 198.96.85.21.65355 > 159.203.29.37.22: Flags [.], ack 8220, win 3837, length 0
20:34:39.096905 IP 198.96.85.21.65355 > 159.203.29.37.22: Flags [.], ack 8516, win 3836, length 0
20:34:39.096910 IP 198.96.85.21.65355 > 159.203.29.37.22: Flags [.], ack 8812, win 3835, length 0
20:34:39.096914 IP 198.96.85.21.65355 > 159.203.29.37.22: Flags [.], ack 9108, win 3834, length 0
20:34:39.096987 IP 198.96.85.21.65355 > 159.203.29.37.22: Flags [.], ack 9404, win 3839, length 0
20:34:39.096994 IP 198.96.85.21.65355 > 159.203.29.37.22: Flags [.], ack 9700, win 3837, length 0
20:34:39.096998 IP 198.96.85.21.65355 > 159.203.29.37.22: Flags [.], ack 9996, win 3836, length 0
20:34:39.097101 IP 159.203.29.37.22 > 198.96.85.21.65355: Flags [P.], seq 15012:15168, ack 1, win 313, length 156
20:34:39.097175 IP 159.203.29.37.22 > 198.96.85.21.65355: Flags [P.], seq 15168:15900, ack 1, win 313, length 732
20:34:39.097293 IP 159.203.29.37.22 > 198.96.85.21.65355: Flags [P.], seq 15900:16168, ack 1, win 313, length 268
20:34:39.097394 IP 159.203.29.37.22 > 198.96.85.21.65355: Flags [P.], seq 16168:16324, ack 1, win 313, length 156
20:34:39.097492 IP 159.203.29.37.22 > 198.96.85.21.65355: Flags [P.], seq 16324:16480, ack 1, win 313, length 156
20:34:39.097617 IP 159.203.29.37.22 > 198.96.85.21.65355: Flags [P.], seq 16480:16636, ack 1, win 313, length 156
20:34:39.097720 IP 159.203.29.37.22 > 198.96.85.21.65355: Flags [P.], seq 16636:16792, ack 1, win 313, length 156
20:34:39.097817 IP 159.203.29.37.22 > 198.96.85.21.65355: Flags [P.], seq 16792:16948, ack 1, win 313, length 156
20:34:39.097912 IP 159.203.29.37.22 > 198.96.85.21.65355: Flags [P.], seq 16948:17104, ack 1, win 313, length 156
20:34:39.098007 IP 159.203.29.37.22 > 198.96.85.21.65355: Flags [P.], seq 17104:17260, ack 1, win 313, length 156
20:34:39.098105 IP 159.203.29.37.22 > 198.96.85.21.65355: Flags [P.], seq 17260:17416, ack 1, win 313, length 156
20:34:39.098201 IP 159.203.29.37.22 > 198.96.85.21.65355: Flags [P.], seq 17416:17572, ack 1, win 313, length 156
20:34:39.098296 IP 159.203.29.37.22 > 198.96.85.21.65355: Flags [P.], seq 17572:17728, ack 1, win 313, length 156
20:34:39.098395 IP 159.203.29.37.22 > 198.96.85.21.65355: Flags [P.], seq 17728:17884, ack 1, win 313, length 156
20:34:39.098492 IP 159.203.29.37.22 > 198.96.85.21.65355: Flags [P.], seq 17884:18040, ack 1, win 313, length 156
20:34:39.098677 IP 159.203.29.37.22 > 198.96.85.21.65355: Flags [P.], seq 18040:18196, ack 1, win 313, length 156
20:34:39.098864 IP 159.203.29.37.22 > 198.96.85.21.65355: Flags [P.], seq 18196:18352, ack 1, win 313, length 156
20:34:39.098995 IP 159.203.29.37.22 > 198.96.85.21.65355: Flags [P.], seq 18352:18508, ack 1, win 313, length 156
20:34:39.099100 IP 159.203.29.37.22 > 198.96.85.21.65355: Flags [P.], seq 18508:18664, ack 1, win 313, length 156
20:34:39.099199 IP 159.203.29.37.22 > 198.96.85.21.65355: Flags [P.], seq 18664:18820, ack 1, win 313, length 156
20:34:39.099354 IP 159.203.29.37.22 > 198.96.85.21.65355: Flags [P.], seq 18820:18976, ack 1, win 313, length 156
20:34:39.099408 IP 198.96.85.21.65355 > 159.203.29.37.22: Flags [.], ack 10596, win 3834, length 0
20:34:39.099422 IP 198.96.85.21.65355 > 159.203.29.37.22: Flags [.], ack 11500, win 3839, length 0
20:34:39.099427 IP 198.96.85.21.65355 > 159.203.29.37.22: Flags [.], ack 11812, win 3837, length 0
20:34:39.099431 IP 198.96.85.21.65355 > 159.203.29.37.22: Flags [.], ack 12124, win 3836, length 0
20:34:39.099472 IP 198.96.85.21.65355 > 159.203.29.37.22: Flags [.], ack 12436, win 3835, length 0
20:34:39.099480 IP 198.96.85.21.65355 > 159.203.29.37.22: Flags [.], ack 12748, win 3834, length 0
20:34:39.099679 IP 198.96.85.21.65355 > 159.203.29.37.22: Flags [.], ack 13684, win 3836, length 0
20:34:39.099692 IP 198.96.85.21.65355 > 159.203.29.37.22: Flags [.], ack 13996, win 3835, length 0
20:34:39.099696 IP 198.96.85.21.65355 > 159.203.29.37.22: Flags [.], ack 14308, win 3834, length 0
20:34:39.099793 IP 159.203.29.37.22 > 198.96.85.21.65355: Flags [P.], seq 18976:19732, ack 1, win 313, length 756
20:34:39.099903 IP 159.203.29.37.22 > 198.96.85.21.65355: Flags [P.], seq 19732:20184, ack 1, win 313, length 452
20:34:39.100001 IP 159.203.29.37.22 > 198.96.85.21.65355: Flags [P.], seq 20184:20340, ack 1, win 313, length 156
20:34:39.100098 IP 159.203.29.37.22 > 198.96.85.21.65355: Flags [P.], seq 20340:20496, ack 1, win 313, length 156
20:34:39.100196 IP 159.203.29.37.22 > 198.96.85.21.65355: Flags [P.], seq 20496:20652, ack 1, win 313, length 156
20:34:39.100296 IP 159.203.29.37.22 > 198.96.85.21.65355: Flags [P.], seq 20652:20808, ack 1, win 313, length 156
20:34:39.100771 IP 159.203.29.37.22 > 198.96.85.21.65355: Flags [P.], seq 20808:20964, ack 1, win 313, length 156
20:34:39.100983 IP 159.203.29.37.22 > 198.96.85.21.65355: Flags [P.], seq 20964:21120, ack 1, win 313, length 156
20:34:39.101146 IP 159.203.29.37.22 > 198.96.85.21.65355: Flags [P.], seq 21120:21276, ack 1, win 313, length 156
20:34:39.101309 IP 159.203.29.37.22 > 198.96.85.21.65355: Flags [P.], seq 21276:21432, ack 1, win 313, length 156
20:34:39.101503 IP 159.203.29.37.22 > 198.96.85.21.65355: Flags [P.], seq 21432:21588, ack 1, win 313, length 156
20:34:39.101676 IP 159.203.29.37.22 > 198.96.85.21.65355: Flags [P.], seq 21588:21744, ack 1, win 313, length 156
20:34:39.101849 IP 159.203.29.37.22 > 198.96.85.21.65355: Flags [P.], seq 21744:21900, ack 1, win 313, length 156
20:34:39.102019 IP 159.203.29.37.22 > 198.96.85.21.65355: Flags [P.], seq 21900:22056, ack 1, win 313, length 156
20:34:39.102181 IP 159.203.29.37.22 > 198.96.85.21.65355: Flags [P.], seq 22056:22212, ack 1, win 313, length 156
20:34:39.102301 IP 198.96.85.21.65355 > 159.203.29.37.22: Flags [.], ack 15012, win 3839, length 0
20:34:39.102322 IP 198.96.85.21.65355 > 159.203.29.37.22: Flags [.], ack 15900, win 3835, length 0
20:34:39.102331 IP 198.96.85.21.65355 > 159.203.29.37.22: Flags [.], ack 16324, win 3839, length 0
20:34:39.102338 IP 198.96.85.21.65355 > 159.203.29.37.22: Flags [.], ack 16636, win 3837, length 0
20:34:39.102586 IP 159.203.29.37.22 > 198.96.85.21.65355: Flags [P.], seq 22212:22768, ack 1, win 313, length 556
20:34:39.102659 IP 198.96.85.21.65355 > 159.203.29.37.22: Flags [.], ack 16948, win 3836, length 0
20:34:39.102668 IP 198.96.85.21.65355 > 159.203.29.37.22: Flags [.], ack 17260, win 3835, length 0
20:34:39.102672 IP 198.96.85.21.65355 > 159.203.29.37.22: Flags [.], ack 17572, win 3834, length 0
20:34:39.102676 IP 198.96.85.21.65355 > 159.203.29.37.22: Flags [.], ack 17884, win 3839, length 0
20:34:39.102679 IP 198.96.85.21.65355 > 159.203.29.37.22: Flags [.], ack 18196, win 3837, length 0
20:34:39.102683 IP 198.96.85.21.65355 > 159.203.29.37.22: Flags [.], ack 18508, win 3836, length 0
20:34:39.103081 IP 159.203.29.37.22 > 198.96.85.21.65355: Flags [P.], seq 22768:23524, ack 1, win 313, length 756
20:34:39.103265 IP 159.203.29.37.22 > 198.96.85.21.65355: Flags [P.], seq 23524:23680, ack 1, win 313, length 156
20:34:39.103478 IP 159.203.29.37.22 > 198.96.85.21.65355: Flags [P.], seq 23680:23836, ack 1, win 313, length 156
20:34:39.103655 IP 159.203.29.37.22 > 198.96.85.21.65355: Flags [P.], seq 23836:23992, ack 1, win 313, length 156
20:34:39.103838 IP 159.203.29.37.22 > 198.96.85.21.65355: Flags [P.], seq 23992:24148, ack 1, win 313, length 156
20:34:39.104016 IP 159.203.29.37.22 > 198.96.85.21.65355: Flags [P.], seq 24148:24304, ack 1, win 313, length 156
20:34:39.104177 IP 159.203.29.37.22 > 198.96.85.21.65355: Flags [P.], seq 24304:24460, ack 1, win 313, length 156
20:34:39.104347 IP 159.203.29.37.22 > 198.96.85.21.65355: Flags [P.], seq 24460:24616, ack 1, win 313, length 156
20:34:39.104516 IP 159.203.29.37.22 > 198.96.85.21.65355: Flags [P.], seq 24616:24772, ack 1, win 313, length 156
20:34:39.104597 IP 198.96.85.21.65355 > 159.203.29.37.22: Flags [.], ack 20964, win 3834, length 0
20:34:39.104768 IP 159.203.29.37.22 > 198.96.85.21.65355: Flags [P.], seq 24772:25024, ack 1, win 313, length 252
20:34:39.104940 IP 159.203.29.37.22 > 198.96.85.21.65355: Flags [P.], seq 25024:25180, ack 1, win 313, length 156
20:34:39.105103 IP 159.203.29.37.22 > 198.96.85.21.65355: Flags [P.], seq 25180:25336, ack 1, win 313, length 156
20:34:39.105146 IP 198.96.85.21.65355 > 159.203.29.37.22: Flags [.], ack 21276, win 3839, length 0
20:34:39.105201 IP 198.96.85.21.65355 > 159.203.29.37.22: Flags [.], ack 21588, win 3837, length 0
20:34:39.105210 IP 198.96.85.21.65355 > 159.203.29.37.22: Flags [.], ack 21900, win 3836, length 0
20:34:39.105214 IP 198.96.85.21.65355 > 159.203.29.37.22: Flags [.], ack 22212, win 3835, length 0
20:34:39.105487 IP 159.203.29.37.22 > 198.96.85.21.65355: Flags [P.], seq 25336:25892, ack 1, win 313, length 556
20:34:39.105679 IP 159.203.29.37.22 > 198.96.85.21.65355: Flags [P.], seq 25892:26048, ack 1, win 313, length 156
20:34:39.105846 IP 159.203.29.37.22 > 198.96.85.21.65355: Flags [P.], seq 26048:26204, ack 1, win 313, length 156
20:34:39.106010 IP 159.203.29.37.22 > 198.96.85.21.65355: Flags [P.], seq 26204:26360, ack 1, win 313, length 156
20:34:39.106180 IP 159.203.29.37.22 > 198.96.85.21.65355: Flags [P.], seq 26360:26516, ack 1, win 313, length 156
20:34:39.106336 IP 159.203.29.37.22 > 198.96.85.21.65355: Flags [P.], seq 26516:26672, ack 1, win 313, length 156
20:34:39.106372 IP 198.96.85.21.65355 > 159.203.29.37.22: Flags [.], ack 23524, win 3839, length 0
20:34:39.106381 IP 198.96.85.21.65355 > 159.203.29.37.22: Flags [.], ack 23836, win 3837, length 0
20:34:39.106689 IP 159.203.29.37.22 > 198.96.85.21.65355: Flags [P.], seq 26672:27028, ack 1, win 313, length 356
20:34:39.106873 IP 159.203.29.37.22 > 198.96.85.21.65355: Flags [P.], seq 27028:27184, ack 1, win 313, length 156
20:34:39.107042 IP 159.203.29.37.22 > 198.96.85.21.65355: Flags [P.], seq 27184:27340, ack 1, win 313, length 156
20:34:39.107215 IP 159.203.29.37.22 > 198.96.85.21.65355: Flags [P.], seq 27340:27496, ack 1, win 313, length 156
20:34:39.107416 IP 159.203.29.37.22 > 198.96.85.21.65355: Flags [P.], seq 27496:27652, ack 1, win 313, length 156
20:34:39.107483 IP 198.96.85.21.65355 > 159.203.29.37.22: Flags [.], ack 24148, win 3836, length 0
20:34:39.107500 IP 198.96.85.21.65355 > 159.203.29.37.22: Flags [.], ack 24460, win 3835, length 0
20:34:39.107507 IP 198.96.85.21.65355 > 159.203.29.37.22: Flags [.], ack 24772, win 3834, length 0
20:34:39.107752 IP 159.203.29.37.22 > 198.96.85.21.65355: Flags [P.], seq 27652:28104, ack 1, win 313, length 452
20:34:39.107983 IP 159.203.29.37.22 > 198.96.85.21.65355: Flags [P.], seq 28104:28260, ack 1, win 313, length 156
20:34:39.108160 IP 159.203.29.37.22 > 198.96.85.21.65355: Flags [P.], seq 28260:28416, ack 1, win 313, length 156
20:34:39.108322 IP 159.203.29.37.22 > 198.96.85.21.65355: Flags [P.], seq 28416:28572, ack 1, win 313, length 156
20:34:39.108468 IP 159.203.29.37.22 > 198.96.85.21.65355: Flags [P.], seq 28572:28728, ack 1, win 313, length 156
20:34:39.108630 IP 159.203.29.37.22 > 198.96.85.21.65355: Flags [P.], seq 28728:28884, ack 1, win 313, length 156
20:34:39.108777 IP 159.203.29.37.22 > 198.96.85.21.65355: Flags [P.], seq 28884:29040, ack 1, win 313, length 156
20:34:39.108827 IP 198.96.85.21.65355 > 159.203.29.37.22: Flags [.], ack 25180, win 3839, length 0
20:34:39.108835 IP 198.96.85.21.65355 > 159.203.29.37.22: Flags [.], ack 25892, win 3836, length 0
20:34:39.108839 IP 198.96.85.21.65355 > 159.203.29.37.22: Flags [.], ack 26204, win 3835, length 0
20:34:39.108843 IP 198.96.85.21.65355 > 159.203.29.37.22: Flags [.], ack 26516, win 3839, length 0
20:34:39.109119 IP 159.203.29.37.22 > 198.96.85.21.65355: Flags [P.], seq 29040:29596, ack 1, win 313, length 556
20:34:39.109293 IP 159.203.29.37.22 > 198.96.85.21.65355: Flags [P.], seq 29596:29752, ack 1, win 313, length 156
20:34:39.109449 IP 159.203.29.37.22 > 198.96.85.21.65355: Flags [P.], seq 29752:29908, ack 1, win 313, length 156
20:34:39.109596 IP 159.203.29.37.22 > 198.96.85.21.65355: Flags [P.], seq 29908:30064, ack 1, win 313, length 156
20:34:39.109751 IP 159.203.29.37.22 > 198.96.85.21.65355: Flags [P.], seq 30064:30220, ack 1, win 313, length 156
20:34:39.109864 IP 198.96.85.21.65355 > 159.203.29.37.22: Flags [.], ack 27028, win 3837, length 0
20:34:39.109881 IP 198.96.85.21.65355 > 159.203.29.37.22: Flags [.], ack 27340, win 3835, length 0
20:34:39.109888 IP 198.96.85.21.65355 > 159.203.29.37.22: Flags [.], ack 27652, win 3834, length 0
20:34:39.110070 IP 159.203.29.37.22 > 198.96.85.21.65355: Flags [P.], seq 30220:30672, ack 1, win 313, length 452
20:34:39.110237 IP 159.203.29.37.22 > 198.96.85.21.65355: Flags [P.], seq 30672:30828, ack 1, win 313, length 156
20:34:39.110391 IP 159.203.29.37.22 > 198.96.85.21.65355: Flags [P.], seq 30828:30984, ack 1, win 313, length 156
20:34:39.110539 IP 159.203.29.37.22 > 198.96.85.21.65355: Flags [P.], seq 30984:31140, ack 1, win 313, length 156
20:34:39.110742 IP 159.203.29.37.22 > 198.96.85.21.65355: Flags [P.], seq 31140:31296, ack 1, win 313, length 156
20:34:39.110898 IP 159.203.29.37.22 > 198.96.85.21.65355: Flags [P.], seq 31296:31452, ack 1, win 313, length 156
20:34:39.111043 IP 198.96.85.21.65355 > 159.203.29.37.22: Flags [.], ack 28260, win 3839, length 0
20:34:39.111062 IP 198.96.85.21.65355 > 159.203.29.37.22: Flags [.], ack 28572, win 3837, length 0
20:34:39.111072 IP 198.96.85.21.65355 > 159.203.29.37.22: Flags [.], ack 28884, win 3836, length 0
20:34:39.111231 IP 159.203.29.37.22 > 198.96.85.21.65355: Flags [P.], seq 31452:31608, ack 1, win 313, length 156
20:34:39.111328 IP 159.203.29.37.22 > 198.96.85.21.65355: Flags [P.], seq 31608:31948, ack 1, win 313, length 340
20:34:39.111520 IP 159.203.29.37.22 > 198.96.85.21.65355: Flags [P.], seq 31948:32216, ack 1, win 313, length 268
20:34:39.111673 IP 159.203.29.37.22 > 198.96.85.21.65355: Flags [P.], seq 32216:32372, ack 1, win 313, length 156
20:34:39.111824 IP 159.203.29.37.22 > 198.96.85.21.65355: Flags [P.], seq 32372:32528, ack 1, win 313, length 156
20:34:39.111969 IP 159.203.29.37.22 > 198.96.85.21.65355: Flags [P.], seq 32528:32684, ack 1, win 313, length 156
20:34:39.112118 IP 159.203.29.37.22 > 198.96.85.21.65355: Flags [P.], seq 32684:32840, ack 1, win 313, length 156
20:34:39.112222 IP 198.96.85.21.65355 > 159.203.29.37.22: Flags [.], ack 29596, win 3839, length 0
20:34:39.112239 IP 198.96.85.21.65355 > 159.203.29.37.22: Flags [.], ack 29908, win 3837, length 0
20:34:39.112246 IP 198.96.85.21.65355 > 159.203.29.37.22: Flags [.], ack 30220, win 3836, length 0
20:34:39.112448 IP 159.203.29.37.22 > 198.96.85.21.65355: Flags [P.], seq 32840:33292, ack 1, win 313, length 452
20:34:39.112612 IP 159.203.29.37.22 > 198.96.85.21.65355: Flags [P.], seq 33292:33448, ack 1, win 313, length 156
20:34:39.112764 IP 159.203.29.37.22 > 198.96.85.21.65355: Flags [P.], seq 33448:33604, ack 1, win 313, length 156
20:34:39.112910 IP 159.203.29.37.22 > 198.96.85.21.65355: Flags [P.], seq 33604:33760, ack 1, win 313, length 156
20:34:39.113056 IP 159.203.29.37.22 > 198.96.85.21.65355: Flags [P.], seq 33760:33916, ack 1, win 313, length 156
20:34:39.113216 IP 159.203.29.37.22 > 198.96.85.21.65355: Flags [P.], seq 33916:34072, ack 1, win 313, length 156
20:34:39.113319 IP 198.96.85.21.65355 > 159.203.29.37.22: Flags [.], ack 30828, win 3834, length 0
20:34:39.113336 IP 198.96.85.21.65355 > 159.203.29.37.22: Flags [.], ack 31140, win 3839, length 0
20:34:39.113343 IP 198.96.85.21.65355 > 159.203.29.37.22: Flags [.], ack 31452, win 3837, length 0
20:34:39.113550 IP 159.203.29.37.22 > 198.96.85.21.65355: Flags [P.], seq 34072:34524, ack 1, win 313, length 452
20:34:39.113725 IP 159.203.29.37.22 > 198.96.85.21.65355: Flags [P.], seq 34524:34680, ack 1, win 313, length 156
20:34:39.113898 IP 159.203.29.37.22 > 198.96.85.21.65355: Flags [P.], seq 34680:34836, ack 1, win 313, length 156
20:34:39.114048 IP 159.203.29.37.22 > 198.96.85.21.65355: Flags [P.], seq 34836:34992, ack 1, win 313, length 156
20:34:39.114194 IP 159.203.29.37.22 > 198.96.85.21.65355: Flags [P.], seq 34992:35148, ack 1, win 313, length 156
20:34:39.114331 IP 159.203.29.37.22 > 198.96.85.21.65355: Flags [P.], seq 35148:35304, ack 1, win 313, length 156
20:34:39.114371 IP 198.96.85.21.65355 > 159.203.29.37.22: Flags [.], ack 31948, win 3835, length 0
20:34:39.114379 IP 198.96.85.21.65355 > 159.203.29.37.22: Flags [.], ack 32372, win 3834, length 0
20:34:39.114573 IP 159.203.29.37.22 > 198.96.85.21.65355: Flags [P.], seq 35304:35660, ack 1, win 313, length 356
20:34:39.114678 IP 198.96.85.21.65355 > 159.203.29.37.22: Flags [.], ack 32684, win 3839, length 0
20:34:39.114831 IP 159.203.29.37.22 > 198.96.85.21.65355: Flags [P.], seq 35660:35912, ack 1, win 313, length 252
20:34:39.115006 IP 159.203.29.37.22 > 198.96.85.21.65355: Flags [P.], seq 35912:36068, ack 1, win 313, length 156
20:34:39.115191 IP 159.203.29.37.22 > 198.96.85.21.65355: Flags [P.], seq 36068:36224, ack 1, win 313, length 156
20:34:39.115383 IP 159.203.29.37.22 > 198.96.85.21.65355: Flags [P.], seq 36224:36380, ack 1, win 313, length 156
20:34:39.115524 IP 159.203.29.37.22 > 198.96.85.21.65355: Flags [P.], seq 36380:36536, ack 1, win 313, length 156
20:34:39.115651 IP 159.203.29.37.22 > 198.96.85.21.65355: Flags [P.], seq 36536:36692, ack 1, win 313, length 156
20:34:39.115774 IP 198.96.85.21.65355 > 159.203.29.37.22: Flags [.], ack 33292, win 3836, length 0
20:34:39.115794 IP 198.96.85.21.65355 > 159.203.29.37.22: Flags [.], ack 33604, win 3835, length 0
20:34:39.115801 IP 198.96.85.21.65355 > 159.203.29.37.22: Flags [.], ack 33916, win 3834, length 0
20:34:39.115982 IP 159.203.29.37.22 > 198.96.85.21.65355: Flags [P.], seq 36692:36848, ack 1, win 313, length 156
20:34:39.116119 IP 159.203.29.37.22 > 198.96.85.21.65355: Flags [P.], seq 36848:37188, ack 1, win 313, length 340
20:34:39.116178 IP 159.203.29.37.22 > 198.96.85.21.65355: Flags [P.], seq 37188:37344, ack 1, win 313, length 156
20:34:39.116351 IP 159.203.29.37.22 > 198.96.85.21.65355: Flags [P.], seq 37344:37612, ack 1, win 313, length 268
20:34:39.116496 IP 159.203.29.37.22 > 198.96.85.21.65355: Flags [P.], seq 37612:37768, ack 1, win 313, length 156
20:34:39.116636 IP 159.203.29.37.22 > 198.96.85.21.65355: Flags [P.], seq 37768:37924, ack 1, win 313, length 156
20:34:39.116804 IP 159.203.29.37.22 > 198.96.85.21.65355: Flags [P.], seq 37924:38080, ack 1, win 313, length 156
20:34:39.116945 IP 198.96.85.21.65355 > 159.203.29.37.22: Flags [.], ack 34524, win 3839, length 0
20:34:39.116964 IP 198.96.85.21.65355 > 159.203.29.37.22: Flags [.], ack 34836, win 3837, length 0
20:34:39.116970 IP 198.96.85.21.65355 > 159.203.29.37.22: Flags [.], ack 35148, win 3836, length 0
20:34:39.116977 IP 198.96.85.21.65355 > 159.203.29.37.22: Flags [.], ack 35660, win 3834, length 0
20:34:39.117154 IP 159.203.29.37.22 > 198.96.85.21.65355: Flags [P.], seq 38080:38236, ack 1, win 313, length 156
20:34:39.117289 IP 159.203.29.37.22 > 198.96.85.21.65355: Flags [P.], seq 38236:38672, ack 1, win 313, length 436
20:34:39.117345 IP 159.203.29.37.22 > 198.96.85.21.65355: Flags [P.], seq 38672:38828, ack 1, win 313, length 156
20:34:39.117511 IP 159.203.29.37.22 > 198.96.85.21.65355: Flags [P.], seq 38828:39096, ack 1, win 313, length 268
20:34:39.117629 IP 198.96.85.21.65355 > 159.203.29.37.22: Flags [P.], seq 1:37, ack 35660, win 3834, length 36
20:34:39.117767 IP 159.203.29.37.22 > 198.96.85.21.65355: Flags [P.], seq 39096:39364, ack 37, win 313, length 268
20:34:39.117925 IP 159.203.29.37.22 > 198.96.85.21.65355: Flags [P.], seq 39364:39520, ack 37, win 313, length 156
20:34:39.118063 IP 198.96.85.21.65355 > 159.203.29.37.22: Flags [.], ack 35912, win 3839, length 0
20:34:39.118080 IP 198.96.85.21.65355 > 159.203.29.37.22: Flags [.], ack 36068, win 3838, length 0
20:34:39.118087 IP 198.96.85.21.65355 > 159.203.29.37.22: Flags [.], ack 36380, win 3837, length 0
20:34:39.118095 IP 198.96.85.21.65355 > 159.203.29.37.22: Flags [.], ack 36692, win 3836, length 0
20:34:39.118272 IP 159.203.29.37.22 > 198.96.85.21.65355: Flags [P.], seq 39520:39676, ack 37, win 313, length 156
20:34:39.118340 IP 159.203.29.37.22 > 198.96.85.21.65355: Flags [P.], seq 39676:40112, ack 37, win 313, length 436
20:34:39.118515 IP 159.203.29.37.22 > 198.96.85.21.65355: Flags [P.], seq 40112:40380, ack 37, win 313, length 268
20:34:39.118709 IP 159.203.29.37.22 > 198.96.85.21.65355: Flags [P.], seq 40380:40536, ack 37, win 313, length 156
20:34:39.118870 IP 159.203.29.37.22 > 198.96.85.21.65355: Flags [P.], seq 40536:40692, ack 37, win 313, length 156
20:34:39.119015 IP 159.203.29.37.22 > 198.96.85.21.65355: Flags [P.], seq 40692:40848, ack 37, win 313, length 156
20:34:39.119174 IP 159.203.29.37.22 > 198.96.85.21.65355: Flags [P.], seq 40848:41004, ack 37, win 313, length 156
20:34:39.119340 IP 198.96.85.21.65355 > 159.203.29.37.22: Flags [.], ack 37188, win 3834, length 0
20:34:39.119357 IP 198.96.85.21.65355 > 159.203.29.37.22: Flags [.], ack 37344, win 3839, length 0
20:34:39.119399 IP 198.96.85.21.65355 > 159.203.29.37.22: Flags [.], ack 37612, win 3838, length 0
20:34:39.119407 IP 198.96.85.21.65355 > 159.203.29.37.22: Flags [.], ack 37924, win 3836, length 0
20:34:39.119593 IP 159.203.29.37.22 > 198.96.85.21.65355: Flags [P.], seq 41004:41160, ack 37, win 313, length 156
20:34:39.119655 IP 159.203.29.37.22 > 198.96.85.21.65355: Flags [P.], seq 41160:41596, ack 37, win 313, length 436
20:34:39.119781 IP 159.203.29.37.22 > 198.96.85.21.65355: Flags [P.], seq 41596:41864, ack 37, win 313, length 268
20:34:39.119881 IP 159.203.29.37.22 > 198.96.85.21.65355: Flags [P.], seq 41864:42020, ack 37, win 313, length 156
20:34:39.119980 IP 159.203.29.37.22 > 198.96.85.21.65355: Flags [P.], seq 42020:42176, ack 37, win 313, length 156
20:34:39.120079 IP 159.203.29.37.22 > 198.96.85.21.65355: Flags [P.], seq 42176:42332, ack 37, win 313, length 156
20:34:39.120176 IP 159.203.29.37.22 > 198.96.85.21.65355: Flags [P.], seq 42332:42488, ack 37, win 313, length 156
20:34:39.120274 IP 159.203.29.37.22 > 198.96.85.21.65355: Flags [P.], seq 42488:42644, ack 37, win 313, length 156
20:34:39.120396 IP 159.203.29.37.22 > 198.96.85.21.65355: Flags [P.], seq 42644:42800, ack 37, win 313, length 156
20:34:39.120560 IP 159.203.29.37.22 > 198.96.85.21.65355: Flags [P.], seq 42800:42956, ack 37, win 313, length 156
20:34:39.120675 IP 159.203.29.37.22 > 198.96.85.21.65355: Flags [P.], seq 42956:43112, ack 37, win 313, length 156
20:34:39.120770 IP 198.96.85.21.65355 > 159.203.29.37.22: Flags [.], ack 38236, win 3835, length 0
20:34:39.120784 IP 198.96.85.21.65355 > 159.203.29.37.22: Flags [.], ack 38672, win 3839, length 0
20:34:39.120806 IP 198.96.85.21.65355 > 159.203.29.37.22: Flags [.], ack 38828, win 3838, length 0
20:34:39.120814 IP 198.96.85.21.65355 > 159.203.29.37.22: Flags [.], ack 39364, win 3836, length 0
20:34:39.120951 IP 159.203.29.37.22 > 198.96.85.21.65355: Flags [P.], seq 43112:43668, ack 37, win 313, length 556
20:34:39.121063 IP 159.203.29.37.22 > 198.96.85.21.65355: Flags [P.], seq 43668:43824, ack 37, win 313, length 156
20:34:39.121190 IP 198.96.85.21.65355 > 159.203.29.37.22: Flags [.], ack 39676, win 3835, length 0
20:34:39.121203 IP 198.96.85.21.65355 > 159.203.29.37.22: Flags [.], ack 40380, win 3839, length 0
20:34:39.121226 IP 159.203.29.37.22 > 198.96.85.21.65355: Flags [P.], seq 43824:43980, ack 37, win 313, length 156
20:34:39.121277 IP 198.96.85.21.65355 > 159.203.29.37.22: Flags [.], ack 40692, win 3837, length 0
20:34:39.121515 IP 159.203.29.37.22 > 198.96.85.21.65355: Flags [P.], seq 43980:44432, ack 37, win 313, length 452
20:34:39.121609 IP 198.96.85.21.65355 > 159.203.29.37.22: Flags [.], ack 41004, win 3836, length 0
20:34:39.121730 IP 159.203.29.37.22 > 198.96.85.21.65355: Flags [P.], seq 44432:44684, ack 37, win 313, length 252
20:34:39.121859 IP 159.203.29.37.22 > 198.96.85.21.65355: Flags [P.], seq 44684:44840, ack 37, win 313, length 156
20:34:39.121963 IP 159.203.29.37.22 > 198.96.85.21.65355: Flags [P.], seq 44840:44996, ack 37, win 313, length 156
20:34:39.122076 IP 159.203.29.37.22 > 198.96.85.21.65355: Flags [P.], seq 44996:45152, ack 37, win 313, length 156
20:34:39.122189 IP 159.203.29.37.22 > 198.96.85.21.65355: Flags [P.], seq 45152:45308, ack 37, win 313, length 156
20:34:39.122294 IP 159.203.29.37.22 > 198.96.85.21.65355: Flags [P.], seq 45308:45464, ack 37, win 313, length 156
20:34:39.122455 IP 159.203.29.37.22 > 198.96.85.21.65355: Flags [P.], seq 45464:45620, ack 37, win 313, length 156
20:34:39.122665 IP 159.203.29.37.22 > 198.96.85.21.65355: Flags [P.], seq 45620:45776, ack 37, win 313, length 156
20:34:39.122791 IP 159.203.29.37.22 > 198.96.85.21.65355: Flags [P.], seq 45776:45932, ack 37, win 313, length 156
20:34:39.122900 IP 159.203.29.37.22 > 198.96.85.21.65355: Flags [P.], seq 45932:46088, ack 37, win 313, length 156
20:34:39.123011 IP 159.203.29.37.22 > 198.96.85.21.65355: Flags [P.], seq 46088:46244, ack 37, win 313, length 156
20:34:39.123122 IP 159.203.29.37.22 > 198.96.85.21.65355: Flags [P.], seq 46244:46400, ack 37, win 313, length 156
20:34:39.123234 IP 198.96.85.21.65355 > 159.203.29.37.22: Flags [.], ack 41596, win 3834, length 0
20:34:39.123248 IP 198.96.85.21.65355 > 159.203.29.37.22: Flags [.], ack 42020, win 3839, length 0
20:34:39.123255 IP 198.96.85.21.65355 > 159.203.29.37.22: Flags [.], ack 42332, win 3837, length 0
20:34:39.123422 IP 198.96.85.21.65355 > 159.203.29.37.22: Flags [.], ack 42644, win 3836, length 0
20:34:39.123455 IP 159.203.29.37.22 > 198.96.85.21.65355: Flags [P.], seq 46400:46556, ack 37, win 313, length 156
20:34:39.123504 IP 159.203.29.37.22 > 198.96.85.21.65355: Flags [P.], seq 46556:46896, ack 37, win 313, length 340
20:34:39.123647 IP 159.203.29.37.22 > 198.96.85.21.65355: Flags [P.], seq 46896:47268, ack 37, win 313, length 372
20:34:39.123714 IP 198.96.85.21.65355 > 159.203.29.37.22: Flags [.], ack 42956, win 3835, length 0
20:34:39.123725 IP 198.96.85.21.65355 > 159.203.29.37.22: Flags [.], ack 43668, win 3839, length 0
20:34:39.123729 IP 198.96.85.21.65355 > 159.203.29.37.22: Flags [.], ack 43980, win 3837, length 0
20:34:39.123856 IP 159.203.29.37.22 > 198.96.85.21.65355: Flags [P.], seq 47268:47720, ack 37, win 313, length 452
20:34:39.123964 IP 159.203.29.37.22 > 198.96.85.21.65355: Flags [P.], seq 47720:47876, ack 37, win 313, length 156
20:34:39.124146 IP 159.203.29.37.22 > 198.96.85.21.65355: Flags [P.], seq 47876:48032, ack 37, win 313, length 156
20:34:39.124321 IP 159.203.29.37.22 > 198.96.85.21.65355: Flags [P.], seq 48032:48188, ack 37, win 313, length 156
20:34:39.124490 IP 159.203.29.37.22 > 198.96.85.21.65355: Flags [P.], seq 48188:48344, ack 37, win 313, length 156
20:34:39.124586 IP 159.203.29.37.22 > 198.96.85.21.65355: Flags [P.], seq 48344:48500, ack 37, win 313, length 156
20:34:39.124692 IP 159.203.29.37.22 > 198.96.85.21.65355: Flags [P.], seq 48500:48656, ack 37, win 313, length 156
20:34:39.124792 IP 159.203.29.37.22 > 198.96.85.21.65355: Flags [P.], seq 48656:48812, ack 37, win 313, length 156
20:34:39.124890 IP 159.203.29.37.22 > 198.96.85.21.65355: Flags [P.], seq 48812:48968, ack 37, win 313, length 156
20:34:39.124988 IP 159.203.29.37.22 > 198.96.85.21.65355: Flags [P.], seq 48968:49124, ack 37, win 313, length 156
20:34:39.125085 IP 159.203.29.37.22 > 198.96.85.21.65355: Flags [P.], seq 49124:49280, ack 37, win 313, length 156
20:34:39.125181 IP 159.203.29.37.22 > 198.96.85.21.65355: Flags [P.], seq 49280:49436, ack 37, win 313, length 156
20:34:39.125278 IP 159.203.29.37.22 > 198.96.85.21.65355: Flags [P.], seq 49436:49592, ack 37, win 313, length 156
20:34:39.125378 IP 159.203.29.37.22 > 198.96.85.21.65355: Flags [P.], seq 49592:49748, ack 37, win 313, length 156
20:34:39.125484 IP 159.203.29.37.22 > 198.96.85.21.65355: Flags [P.], seq 49748:49904, ack 37, win 313, length 156
20:34:39.125622 IP 159.203.29.37.22 > 198.96.85.21.65355: Flags [P.], seq 49904:50060, ack 37, win 313, length 156
20:34:39.125789 IP 159.203.29.37.22 > 198.96.85.21.65355: Flags [P.], seq 50060:50216, ack 37, win 313, length 156
20:34:39.125968 IP 159.203.29.37.22 > 198.96.85.21.65355: Flags [P.], seq 50216:50372, ack 37, win 313, length 156
20:34:39.126128 IP 159.203.29.37.22 > 198.96.85.21.65355: Flags [P.], seq 50372:50528, ack 37, win 313, length 156
20:34:39.126244 IP 159.203.29.37.22 > 198.96.85.21.65355: Flags [P.], seq 50528:50684, ack 37, win 313, length 156
20:34:39.126346 IP 159.203.29.37.22 > 198.96.85.21.65355: Flags [P.], seq 50684:50840, ack 37, win 313, length 156
20:34:39.126457 IP 159.203.29.37.22 > 198.96.85.21.65355: Flags [P.], seq 50840:50996, ack 37, win 313, length 156
20:34:39.126644 IP 159.203.29.37.22 > 198.96.85.21.65355: Flags [P.], seq 50996:51152, ack 37, win 313, length 156
20:34:39.126754 IP 159.203.29.37.22 > 198.96.85.21.65355: Flags [P.], seq 51152:51308, ack 37, win 313, length 156
20:34:39.126857 IP 159.203.29.37.22 > 198.96.85.21.65355: Flags [P.], seq 51308:51464, ack 37, win 313, length 156
20:34:39.126957 IP 159.203.29.37.22 > 198.96.85.21.65355: Flags [P.], seq 51464:51620, ack 37, win 313, length 156
