root@ubuntu-s-1vcpu-1gb-tor1-01:~# tcpdump -i eth0
tcpdump: verbose output suppressed, use -v or -vv for full protocol decode
listening on eth0, link-type EN10MB (Ethernet), capture size 262144 bytes
20:23:58.000878 IP ubuntu-s-1vcpu-1gb-tor1-01.ssh > 198.96.85.21.65355: Flags [P.], seq 2047187554:2047187662, ack 3366056106, win 313, length 108
20:23:58.000973 IP ubuntu-s-1vcpu-1gb-tor1-01.ssh > 198.96.85.21.65355: Flags [P.], seq 108:144, ack 1, win 313, length 36
20:23:58.001060 IP ubuntu-s-1vcpu-1gb-tor1-01.ssh > 198.96.85.21.65355: Flags [P.], seq 144:252, ack 1, win 313, length 108
20:23:58.001128 IP ubuntu-s-1vcpu-1gb-tor1-01.ssh > 198.96.85.21.65355: Flags [P.], seq 252:288, ack 1, win 313, length 36
20:23:58.003120 IP ubuntu-s-1vcpu-1gb-tor1-01.ssh > 198.96.85.21.65355: Flags [P.], seq 288:468, ack 1, win 313, length 180
20:23:58.003218 IP ubuntu-s-1vcpu-1gb-tor1-01.ssh > 198.96.85.21.65355: Flags [P.], seq 468:504, ack 1, win 313, length 36
20:23:58.003322 IP ubuntu-s-1vcpu-1gb-tor1-01.ssh > 198.96.85.21.65355: Flags [P.], seq 504:660, ack 1, win 313, length 156
20:23:58.003421 IP ubuntu-s-1vcpu-1gb-tor1-01.ssh > 198.96.85.21.65355: Flags [P.], seq 660:696, ack 1, win 313, length 36
20:23:58.003518 IP ubuntu-s-1vcpu-1gb-tor1-01.ssh > 198.96.85.21.65355: Flags [P.], seq 696:860, ack 1, win 313, length 164
20:23:58.005349 IP 198.96.85.21.65355 > ubuntu-s-1vcpu-1gb-tor1-01.ssh: Flags [.], ack 108, win 256, length 0
20:23:58.005379 IP ubuntu-s-1vcpu-1gb-tor1-01.ssh > 198.96.85.21.65355: Flags [P.], seq 860:2072, ack 1, win 313, length 1212
20:23:58.005401 IP 198.96.85.21.65355 > ubuntu-s-1vcpu-1gb-tor1-01.ssh: Flags [.], ack 252, win 255, length 0
20:23:58.005552 IP ubuntu-s-1vcpu-1gb-tor1-01.ssh > 198.96.85.21.65355: Flags [P.], seq 2072:2220, ack 1, win 313, length 148
20:23:58.005668 IP ubuntu-s-1vcpu-1gb-tor1-01.ssh > 198.96.85.21.65355: Flags [P.], seq 2220:2256, ack 1, win 313, length 36
20:23:58.005768 IP ubuntu-s-1vcpu-1gb-tor1-01.ssh > 198.96.85.21.65355: Flags [P.], seq 2256:2420, ack 1, win 313, length 164
20:23:58.005837 IP ubuntu-s-1vcpu-1gb-tor1-01.ssh > 198.96.85.21.65355: Flags [P.], seq 2420:2456, ack 1, win 313, length 36
20:23:58.005927 IP ubuntu-s-1vcpu-1gb-tor1-01.ssh > 198.96.85.21.65355: Flags [P.], seq 2456:2604, ack 1, win 313, length 148
20:23:58.006010 IP 198.96.85.21.65355 > ubuntu-s-1vcpu-1gb-tor1-01.ssh: Flags [.], ack 468, win 254, length 0
20:23:58.006142 IP ubuntu-s-1vcpu-1gb-tor1-01.ssh > 198.96.85.21.65355: Flags [P.], seq 2640:2804, ack 1, win 313, length 164
20:23:58.006297 IP ubuntu-s-1vcpu-1gb-tor1-01.ssh > 198.96.85.21.65355: Flags [P.], seq 2840:3004, ack 1, win 313, length 164
20:23:58.006451 IP ubuntu-s-1vcpu-1gb-tor1-01.ssh > 198.96.85.21.65355: Flags [P.], seq 3040:3204, ack 1, win 313, length 164
20:23:58.006794 IP ubuntu-s-1vcpu-1gb-tor1-01.ssh > 198.96.85.21.65355: Flags [P.], seq 3240:3404, ack 1, win 313, length 164
20:23:58.006960 IP ubuntu-s-1vcpu-1gb-tor1-01.ssh > 198.96.85.21.65355: Flags [P.], seq 3440:3604, ack 1, win 313, length 164
20:23:58.007130 IP ubuntu-s-1vcpu-1gb-tor1-01.ssh > 198.96.85.21.65355: Flags [P.], seq 3640:3788, ack 1, win 313, length 148
20:23:58.007285 IP ubuntu-s-1vcpu-1gb-tor1-01.ssh > 198.96.85.21.65355: Flags [P.], seq 3824:3988, ack 1, win 313, length 164
20:23:58.009722 IP 198.96.85.21.65355 > ubuntu-s-1vcpu-1gb-tor1-01.ssh: Flags [.], ack 2220, win 258, length 0
20:23:58.009751 IP ubuntu-s-1vcpu-1gb-tor1-01.ssh > 198.96.85.21.65355: Flags [P.], seq 3988:5224, ack 1, win 313, length 1236
20:23:58.009774 IP 198.96.85.21.65355 > ubuntu-s-1vcpu-1gb-tor1-01.ssh: Flags [.], ack 2420, win 258, length 0
20:23:58.009894 IP ubuntu-s-1vcpu-1gb-tor1-01.ssh > 198.96.85.21.65355: Flags [P.], seq 5224:5372, ack 1, win 313, length 148
20:23:58.009967 IP 198.96.85.21.65355 > ubuntu-s-1vcpu-1gb-tor1-01.ssh: Flags [.], ack 2604, win 257, length 0
20:23:58.010011 IP ubuntu-s-1vcpu-1gb-tor1-01.ssh > 198.96.85.21.65355: Flags [P.], seq 5372:5408, ack 1, win 313, length 36
20:23:58.010113 IP ubuntu-s-1vcpu-1gb-tor1-01.ssh > 198.96.85.21.65355: Flags [P.], seq 5408:5572, ack 1, win 313, length 164
20:23:58.010146 IP 198.96.85.21.65355 > ubuntu-s-1vcpu-1gb-tor1-01.ssh: Flags [.], ack 2804, win 256, length 0
20:23:58.010316 IP ubuntu-s-1vcpu-1gb-tor1-01.ssh > 198.96.85.21.65355: Flags [P.], seq 5608:5756, ack 1, win 313, length 148
20:23:58.010519 IP ubuntu-s-1vcpu-1gb-tor1-01.ssh > 198.96.85.21.65355: Flags [P.], seq 5792:5956, ack 1, win 313, length 164
20:23:58.010690 IP 198.96.85.21.65355 > ubuntu-s-1vcpu-1gb-tor1-01.ssh: Flags [.], ack 3604, win 258, length 0
20:23:58.010970 IP ubuntu-s-1vcpu-1gb-tor1-01.ssh > 198.96.85.21.65355: Flags [P.], seq 6176:6340, ack 1, win 313, length 164
20:23:58.011119 IP ubuntu-s-1vcpu-1gb-tor1-01.ssh > 198.96.85.21.65355: Flags [P.], seq 6376:6540, ack 1, win 313, length 164
20:23:58.011275 IP ubuntu-s-1vcpu-1gb-tor1-01.ssh > 198.96.85.21.65355: Flags [P.], seq 6576:6724, ack 1, win 313, length 148
20:23:58.011465 IP ubuntu-s-1vcpu-1gb-tor1-01.ssh > 198.96.85.21.65355: Flags [P.], seq 6760:6924, ack 1, win 313, length 164
20:23:58.011624 IP ubuntu-s-1vcpu-1gb-tor1-01.ssh > 198.96.85.21.65355: Flags [P.], seq 6960:7124, ack 1, win 313, length 164
20:23:58.011777 IP ubuntu-s-1vcpu-1gb-tor1-01.ssh > 198.96.85.21.65355: Flags [P.], seq 7160:7308, ack 1, win 313, length 148
20:23:58.011940 IP ubuntu-s-1vcpu-1gb-tor1-01.ssh > 198.96.85.21.65355: Flags [P.], seq 7344:7508, ack 1, win 313, length 164
20:23:58.012100 IP ubuntu-s-1vcpu-1gb-tor1-01.ssh > 198.96.85.21.65355: Flags [P.], seq 7544:7708, ack 1, win 313, length 164
20:23:58.012257 IP ubuntu-s-1vcpu-1gb-tor1-01.ssh > 198.96.85.21.65355: Flags [P.], seq 7744:7908, ack 1, win 313, length 164
20:23:58.012417 IP ubuntu-s-1vcpu-1gb-tor1-01.ssh > 198.96.85.21.65355: Flags [P.], seq 7944:8108, ack 1, win 313, length 164
20:23:58.012535 IP ubuntu-s-1vcpu-1gb-tor1-01.ssh > 198.96.85.21.65355: Flags [P.], seq 8108:8400, ack 1, win 313, length 292
20:23:58.012704 IP ubuntu-s-1vcpu-1gb-tor1-01.ssh > 198.96.85.21.65355: Flags [P.], seq 8400:9076, ack 1, win 313, length 676
20:23:58.012814 IP ubuntu-s-1vcpu-1gb-tor1-01.ssh > 198.96.85.21.65355: Flags [P.], seq 9076:9240, ack 1, win 313, length 164
20:23:58.012916 IP ubuntu-s-1vcpu-1gb-tor1-01.ssh > 198.96.85.21.65355: Flags [P.], seq 9240:9404, ack 1, win 313, length 164
20:23:58.013017 IP ubuntu-s-1vcpu-1gb-tor1-01.ssh > 198.96.85.21.65355: Flags [P.], seq 9404:9568, ack 1, win 313, length 164
20:23:58.013138 IP ubuntu-s-1vcpu-1gb-tor1-01.ssh > 198.96.85.21.65355: Flags [P.], seq 9568:9732, ack 1, win 313, length 164
20:23:58.013240 IP ubuntu-s-1vcpu-1gb-tor1-01.ssh > 198.96.85.21.65355: Flags [P.], seq 9732:9896, ack 1, win 313, length 164
20:23:58.013340 IP ubuntu-s-1vcpu-1gb-tor1-01.ssh > 198.96.85.21.65355: Flags [P.], seq 9896:10060, ack 1, win 313, length 164
20:23:58.013488 IP ubuntu-s-1vcpu-1gb-tor1-01.ssh > 198.96.85.21.65355: Flags [P.], seq 10060:10224, ack 1, win 313, length 164
20:23:58.017247 IP 198.96.85.21.65355 > ubuntu-s-1vcpu-1gb-tor1-01.ssh: Flags [.], ack 5372, win 258, length 0
20:23:58.017276 IP ubuntu-s-1vcpu-1gb-tor1-01.ssh > 198.96.85.21.65355: Flags [P.], seq 10224:10388, ack 1, win 313, length 164
20:23:58.017300 IP 198.96.85.21.65355 > ubuntu-s-1vcpu-1gb-tor1-01.ssh: Flags [.], ack 5572, win 258, length 0
20:23:58.017489 IP ubuntu-s-1vcpu-1gb-tor1-01.ssh > 198.96.85.21.65355: Flags [P.], seq 10388:10776, ack 1, win 313, length 388
20:23:58.017543 IP 198.96.85.21.65355 > ubuntu-s-1vcpu-1gb-tor1-01.ssh: Flags [.], ack 5756, win 257, length 0
20:23:58.017555 IP 198.96.85.21.65355 > ubuntu-s-1vcpu-1gb-tor1-01.ssh: Flags [.], ack 5956, win 256, length 0
20:23:58.017560 IP 198.96.85.21.65355 > ubuntu-s-1vcpu-1gb-tor1-01.ssh: Flags [.], ack 6140, win 255, length 0
20:23:58.017715 IP ubuntu-s-1vcpu-1gb-tor1-01.ssh > 198.96.85.21.65355: Flags [P.], seq 10776:11276, ack 1, win 313, length 500
20:23:58.017831 IP ubuntu-s-1vcpu-1gb-tor1-01.ssh > 198.96.85.21.65355: Flags [P.], seq 11276:11440, ack 1, win 313, length 164
20:23:58.017965 IP ubuntu-s-1vcpu-1gb-tor1-01.ssh > 198.96.85.21.65355: Flags [P.], seq 11440:11604, ack 1, win 313, length 164
20:23:58.018071 IP ubuntu-s-1vcpu-1gb-tor1-01.ssh > 198.96.85.21.65355: Flags [P.], seq 11604:11768, ack 1, win 313, length 164
20:23:58.018173 IP ubuntu-s-1vcpu-1gb-tor1-01.ssh > 198.96.85.21.65355: Flags [P.], seq 11768:11932, ack 1, win 313, length 164
20:23:58.018274 IP ubuntu-s-1vcpu-1gb-tor1-01.ssh > 198.96.85.21.65355: Flags [P.], seq 11932:12096, ack 1, win 313, length 164
20:23:58.018375 IP ubuntu-s-1vcpu-1gb-tor1-01.ssh > 198.96.85.21.65355: Flags [P.], seq 12096:12260, ack 1, win 313, length 164
20:23:58.018475 IP ubuntu-s-1vcpu-1gb-tor1-01.ssh > 198.96.85.21.65355: Flags [P.], seq 12260:12424, ack 1, win 313, length 164
20:23:58.018701 IP ubuntu-s-1vcpu-1gb-tor1-01.ssh > 198.96.85.21.65355: Flags [P.], seq 12424:12588, ack 1, win 313, length 164
20:23:58.018851 IP ubuntu-s-1vcpu-1gb-tor1-01.ssh > 198.96.85.21.65355: Flags [P.], seq 12588:12752, ack 1, win 313, length 164
20:23:58.018957 IP ubuntu-s-1vcpu-1gb-tor1-01.ssh > 198.96.85.21.65355: Flags [P.], seq 12752:12916, ack 1, win 313, length 164
20:23:58.020432 IP 198.96.85.21.65355 > ubuntu-s-1vcpu-1gb-tor1-01.ssh: Flags [.], ack 6340, win 255, length 0
20:23:58.020459 IP ubuntu-s-1vcpu-1gb-tor1-01.ssh > 198.96.85.21.65355: Flags [P.], seq 12916:13080, ack 1, win 313, length 164
20:23:58.020484 IP 198.96.85.21.65355 > ubuntu-s-1vcpu-1gb-tor1-01.ssh: Flags [.], ack 6540, win 254, length 0
20:23:58.020491 IP 198.96.85.21.65355 > ubuntu-s-1vcpu-1gb-tor1-01.ssh: Flags [.], ack 6724, win 258, length 0
20:23:58.020594 IP 198.96.85.21.65355 > ubuntu-s-1vcpu-1gb-tor1-01.ssh: Flags [.], ack 6924, win 258, length 0
20:23:58.020610 IP 198.96.85.21.65355 > ubuntu-s-1vcpu-1gb-tor1-01.ssh: Flags [.], ack 7124, win 257, length 0
20:23:58.020617 IP 198.96.85.21.65355 > ubuntu-s-1vcpu-1gb-tor1-01.ssh: Flags [.], ack 7308, win 256, length 0
20:23:58.020732 IP 198.96.85.21.65355 > ubuntu-s-1vcpu-1gb-tor1-01.ssh: Flags [.], ack 10060, win 257, length 0
20:23:58.020951 IP ubuntu-s-1vcpu-1gb-tor1-01.ssh > 198.96.85.21.65355: Flags [P.], seq 13080:14028, ack 1, win 313, length 948
20:23:58.021098 IP ubuntu-s-1vcpu-1gb-tor1-01.ssh > 198.96.85.21.65355: Flags [P.], seq 14028:14192, ack 1, win 313, length 164
20:23:58.021212 IP ubuntu-s-1vcpu-1gb-tor1-01.ssh > 198.96.85.21.65355: Flags [P.], seq 14192:14356, ack 1, win 313, length 164
20:23:58.021315 IP ubuntu-s-1vcpu-1gb-tor1-01.ssh > 198.96.85.21.65355: Flags [P.], seq 14356:14520, ack 1, win 313, length 164
20:23:58.021439 IP ubuntu-s-1vcpu-1gb-tor1-01.ssh > 198.96.85.21.65355: Flags [P.], seq 14520:14684, ack 1, win 313, length 164
20:23:58.021543 IP ubuntu-s-1vcpu-1gb-tor1-01.ssh > 198.96.85.21.65355: Flags [P.], seq 14684:14848, ack 1, win 313, length 164
20:23:58.021660 IP ubuntu-s-1vcpu-1gb-tor1-01.ssh > 198.96.85.21.65355: Flags [P.], seq 14848:15012, ack 1, win 313, length 164
20:23:58.021787 IP ubuntu-s-1vcpu-1gb-tor1-01.ssh > 198.96.85.21.65355: Flags [P.], seq 15012:15176, ack 1, win 313, length 164
20:23:58.021925 IP ubuntu-s-1vcpu-1gb-tor1-01.ssh > 198.96.85.21.65355: Flags [P.], seq 15176:15340, ack 1, win 313, length 164
20:23:58.022064 IP ubuntu-s-1vcpu-1gb-tor1-01.ssh > 198.96.85.21.65355: Flags [P.], seq 15340:15504, ack 1, win 313, length 164
20:23:58.022220 IP ubuntu-s-1vcpu-1gb-tor1-01.ssh > 198.96.85.21.65355: Flags [P.], seq 15504:15668, ack 1, win 313, length 164
20:23:58.022297 IP 198.96.85.21.65355 > ubuntu-s-1vcpu-1gb-tor1-01.ssh: Flags [.], ack 11276, win 258, length 0
20:23:58.022315 IP 198.96.85.21.65355 > ubuntu-s-1vcpu-1gb-tor1-01.ssh: Flags [.], ack 11604, win 257, length 0
20:23:58.022323 IP 198.96.85.21.65355 > ubuntu-s-1vcpu-1gb-tor1-01.ssh: Flags [.], ack 11932, win 256, length 0
20:23:58.022329 IP 198.96.85.21.65355 > ubuntu-s-1vcpu-1gb-tor1-01.ssh: Flags [.], ack 12260, win 255, length 0
20:23:58.022393 IP 198.96.85.21.65355 > ubuntu-s-1vcpu-1gb-tor1-01.ssh: Flags [.], ack 12588, win 258, length 0
20:23:58.022462 IP 198.96.85.21.65355 > ubuntu-s-1vcpu-1gb-tor1-01.ssh: Flags [.], ack 12916, win 257, length 0
20:23:58.022753 IP ubuntu-s-1vcpu-1gb-tor1-01.ssh > 198.96.85.21.65355: Flags [P.], seq 15668:16512, ack 1, win 313, length 844
20:23:58.022913 IP ubuntu-s-1vcpu-1gb-tor1-01.ssh > 198.96.85.21.65355: Flags [P.], seq 16512:16676, ack 1, win 313, length 164
20:23:58.023038 IP ubuntu-s-1vcpu-1gb-tor1-01.ssh > 198.96.85.21.65355: Flags [P.], seq 16676:16840, ack 1, win 313, length 164
20:23:58.023143 IP ubuntu-s-1vcpu-1gb-tor1-01.ssh > 198.96.85.21.65355: Flags [P.], seq 16840:17004, ack 1, win 313, length 164
20:23:58.023243 IP ubuntu-s-1vcpu-1gb-tor1-01.ssh > 198.96.85.21.65355: Flags [P.], seq 17004:17168, ack 1, win 313, length 164
20:23:58.023356 IP ubuntu-s-1vcpu-1gb-tor1-01.ssh > 198.96.85.21.65355: Flags [P.], seq 17168:17332, ack 1, win 313, length 164
20:23:58.023557 IP ubuntu-s-1vcpu-1gb-tor1-01.ssh > 198.96.85.21.65355: Flags [P.], seq 17332:17496, ack 1, win 313, length 164
20:23:58.023687 IP ubuntu-s-1vcpu-1gb-tor1-01.ssh > 198.96.85.21.65355: Flags [P.], seq 17496:17660, ack 1, win 313, length 164
20:23:58.023790 IP ubuntu-s-1vcpu-1gb-tor1-01.ssh > 198.96.85.21.65355: Flags [P.], seq 17660:17824, ack 1, win 313, length 164
20:23:58.023897 IP ubuntu-s-1vcpu-1gb-tor1-01.ssh > 198.96.85.21.65355: Flags [P.], seq 17824:17988, ack 1, win 313, length 164
20:23:58.023996 IP ubuntu-s-1vcpu-1gb-tor1-01.ssh > 198.96.85.21.65355: Flags [P.], seq 17988:18152, ack 1, win 313, length 164
20:23:58.024095 IP ubuntu-s-1vcpu-1gb-tor1-01.ssh > 198.96.85.21.65355: Flags [P.], seq 18152:18316, ack 1, win 313, length 164
20:23:58.024190 IP ubuntu-s-1vcpu-1gb-tor1-01.ssh > 198.96.85.21.65355: Flags [P.], seq 18316:18480, ack 1, win 313, length 164
20:23:58.024285 IP ubuntu-s-1vcpu-1gb-tor1-01.ssh > 198.96.85.21.65355: Flags [P.], seq 18480:18644, ack 1, win 313, length 164
20:23:58.024380 IP ubuntu-s-1vcpu-1gb-tor1-01.ssh > 198.96.85.21.65355: Flags [P.], seq 18644:18808, ack 1, win 313, length 164
20:23:58.024476 IP ubuntu-s-1vcpu-1gb-tor1-01.ssh > 198.96.85.21.65355: Flags [P.], seq 18808:18972, ack 1, win 313, length 164
20:23:58.024570 IP ubuntu-s-1vcpu-1gb-tor1-01.ssh > 198.96.85.21.65355: Flags [P.], seq 18972:19136, ack 1, win 313, length 164
20:23:58.024664 IP ubuntu-s-1vcpu-1gb-tor1-01.ssh > 198.96.85.21.65355: Flags [P.], seq 19136:19300, ack 1, win 313, length 164
20:23:58.024770 IP ubuntu-s-1vcpu-1gb-tor1-01.ssh > 198.96.85.21.65355: Flags [P.], seq 19300:19464, ack 1, win 313, length 164
20:23:58.024815 IP 198.96.85.21.65355 > ubuntu-s-1vcpu-1gb-tor1-01.ssh: Flags [.], ack 14028, win 258, length 0
20:23:58.024828 IP 198.96.85.21.65355 > ubuntu-s-1vcpu-1gb-tor1-01.ssh: Flags [.], ack 14356, win 257, length 0
20:23:58.024832 IP 198.96.85.21.65355 > ubuntu-s-1vcpu-1gb-tor1-01.ssh: Flags [.], ack 14684, win 256, length 0
20:23:58.024920 IP 198.96.85.21.65355 > ubuntu-s-1vcpu-1gb-tor1-01.ssh: Flags [.], ack 15012, win 255, length 0
20:23:58.024926 IP 198.96.85.21.65355 > ubuntu-s-1vcpu-1gb-tor1-01.ssh: Flags [.], ack 15340, win 258, length 0
20:23:58.025036 IP ubuntu-s-1vcpu-1gb-tor1-01.ssh > 198.96.85.21.65355: Flags [P.], seq 19464:20196, ack 1, win 313, length 732
20:23:58.025149 IP ubuntu-s-1vcpu-1gb-tor1-01.ssh > 198.96.85.21.65355: Flags [P.], seq 20196:20360, ack 1, win 313, length 164
20:23:58.025223 IP 198.96.85.21.65355 > ubuntu-s-1vcpu-1gb-tor1-01.ssh: Flags [.], ack 15668, win 257, length 0
20:23:58.025313 IP ubuntu-s-1vcpu-1gb-tor1-01.ssh > 198.96.85.21.65355: Flags [P.], seq 20360:20636, ack 1, win 313, length 276
20:23:58.025419 IP ubuntu-s-1vcpu-1gb-tor1-01.ssh > 198.96.85.21.65355: Flags [P.], seq 20636:20800, ack 1, win 313, length 164
20:23:58.025520 IP ubuntu-s-1vcpu-1gb-tor1-01.ssh > 198.96.85.21.65355: Flags [P.], seq 20800:20964, ack 1, win 313, length 164
20:23:58.025546 IP 198.96.85.21.65355 > ubuntu-s-1vcpu-1gb-tor1-01.ssh: Flags [P.], seq 1:37, ack 15668, win 257, length 36
20:23:58.025677 IP ubuntu-s-1vcpu-1gb-tor1-01.ssh > 198.96.85.21.65355: Flags [P.], seq 20964:21256, ack 37, win 313, length 292
20:23:58.025785 IP ubuntu-s-1vcpu-1gb-tor1-01.ssh > 198.96.85.21.65355: Flags [P.], seq 21256:21420, ack 37, win 313, length 164
20:23:58.025888 IP ubuntu-s-1vcpu-1gb-tor1-01.ssh > 198.96.85.21.65355: Flags [P.], seq 21420:21584, ack 37, win 313, length 164
20:23:58.025986 IP ubuntu-s-1vcpu-1gb-tor1-01.ssh > 198.96.85.21.65355: Flags [P.], seq 21584:21748, ack 37, win 313, length 164
20:23:58.026080 IP ubuntu-s-1vcpu-1gb-tor1-01.ssh > 198.96.85.21.65355: Flags [P.], seq 21748:21912, ack 37, win 313, length 164
20:23:58.026175 IP ubuntu-s-1vcpu-1gb-tor1-01.ssh > 198.96.85.21.65355: Flags [P.], seq 21912:22076, ack 37, win 313, length 164
20:23:58.026270 IP ubuntu-s-1vcpu-1gb-tor1-01.ssh > 198.96.85.21.65355: Flags [P.], seq 22076:22240, ack 37, win 313, length 164
20:23:58.026365 IP ubuntu-s-1vcpu-1gb-tor1-01.ssh > 198.96.85.21.65355: Flags [P.], seq 22240:22404, ack 37, win 313, length 164
20:23:58.026459 IP ubuntu-s-1vcpu-1gb-tor1-01.ssh > 198.96.85.21.65355: Flags [P.], seq 22404:22568, ack 37, win 313, length 164
20:23:58.026556 IP ubuntu-s-1vcpu-1gb-tor1-01.ssh > 198.96.85.21.65355: Flags [P.], seq 22568:22732, ack 37, win 313, length 164
20:23:58.026687 IP ubuntu-s-1vcpu-1gb-tor1-01.ssh > 198.96.85.21.65355: Flags [P.], seq 22732:22896, ack 37, win 313, length 164
20:23:58.026789 IP ubuntu-s-1vcpu-1gb-tor1-01.ssh > 198.96.85.21.65355: Flags [P.], seq 22896:23060, ack 37, win 313, length 164
20:23:58.026884 IP ubuntu-s-1vcpu-1gb-tor1-01.ssh > 198.96.85.21.65355: Flags [P.], seq 23060:23224, ack 37, win 313, length 164
20:23:58.026980 IP ubuntu-s-1vcpu-1gb-tor1-01.ssh > 198.96.85.21.65355: Flags [P.], seq 23224:23388, ack 37, win 313, length 164
20:23:58.027076 IP ubuntu-s-1vcpu-1gb-tor1-01.ssh > 198.96.85.21.65355: Flags [P.], seq 23388:23552, ack 37, win 313, length 164
20:23:58.027175 IP ubuntu-s-1vcpu-1gb-tor1-01.ssh > 198.96.85.21.65355: Flags [P.], seq 23552:23716, ack 37, win 313, length 164
20:23:58.027269 IP ubuntu-s-1vcpu-1gb-tor1-01.ssh > 198.96.85.21.65355: Flags [P.], seq 23716:23880, ack 37, win 313, length 164
20:23:58.027399 IP ubuntu-s-1vcpu-1gb-tor1-01.ssh > 198.96.85.21.65355: Flags [P.], seq 23880:24044, ack 37, win 313, length 164
20:23:58.027508 IP ubuntu-s-1vcpu-1gb-tor1-01.ssh > 198.96.85.21.65355: Flags [P.], seq 24044:24208, ack 37, win 313, length 164
20:23:58.027552 IP 198.96.85.21.65355 > ubuntu-s-1vcpu-1gb-tor1-01.ssh: Flags [.], ack 16676, win 258, length 0
20:23:58.027559 IP 198.96.85.21.65355 > ubuntu-s-1vcpu-1gb-tor1-01.ssh: Flags [.], ack 17004, win 257, length 0
20:23:58.027561 IP 198.96.85.21.65355 > ubuntu-s-1vcpu-1gb-tor1-01.ssh: Flags [.], ack 17332, win 256, length 0
20:23:58.027564 IP 198.96.85.21.65355 > ubuntu-s-1vcpu-1gb-tor1-01.ssh: Flags [.], ack 17660, win 255, length 0
20:23:58.027743 IP ubuntu-s-1vcpu-1gb-tor1-01.ssh > 198.96.85.21.65355: Flags [P.], seq 24208:24828, ack 37, win 313, length 620
20:23:58.027765 IP 198.96.85.21.65355 > ubuntu-s-1vcpu-1gb-tor1-01.ssh: Flags [.], ack 17988, win 258, length 0
20:23:58.027813 IP 198.96.85.21.65355 > ubuntu-s-1vcpu-1gb-tor1-01.ssh: Flags [.], ack 18316, win 257, length 0
20:23:58.027822 IP 198.96.85.21.65355 > ubuntu-s-1vcpu-1gb-tor1-01.ssh: Flags [.], ack 18644, win 256, length 0
20:23:58.027826 IP 198.96.85.21.65355 > ubuntu-s-1vcpu-1gb-tor1-01.ssh: Flags [.], ack 18972, win 255, length 0
20:23:58.027872 IP 198.96.85.21.65355 > ubuntu-s-1vcpu-1gb-tor1-01.ssh: Flags [.], ack 19300, win 258, length 0
20:23:58.028025 IP ubuntu-s-1vcpu-1gb-tor1-01.ssh > 198.96.85.21.65355: Flags [P.], seq 24828:25560, ack 37, win 313, length 732
20:23:58.028135 IP ubuntu-s-1vcpu-1gb-tor1-01.ssh > 198.96.85.21.65355: Flags [P.], seq 25560:25724, ack 37, win 313, length 164
20:23:58.028235 IP ubuntu-s-1vcpu-1gb-tor1-01.ssh > 198.96.85.21.65355: Flags [P.], seq 25724:25888, ack 37, win 313, length 164
20:23:58.028333 IP ubuntu-s-1vcpu-1gb-tor1-01.ssh > 198.96.85.21.65355: Flags [P.], seq 25888:26052, ack 37, win 313, length 164
20:23:58.028430 IP ubuntu-s-1vcpu-1gb-tor1-01.ssh > 198.96.85.21.65355: Flags [P.], seq 26052:26216, ack 37, win 313, length 164
20:23:58.028526 IP ubuntu-s-1vcpu-1gb-tor1-01.ssh > 198.96.85.21.65355: Flags [P.], seq 26216:26380, ack 37, win 313, length 164
20:23:58.028621 IP ubuntu-s-1vcpu-1gb-tor1-01.ssh > 198.96.85.21.65355: Flags [P.], seq 26380:26544, ack 37, win 313, length 164
20:23:58.028716 IP ubuntu-s-1vcpu-1gb-tor1-01.ssh > 198.96.85.21.65355: Flags [P.], seq 26544:26708, ack 37, win 313, length 164
20:23:58.028811 IP ubuntu-s-1vcpu-1gb-tor1-01.ssh > 198.96.85.21.65355: Flags [P.], seq 26708:26872, ack 37, win 313, length 164
20:23:58.028905 IP ubuntu-s-1vcpu-1gb-tor1-01.ssh > 198.96.85.21.65355: Flags [P.], seq 26872:27036, ack 37, win 313, length 164
20:23:58.029002 IP ubuntu-s-1vcpu-1gb-tor1-01.ssh > 198.96.85.21.65355: Flags [P.], seq 27036:27200, ack 37, win 313, length 164
20:23:58.029096 IP ubuntu-s-1vcpu-1gb-tor1-01.ssh > 198.96.85.21.65355: Flags [P.], seq 27200:27364, ack 37, win 313, length 164
20:23:58.029190 IP ubuntu-s-1vcpu-1gb-tor1-01.ssh > 198.96.85.21.65355: Flags [P.], seq 27364:27528, ack 37, win 313, length 164
20:23:58.029285 IP ubuntu-s-1vcpu-1gb-tor1-01.ssh > 198.96.85.21.65355: Flags [P.], seq 27528:27692, ack 37, win 313, length 164
20:23:58.029380 IP ubuntu-s-1vcpu-1gb-tor1-01.ssh > 198.96.85.21.65355: Flags [P.], seq 27692:27856, ack 37, win 313, length 164
20:23:58.029473 IP ubuntu-s-1vcpu-1gb-tor1-01.ssh > 198.96.85.21.65355: Flags [P.], seq 27856:28020, ack 37, win 313, length 164
20:23:58.029568 IP ubuntu-s-1vcpu-1gb-tor1-01.ssh > 198.96.85.21.65355: Flags [P.], seq 28020:28184, ack 37, win 313, length 164
20:23:58.029713 IP ubuntu-s-1vcpu-1gb-tor1-01.ssh > 198.96.85.21.65355: Flags [P.], seq 28184:28348, ack 37, win 313, length 164
20:23:58.029861 IP ubuntu-s-1vcpu-1gb-tor1-01.ssh > 198.96.85.21.65355: Flags [P.], seq 28348:28512, ack 37, win 313, length 164
20:23:58.029988 IP ubuntu-s-1vcpu-1gb-tor1-01.ssh > 198.96.85.21.65355: Flags [P.], seq 28512:28676, ack 37, win 313, length 164
20:23:58.030161 IP ubuntu-s-1vcpu-1gb-tor1-01.ssh > 198.96.85.21.65355: Flags [P.], seq 28676:28840, ack 37, win 313, length 164
20:23:58.030338 IP ubuntu-s-1vcpu-1gb-tor1-01.ssh > 198.96.85.21.65355: Flags [P.], seq 28840:29004, ack 37, win 313, length 164
20:23:58.030510 IP ubuntu-s-1vcpu-1gb-tor1-01.ssh > 198.96.85.21.65355: Flags [P.], seq 29004:29168, ack 37, win 313, length 164
20:23:58.030650 IP 198.96.85.21.65355 > ubuntu-s-1vcpu-1gb-tor1-01.ssh: Flags [.], ack 20196, win 255, length 0
20:23:58.030713 IP 198.96.85.21.65355 > ubuntu-s-1vcpu-1gb-tor1-01.ssh: Flags [.], ack 20636, win 258, length 0
20:23:58.030728 IP 198.96.85.21.65355 > ubuntu-s-1vcpu-1gb-tor1-01.ssh: Flags [.], ack 20964, win 257, length 0
20:23:58.030798 IP 198.96.85.21.65355 > ubuntu-s-1vcpu-1gb-tor1-01.ssh: Flags [.], ack 21420, win 255, length 0
20:23:58.030810 IP 198.96.85.21.65355 > ubuntu-s-1vcpu-1gb-tor1-01.ssh: Flags [.], ack 21748, win 254, length 0
20:23:58.030815 IP 198.96.85.21.65355 > ubuntu-s-1vcpu-1gb-tor1-01.ssh: Flags [.], ack 22076, win 258, length 0
20:23:58.030821 IP 198.96.85.21.65355 > ubuntu-s-1vcpu-1gb-tor1-01.ssh: Flags [.], ack 22404, win 257, length 0
20:23:58.030972 IP 198.96.85.21.65355 > ubuntu-s-1vcpu-1gb-tor1-01.ssh: Flags [.], ack 24828, win 258, length 0
20:23:58.030990 IP 198.96.85.21.65355 > ubuntu-s-1vcpu-1gb-tor1-01.ssh: Flags [.], ack 25724, win 255, length 0
20:23:58.031022 IP 198.96.85.21.65355 > ubuntu-s-1vcpu-1gb-tor1-01.ssh: Flags [.], ack 26052, win 254, length 0
20:23:58.031358 IP ubuntu-s-1vcpu-1gb-tor1-01.ssh > 198.96.85.21.65355: Flags [P.], seq 29168:30468, ack 37, win 313, length 1300
20:23:58.031502 IP ubuntu-s-1vcpu-1gb-tor1-01.ssh > 198.96.85.21.65355: Flags [P.], seq 30468:30640, ack 37, win 313, length 172
20:23:58.031605 IP ubuntu-s-1vcpu-1gb-tor1-01.ssh > 198.96.85.21.65355: Flags [P.], seq 30640:30804, ack 37, win 313, length 164
20:23:58.031704 IP ubuntu-s-1vcpu-1gb-tor1-01.ssh > 198.96.85.21.65355: Flags [P.], seq 30804:30968, ack 37, win 313, length 164
20:23:58.031803 IP ubuntu-s-1vcpu-1gb-tor1-01.ssh > 198.96.85.21.65355: Flags [P.], seq 30968:31132, ack 37, win 313, length 164
20:23:58.031901 IP ubuntu-s-1vcpu-1gb-tor1-01.ssh > 198.96.85.21.65355: Flags [P.], seq 31132:31296, ack 37, win 313, length 164
20:23:58.032030 IP ubuntu-s-1vcpu-1gb-tor1-01.ssh > 198.96.85.21.65355: Flags [P.], seq 31296:31460, ack 37, win 313, length 164
20:23:58.032219 IP ubuntu-s-1vcpu-1gb-tor1-01.ssh > 198.96.85.21.65355: Flags [P.], seq 31460:31624, ack 37, win 313, length 164
20:23:58.032391 IP ubuntu-s-1vcpu-1gb-tor1-01.ssh > 198.96.85.21.65355: Flags [P.], seq 31624:31788, ack 37, win 313, length 164
20:23:58.032563 IP ubuntu-s-1vcpu-1gb-tor1-01.ssh > 198.96.85.21.65355: Flags [P.], seq 31788:31952, ack 37, win 313, length 164
20:23:58.032672 IP 198.96.85.21.65355 > ubuntu-s-1vcpu-1gb-tor1-01.ssh: Flags [.], ack 26708, win 257, length 0
20:23:58.032691 IP 198.96.85.21.65355 > ubuntu-s-1vcpu-1gb-tor1-01.ssh: Flags [.], ack 27036, win 256, length 0
20:23:58.032703 IP 198.96.85.21.65355 > ubuntu-s-1vcpu-1gb-tor1-01.ssh: Flags [.], ack 27364, win 255, length 0
20:23:58.032709 IP 198.96.85.21.65355 > ubuntu-s-1vcpu-1gb-tor1-01.ssh: Flags [.], ack 27692, win 258, length 0
20:23:58.032715 IP 198.96.85.21.65355 > ubuntu-s-1vcpu-1gb-tor1-01.ssh: Flags [.], ack 28020, win 257, length 0
20:23:58.032720 IP 198.96.85.21.65355 > ubuntu-s-1vcpu-1gb-tor1-01.ssh: Flags [.], ack 28348, win 256, length 0
20:23:58.032842 IP 198.96.85.21.65355 > ubuntu-s-1vcpu-1gb-tor1-01.ssh: Flags [.], ack 29004, win 258, length 0
20:23:58.032976 IP ubuntu-s-1vcpu-1gb-tor1-01.ssh > 198.96.85.21.65355: Flags [P.], seq 31952:32908, ack 37, win 313, length 956
20:23:58.033093 IP ubuntu-s-1vcpu-1gb-tor1-01.ssh > 198.96.85.21.65355: Flags [P.], seq 32908:33072, ack 37, win 313, length 164
20:23:58.033196 IP ubuntu-s-1vcpu-1gb-tor1-01.ssh > 198.96.85.21.65355: Flags [P.], seq 33072:33236, ack 37, win 313, length 164
20:23:58.033291 IP ubuntu-s-1vcpu-1gb-tor1-01.ssh > 198.96.85.21.65355: Flags [P.], seq 33236:33400, ack 37, win 313, length 164
20:23:58.033403 IP ubuntu-s-1vcpu-1gb-tor1-01.ssh > 198.96.85.21.65355: Flags [P.], seq 33400:33564, ack 37, win 313, length 164
20:23:58.033572 IP ubuntu-s-1vcpu-1gb-tor1-01.ssh > 198.96.85.21.65355: Flags [P.], seq 33564:33728, ack 37, win 313, length 164
20:23:58.033750 IP ubuntu-s-1vcpu-1gb-tor1-01.ssh > 198.96.85.21.65355: Flags [P.], seq 33728:33892, ack 37, win 313, length 164
20:23:58.033929 IP ubuntu-s-1vcpu-1gb-tor1-01.ssh > 198.96.85.21.65355: Flags [P.], seq 33892:34056, ack 37, win 313, length 164
20:23:58.034092 IP ubuntu-s-1vcpu-1gb-tor1-01.ssh > 198.96.85.21.65355: Flags [P.], seq 34056:34220, ack 37, win 313, length 164
20:23:58.034202 IP ubuntu-s-1vcpu-1gb-tor1-01.ssh > 198.96.85.21.65355: Flags [P.], seq 34220:34384, ack 37, win 313, length 164
20:23:58.034302 IP ubuntu-s-1vcpu-1gb-tor1-01.ssh > 198.96.85.21.65355: Flags [P.], seq 34384:34548, ack 37, win 313, length 164
20:23:58.034396 IP ubuntu-s-1vcpu-1gb-tor1-01.ssh > 198.96.85.21.65355: Flags [P.], seq 34548:34712, ack 37, win 313, length 164
20:23:58.034559 IP ubuntu-s-1vcpu-1gb-tor1-01.ssh > 198.96.85.21.65355: Flags [P.], seq 34712:34876, ack 37, win 313, length 164
20:23:58.034721 IP ubuntu-s-1vcpu-1gb-tor1-01.ssh > 198.96.85.21.65355: Flags [P.], seq 34876:35040, ack 37, win 313, length 164
20:23:58.034823 IP ubuntu-s-1vcpu-1gb-tor1-01.ssh > 198.96.85.21.65355: Flags [P.], seq 35040:35204, ack 37, win 313, length 164
20:23:58.034878 IP 198.96.85.21.65355 > ubuntu-s-1vcpu-1gb-tor1-01.ssh: Flags [.], ack 30468, win 258, length 0
20:23:58.034892 IP 198.96.85.21.65355 > ubuntu-s-1vcpu-1gb-tor1-01.ssh: Flags [.], ack 30804, win 257, length 0
20:23:58.034897 IP 198.96.85.21.65355 > ubuntu-s-1vcpu-1gb-tor1-01.ssh: Flags [.], ack 31132, win 256, length 0
20:23:58.034916 IP 198.96.85.21.65355 > ubuntu-s-1vcpu-1gb-tor1-01.ssh: Flags [.], ack 31460, win 255, length 0
20:23:58.035112 IP 198.96.85.21.65355 > ubuntu-s-1vcpu-1gb-tor1-01.ssh: Flags [.], ack 31788, win 258, length 0
20:23:58.035129 IP ubuntu-s-1vcpu-1gb-tor1-01.ssh > 198.96.85.21.65355: Flags [P.], seq 35204:35824, ack 37, win 313, length 620
20:23:58.035267 IP ubuntu-s-1vcpu-1gb-tor1-01.ssh > 198.96.85.21.65355: Flags [P.], seq 35824:36108, ack 37, win 313, length 284
20:23:58.035391 IP ubuntu-s-1vcpu-1gb-tor1-01.ssh > 198.96.85.21.65355: Flags [P.], seq 36108:36272, ack 37, win 313, length 164
20:23:58.035556 IP ubuntu-s-1vcpu-1gb-tor1-01.ssh > 198.96.85.21.65355: Flags [P.], seq 36272:36436, ack 37, win 313, length 164
20:23:58.035693 IP ubuntu-s-1vcpu-1gb-tor1-01.ssh > 198.96.85.21.65355: Flags [P.], seq 36436:36600, ack 37, win 313, length 164
20:23:58.035820 IP ubuntu-s-1vcpu-1gb-tor1-01.ssh > 198.96.85.21.65355: Flags [P.], seq 36600:36764, ack 37, win 313, length 164
20:23:58.035920 IP ubuntu-s-1vcpu-1gb-tor1-01.ssh > 198.96.85.21.65355: Flags [P.], seq 36764:36928, ack 37, win 313, length 164
20:23:58.036016 IP ubuntu-s-1vcpu-1gb-tor1-01.ssh > 198.96.85.21.65355: Flags [P.], seq 36928:37092, ack 37, win 313, length 164
20:23:58.036110 IP ubuntu-s-1vcpu-1gb-tor1-01.ssh > 198.96.85.21.65355: Flags [P.], seq 37092:37256, ack 37, win 313, length 164
20:23:58.036204 IP ubuntu-s-1vcpu-1gb-tor1-01.ssh > 198.96.85.21.65355: Flags [P.], seq 37256:37420, ack 37, win 313, length 164
20:23:58.036299 IP ubuntu-s-1vcpu-1gb-tor1-01.ssh > 198.96.85.21.65355: Flags [P.], seq 37420:37584, ack 37, win 313, length 164
20:23:58.036395 IP ubuntu-s-1vcpu-1gb-tor1-01.ssh > 198.96.85.21.65355: Flags [P.], seq 37584:37748, ack 37, win 313, length 164
20:23:58.036491 IP ubuntu-s-1vcpu-1gb-tor1-01.ssh > 198.96.85.21.65355: Flags [P.], seq 37748:37912, ack 37, win 313, length 164
20:23:58.036641 IP ubuntu-s-1vcpu-1gb-tor1-01.ssh > 198.96.85.21.65355: Flags [P.], seq 37912:38076, ack 37, win 313, length 164
20:23:58.036783 IP ubuntu-s-1vcpu-1gb-tor1-01.ssh > 198.96.85.21.65355: Flags [P.], seq 38076:38240, ack 37, win 313, length 164
20:23:58.036916 IP ubuntu-s-1vcpu-1gb-tor1-01.ssh > 198.96.85.21.65355: Flags [P.], seq 38240:38404, ack 37, win 313, length 164
20:23:58.037020 IP ubuntu-s-1vcpu-1gb-tor1-01.ssh > 198.96.85.21.65355: Flags [P.], seq 38404:38568, ack 37, win 313, length 164
20:23:58.037116 IP ubuntu-s-1vcpu-1gb-tor1-01.ssh > 198.96.85.21.65355: Flags [P.], seq 38568:38732, ack 37, win 313, length 164
20:23:58.037215 IP ubuntu-s-1vcpu-1gb-tor1-01.ssh > 198.96.85.21.65355: Flags [P.], seq 38732:38896, ack 37, win 313, length 164
20:23:58.037313 IP ubuntu-s-1vcpu-1gb-tor1-01.ssh > 198.96.85.21.65355: Flags [P.], seq 38896:39060, ack 37, win 313, length 164
20:23:58.037410 IP ubuntu-s-1vcpu-1gb-tor1-01.ssh > 198.96.85.21.65355: Flags [P.], seq 39060:39224, ack 37, win 313, length 164
20:23:58.037521 IP ubuntu-s-1vcpu-1gb-tor1-01.ssh > 198.96.85.21.65355: Flags [P.], seq 39224:39388, ack 37, win 313, length 164
20:23:58.037643 IP ubuntu-s-1vcpu-1gb-tor1-01.ssh > 198.96.85.21.65355: Flags [P.], seq 39388:39552, ack 37, win 313, length 164
20:23:58.037746 IP ubuntu-s-1vcpu-1gb-tor1-01.ssh > 198.96.85.21.65355: Flags [P.], seq 39552:39716, ack 37, win 313, length 164
20:23:58.037843 IP ubuntu-s-1vcpu-1gb-tor1-01.ssh > 198.96.85.21.65355: Flags [P.], seq 39716:39880, ack 37, win 313, length 164
20:23:58.037939 IP ubuntu-s-1vcpu-1gb-tor1-01.ssh > 198.96.85.21.65355: Flags [P.], seq 39880:40044, ack 37, win 313, length 164
20:23:58.038036 IP ubuntu-s-1vcpu-1gb-tor1-01.ssh > 198.96.85.21.65355: Flags [P.], seq 40044:40208, ack 37, win 313, length 164
20:23:58.038132 IP ubuntu-s-1vcpu-1gb-tor1-01.ssh > 198.96.85.21.65355: Flags [P.], seq 40208:40372, ack 37, win 313, length 164
20:23:58.038228 IP ubuntu-s-1vcpu-1gb-tor1-01.ssh > 198.96.85.21.65355: Flags [P.], seq 40372:40536, ack 37, win 313, length 164
20:23:58.038322 IP ubuntu-s-1vcpu-1gb-tor1-01.ssh > 198.96.85.21.65355: Flags [P.], seq 40536:40700, ack 37, win 313, length 164
20:23:58.038417 IP ubuntu-s-1vcpu-1gb-tor1-01.ssh > 198.96.85.21.65355: Flags [P.], seq 40700:40864, ack 37, win 313, length 164
20:23:58.038514 IP ubuntu-s-1vcpu-1gb-tor1-01.ssh > 198.96.85.21.65355: Flags [P.], seq 40864:41028, ack 37, win 313, length 164
20:23:58.038686 IP ubuntu-s-1vcpu-1gb-tor1-01.ssh > 198.96.85.21.65355: Flags [P.], seq 41028:41192, ack 37, win 313, length 164
20:23:58.038814 IP ubuntu-s-1vcpu-1gb-tor1-01.ssh > 198.96.85.21.65355: Flags [P.], seq 41192:41356, ack 37, win 313, length 164
20:23:58.040363 IP 198.96.85.21.65355 > ubuntu-s-1vcpu-1gb-tor1-01.ssh: Flags [.], ack 32908, win 254, length 0
20:23:58.040392 IP ubuntu-s-1vcpu-1gb-tor1-01.ssh > 198.96.85.21.65355: Flags [P.], seq 41356:41520, ack 37, win 313, length 164
20:23:58.040570 IP ubuntu-s-1vcpu-1gb-tor1-01.ssh > 198.96.85.21.65355: Flags [P.], seq 41520:41804, ack 37, win 313, length 284
20:23:58.040920 IP 198.96.85.21.65355 > ubuntu-s-1vcpu-1gb-tor1-01.ssh: Flags [.], ack 33236, win 258, length 0
20:23:58.040940 IP ubuntu-s-1vcpu-1gb-tor1-01.ssh > 198.96.85.21.65355: Flags [P.], seq 41804:41968, ack 37, win 313, length 164
20:23:58.040972 IP 198.96.85.21.65355 > ubuntu-s-1vcpu-1gb-tor1-01.ssh: Flags [.], ack 33564, win 257, length 0
20:23:58.040979 IP 198.96.85.21.65355 > ubuntu-s-1vcpu-1gb-tor1-01.ssh: Flags [.], ack 33892, win 256, length 0
20:23:58.040983 IP 198.96.85.21.65355 > ubuntu-s-1vcpu-1gb-tor1-01.ssh: Flags [.], ack 34220, win 255, length 0
20:23:58.040987 IP 198.96.85.21.65355 > ubuntu-s-1vcpu-1gb-tor1-01.ssh: Flags [.], ack 34548, win 258, length 0
20:23:58.040992 IP 198.96.85.21.65355 > ubuntu-s-1vcpu-1gb-tor1-01.ssh: Flags [.], ack 34876, win 257, length 0
20:23:58.041107 IP 198.96.85.21.65355 > ubuntu-s-1vcpu-1gb-tor1-01.ssh: Flags [.], ack 36436, win 257, length 0
20:23:58.041114 IP 198.96.85.21.65355 > ubuntu-s-1vcpu-1gb-tor1-01.ssh: Flags [.], ack 36764, win 256, length 0
20:23:58.041199 IP 198.96.85.21.65355 > ubuntu-s-1vcpu-1gb-tor1-01.ssh: Flags [.], ack 37092, win 255, length 0
20:23:58.041263 IP 198.96.85.21.65355 > ubuntu-s-1vcpu-1gb-tor1-01.ssh: Flags [.], ack 37420, win 258, length 0
20:23:58.041270 IP 198.96.85.21.65355 > ubuntu-s-1vcpu-1gb-tor1-01.ssh: Flags [.], ack 37748, win 257, length 0
20:23:58.041277 IP 198.96.85.21.65355 > ubuntu-s-1vcpu-1gb-tor1-01.ssh: Flags [.], ack 38076, win 256, length 0
20:23:58.041394 IP 198.96.85.21.65355 > ubuntu-s-1vcpu-1gb-tor1-01.ssh: Flags [.], ack 38404, win 255, length 0
20:23:58.041451 IP 198.96.85.21.65355 > ubuntu-s-1vcpu-1gb-tor1-01.ssh: Flags [.], ack 38732, win 258, length 0
20:23:58.041572 IP 198.96.85.21.65355 > ubuntu-s-1vcpu-1gb-tor1-01.ssh: Flags [.], ack 39060, win 257, length 0
20:23:58.041588 IP 198.96.85.21.65355 > ubuntu-s-1vcpu-1gb-tor1-01.ssh: Flags [.], ack 39388, win 256, length 0
20:23:58.041594 IP 198.96.85.21.65355 > ubuntu-s-1vcpu-1gb-tor1-01.ssh: Flags [.], ack 39716, win 255, length 0
20:23:58.041599 IP 198.96.85.21.65355 > ubuntu-s-1vcpu-1gb-tor1-01.ssh: Flags [.], ack 40044, win 258, length 0
20:23:58.041780 IP 198.96.85.21.65355 > ubuntu-s-1vcpu-1gb-tor1-01.ssh: Flags [.], ack 40700, win 256, length 0
20:23:58.041823 IP 198.96.85.21.65355 > ubuntu-s-1vcpu-1gb-tor1-01.ssh: Flags [.], ack 41028, win 255, length 0
20:23:58.041870 IP 198.96.85.21.65355 > ubuntu-s-1vcpu-1gb-tor1-01.ssh: Flags [.], ack 41356, win 258, length 0
20:23:58.042070 IP ubuntu-s-1vcpu-1gb-tor1-01.ssh > 198.96.85.21.65355: Flags [P.], seq 41968:44508, ack 37, win 313, length 2540
20:23:58.042195 IP ubuntu-s-1vcpu-1gb-tor1-01.ssh > 198.96.85.21.65355: Flags [P.], seq 44508:44680, ack 37, win 313, length 172
20:23:58.042297 IP ubuntu-s-1vcpu-1gb-tor1-01.ssh > 198.96.85.21.65355: Flags [P.], seq 44680:44844, ack 37, win 313, length 164
20:23:58.042397 IP ubuntu-s-1vcpu-1gb-tor1-01.ssh > 198.96.85.21.65355: Flags [P.], seq 44844:45008, ack 37, win 313, length 164
20:23:58.042496 IP ubuntu-s-1vcpu-1gb-tor1-01.ssh > 198.96.85.21.65355: Flags [P.], seq 45008:45172, ack 37, win 313, length 164
20:23:58.042625 IP ubuntu-s-1vcpu-1gb-tor1-01.ssh > 198.96.85.21.65355: Flags [P.], seq 45172:45336, ack 37, win 313, length 164
20:23:58.042732 IP ubuntu-s-1vcpu-1gb-tor1-01.ssh > 198.96.85.21.65355: Flags [P.], seq 45336:45500, ack 37, win 313, length 164
20:23:58.042846 IP ubuntu-s-1vcpu-1gb-tor1-01.ssh > 198.96.85.21.65355: Flags [P.], seq 45500:45664, ack 37, win 313, length 164
20:23:58.042950 IP ubuntu-s-1vcpu-1gb-tor1-01.ssh > 198.96.85.21.65355: Flags [P.], seq 45664:45828, ack 37, win 313, length 164
20:23:58.043049 IP ubuntu-s-1vcpu-1gb-tor1-01.ssh > 198.96.85.21.65355: Flags [P.], seq 45828:45992, ack 37, win 313, length 164
20:23:58.043166 IP ubuntu-s-1vcpu-1gb-tor1-01.ssh > 198.96.85.21.65355: Flags [P.], seq 45992:46156, ack 37, win 313, length 164
20:23:58.043267 IP ubuntu-s-1vcpu-1gb-tor1-01.ssh > 198.96.85.21.65355: Flags [P.], seq 46156:46320, ack 37, win 313, length 164
20:23:58.043397 IP ubuntu-s-1vcpu-1gb-tor1-01.ssh > 198.96.85.21.65355: Flags [P.], seq 46320:46484, ack 37, win 313, length 164
20:23:58.043440 IP 198.96.85.21.65355 > ubuntu-s-1vcpu-1gb-tor1-01.ssh: Flags [.], ack 41804, win 257, length 0
20:23:58.043638 IP ubuntu-s-1vcpu-1gb-tor1-01.ssh > 198.96.85.21.65355: Flags [P.], seq 46484:46768, ack 37, win 313, length 284
20:23:58.043760 IP ubuntu-s-1vcpu-1gb-tor1-01.ssh > 198.96.85.21.65355: Flags [P.], seq 46768:46932, ack 37, win 313, length 164
20:23:58.043860 IP ubuntu-s-1vcpu-1gb-tor1-01.ssh > 198.96.85.21.65355: Flags [P.], seq 46932:47096, ack 37, win 313, length 164
20:23:58.043956 IP ubuntu-s-1vcpu-1gb-tor1-01.ssh > 198.96.85.21.65355: Flags [P.], seq 47096:47260, ack 37, win 313, length 164
20:23:58.044051 IP ubuntu-s-1vcpu-1gb-tor1-01.ssh > 198.96.85.21.65355: Flags [P.], seq 47260:47424, ack 37, win 313, length 164
20:23:58.044224 IP ubuntu-s-1vcpu-1gb-tor1-01.ssh > 198.96.85.21.65355: Flags [P.], seq 47424:47588, ack 37, win 313, length 164
20:23:58.044403 IP ubuntu-s-1vcpu-1gb-tor1-01.ssh > 198.96.85.21.65355: Flags [P.], seq 47588:47752, ack 37, win 313, length 164
20:23:58.044578 IP ubuntu-s-1vcpu-1gb-tor1-01.ssh > 198.96.85.21.65355: Flags [P.], seq 47752:47916, ack 37, win 313, length 164
20:23:58.044729 IP ubuntu-s-1vcpu-1gb-tor1-01.ssh > 198.96.85.21.65355: Flags [P.], seq 47916:48080, ack 37, win 313, length 164
20:23:58.044885 IP ubuntu-s-1vcpu-1gb-tor1-01.ssh > 198.96.85.21.65355: Flags [P.], seq 48080:48244, ack 37, win 313, length 164
20:23:58.044992 IP ubuntu-s-1vcpu-1gb-tor1-01.ssh > 198.96.85.21.65355: Flags [P.], seq 48244:48408, ack 37, win 313, length 164
20:23:58.045090 IP ubuntu-s-1vcpu-1gb-tor1-01.ssh > 198.96.85.21.65355: Flags [P.], seq 48408:48572, ack 37, win 313, length 164
20:23:58.045184 IP ubuntu-s-1vcpu-1gb-tor1-01.ssh > 198.96.85.21.65355: Flags [P.], seq 48572:48736, ack 37, win 313, length 164
20:23:58.045279 IP ubuntu-s-1vcpu-1gb-tor1-01.ssh > 198.96.85.21.65355: Flags [P.], seq 48736:48900, ack 37, win 313, length 164
20:23:58.045383 IP ubuntu-s-1vcpu-1gb-tor1-01.ssh > 198.96.85.21.65355: Flags [P.], seq 48900:49064, ack 37, win 313, length 164
20:23:58.045485 IP ubuntu-s-1vcpu-1gb-tor1-01.ssh > 198.96.85.21.65355: Flags [P.], seq 49064:49228, ack 37, win 313, length 164
20:23:58.045580 IP ubuntu-s-1vcpu-1gb-tor1-01.ssh > 198.96.85.21.65355: Flags [P.], seq 49228:49392, ack 37, win 313, length 164
20:23:58.045675 IP ubuntu-s-1vcpu-1gb-tor1-01.ssh > 198.96.85.21.65355: Flags [P.], seq 49392:49556, ack 37, win 313, length 164
20:23:58.045770 IP ubuntu-s-1vcpu-1gb-tor1-01.ssh > 198.96.85.21.65355: Flags [P.], seq 49556:49720, ack 37, win 313, length 164
20:23:58.045866 IP ubuntu-s-1vcpu-1gb-tor1-01.ssh > 198.96.85.21.65355: Flags [P.], seq 49720:49884, ack 37, win 313, length 164
