root@ubuntu-s-1vcpu-1gb-tor1-01:~# tcpdump -i eth0 port 22
tcpdump: verbose output suppressed, use -v or -vv for full protocol decode
listening on eth0, link-type EN10MB (Ethernet), capture size 262144 bytes
20:37:56.209985 IP ubuntu-s-1vcpu-1gb-tor1-01.ssh > 198.96.85.21.65355: Flags [P.], seq 2060867770:2060867878, ack 3366068486, win 313, length 108
20:37:56.210078 IP ubuntu-s-1vcpu-1gb-tor1-01.ssh > 198.96.85.21.65355: Flags [P.], seq 108:144, ack 1, win 313, length 36
20:37:56.210176 IP ubuntu-s-1vcpu-1gb-tor1-01.ssh > 198.96.85.21.65355: Flags [P.], seq 144:252, ack 1, win 313, length 108
20:37:56.210260 IP ubuntu-s-1vcpu-1gb-tor1-01.ssh > 198.96.85.21.65355: Flags [P.], seq 252:288, ack 1, win 313, length 36
20:37:56.212167 IP ubuntu-s-1vcpu-1gb-tor1-01.ssh > 198.96.85.21.65355: Flags [P.], seq 288:468, ack 1, win 313, length 180
20:37:56.212255 IP ubuntu-s-1vcpu-1gb-tor1-01.ssh > 198.96.85.21.65355: Flags [P.], seq 468:504, ack 1, win 313, length 36
20:37:56.212394 IP ubuntu-s-1vcpu-1gb-tor1-01.ssh > 198.96.85.21.65355: Flags [P.], seq 504:660, ack 1, win 313, length 156
20:37:56.212471 IP ubuntu-s-1vcpu-1gb-tor1-01.ssh > 198.96.85.21.65355: Flags [P.], seq 660:696, ack 1, win 313, length 36
20:37:56.212565 IP ubuntu-s-1vcpu-1gb-tor1-01.ssh > 198.96.85.21.65355: Flags [P.], seq 696:860, ack 1, win 313, length 164
20:37:56.213194 IP 198.96.85.21.65355 > ubuntu-s-1vcpu-1gb-tor1-01.ssh: Flags [.], ack 108, win 3836, length 0
20:37:56.213216 IP ubuntu-s-1vcpu-1gb-tor1-01.ssh > 198.96.85.21.65355: Flags [P.], seq 860:1872, ack 1, win 313, length 1012
20:37:56.213232 IP 198.96.85.21.65355 > ubuntu-s-1vcpu-1gb-tor1-01.ssh: Flags [.], ack 252, win 3836, length 0
20:37:56.213260 IP ubuntu-s-1vcpu-1gb-tor1-01.ssh > 198.96.85.21.65355: Flags [P.], seq 1872:2036, ack 1, win 313, length 164
20:37:56.213328 IP ubuntu-s-1vcpu-1gb-tor1-01.ssh > 198.96.85.21.65355: Flags [P.], seq 2036:2072, ack 1, win 313, length 36
20:37:56.213426 IP ubuntu-s-1vcpu-1gb-tor1-01.ssh > 198.96.85.21.65355: Flags [P.], seq 2072:2220, ack 1, win 313, length 148
20:37:56.213493 IP ubuntu-s-1vcpu-1gb-tor1-01.ssh > 198.96.85.21.65355: Flags [P.], seq 2220:2256, ack 1, win 313, length 36
20:37:56.213581 IP ubuntu-s-1vcpu-1gb-tor1-01.ssh > 198.96.85.21.65355: Flags [P.], seq 2256:2420, ack 1, win 313, length 164
20:37:56.213781 IP ubuntu-s-1vcpu-1gb-tor1-01.ssh > 198.96.85.21.65355: Flags [P.], seq 2456:2604, ack 1, win 313, length 148
20:37:56.224917 IP 198.96.85.21.65355 > ubuntu-s-1vcpu-1gb-tor1-01.ssh: Flags [.], ack 468, win 3835, length 0
20:37:56.224984 IP ubuntu-s-1vcpu-1gb-tor1-01.ssh > 198.96.85.21.65355: Flags [P.], seq 2604:3840, ack 1, win 313, length 1236
20:37:56.225014 IP 198.96.85.21.65355 > ubuntu-s-1vcpu-1gb-tor1-01.ssh: Flags [.], ack 660, win 3834, length 0
20:37:56.225181 IP 198.96.85.21.65355 > ubuntu-s-1vcpu-1gb-tor1-01.ssh: Flags [.], ack 860, win 3839, length 0
20:37:56.225201 IP 198.96.85.21.65355 > ubuntu-s-1vcpu-1gb-tor1-01.ssh: Flags [.], ack 2036, win 3834, length 0
20:37:56.225287 IP ubuntu-s-1vcpu-1gb-tor1-01.ssh > 198.96.85.21.65355: Flags [P.], seq 3840:3988, ack 1, win 313, length 148
20:37:56.225425 IP 198.96.85.21.65355 > ubuntu-s-1vcpu-1gb-tor1-01.ssh: Flags [.], ack 2220, win 3839, length 0
20:37:56.225682 IP ubuntu-s-1vcpu-1gb-tor1-01.ssh > 198.96.85.21.65355: Flags [P.], seq 4024:4188, ack 1, win 313, length 164
20:37:56.225974 IP ubuntu-s-1vcpu-1gb-tor1-01.ssh > 198.96.85.21.65355: Flags [P.], seq 4224:4372, ack 1, win 313, length 148
20:37:56.226273 IP ubuntu-s-1vcpu-1gb-tor1-01.ssh > 198.96.85.21.65355: Flags [P.], seq 4408:4556, ack 1, win 313, length 148
20:37:56.226544 IP ubuntu-s-1vcpu-1gb-tor1-01.ssh > 198.96.85.21.65355: Flags [P.], seq 4592:4740, ack 1, win 313, length 148
20:37:56.226895 IP ubuntu-s-1vcpu-1gb-tor1-01.ssh > 198.96.85.21.65355: Flags [P.], seq 4776:4940, ack 1, win 313, length 164
20:37:56.227114 IP ubuntu-s-1vcpu-1gb-tor1-01.ssh > 198.96.85.21.65355: Flags [P.], seq 4976:5124, ack 1, win 313, length 148
20:37:56.227296 IP ubuntu-s-1vcpu-1gb-tor1-01.ssh > 198.96.85.21.65355: Flags [P.], seq 5160:5324, ack 1, win 313, length 164
20:37:56.227560 IP ubuntu-s-1vcpu-1gb-tor1-01.ssh > 198.96.85.21.65355: Flags [P.], seq 5360:5524, ack 1, win 313, length 164
20:37:56.227794 IP ubuntu-s-1vcpu-1gb-tor1-01.ssh > 198.96.85.21.65355: Flags [P.], seq 5560:5724, ack 1, win 313, length 164
20:37:56.228035 IP ubuntu-s-1vcpu-1gb-tor1-01.ssh > 198.96.85.21.65355: Flags [P.], seq 5760:5924, ack 1, win 313, length 164
20:37:56.228284 IP ubuntu-s-1vcpu-1gb-tor1-01.ssh > 198.96.85.21.65355: Flags [P.], seq 5960:6124, ack 1, win 313, length 164
20:37:56.228528 IP ubuntu-s-1vcpu-1gb-tor1-01.ssh > 198.96.85.21.65355: Flags [P.], seq 6160:6324, ack 1, win 313, length 164
20:37:56.228785 IP ubuntu-s-1vcpu-1gb-tor1-01.ssh > 198.96.85.21.65355: Flags [P.], seq 6360:6524, ack 1, win 313, length 164
20:37:56.238705 IP 198.96.85.21.65355 > ubuntu-s-1vcpu-1gb-tor1-01.ssh: Flags [.], ack 3988, win 3839, length 0
20:37:56.238752 IP ubuntu-s-1vcpu-1gb-tor1-01.ssh > 198.96.85.21.65355: Flags [P.], seq 6524:7364, ack 1, win 313, length 840
20:37:56.238781 IP 198.96.85.21.65355 > ubuntu-s-1vcpu-1gb-tor1-01.ssh: Flags [.], ack 4188, win 3838, length 0
20:37:56.238960 IP 198.96.85.21.65355 > ubuntu-s-1vcpu-1gb-tor1-01.ssh: Flags [.], ack 4372, win 3837, length 0
20:37:56.238977 IP 198.96.85.21.65355 > ubuntu-s-1vcpu-1gb-tor1-01.ssh: Flags [.], ack 4556, win 3836, length 0
20:37:56.239092 IP ubuntu-s-1vcpu-1gb-tor1-01.ssh > 198.96.85.21.65355: Flags [P.], seq 7364:7512, ack 1, win 313, length 148
20:37:56.239211 IP ubuntu-s-1vcpu-1gb-tor1-01.ssh > 198.96.85.21.65355: Flags [P.], seq 7512:7548, ack 1, win 313, length 36
20:37:56.239291 IP 198.96.85.21.65355 > ubuntu-s-1vcpu-1gb-tor1-01.ssh: Flags [.], ack 4740, win 3836, length 0
20:37:56.239594 IP 198.96.85.21.65355 > ubuntu-s-1vcpu-1gb-tor1-01.ssh: Flags [.], ack 5324, win 3839, length 0
20:37:56.239976 IP ubuntu-s-1vcpu-1gb-tor1-01.ssh > 198.96.85.21.65355: Flags [P.], seq 7932:8080, ack 1, win 313, length 148
20:37:56.240085 IP 198.96.85.21.65355 > ubuntu-s-1vcpu-1gb-tor1-01.ssh: Flags [.], ack 5724, win 3837, length 0
20:37:56.240491 IP ubuntu-s-1vcpu-1gb-tor1-01.ssh > 198.96.85.21.65355: Flags [P.], seq 8236:8880, ack 1, win 313, length 644
20:37:56.240733 IP 198.96.85.21.65355 > ubuntu-s-1vcpu-1gb-tor1-01.ssh: Flags [.], ack 6524, win 3834, length 0
20:37:56.240753 IP ubuntu-s-1vcpu-1gb-tor1-01.ssh > 198.96.85.21.65355: Flags [P.], seq 8880:9156, ack 1, win 313, length 276
20:37:56.240985 IP ubuntu-s-1vcpu-1gb-tor1-01.ssh > 198.96.85.21.65355: Flags [P.], seq 9156:9432, ack 1, win 313, length 276
20:37:56.241128 IP ubuntu-s-1vcpu-1gb-tor1-01.ssh > 198.96.85.21.65355: Flags [P.], seq 9432:9596, ack 1, win 313, length 164
20:37:56.241276 IP ubuntu-s-1vcpu-1gb-tor1-01.ssh > 198.96.85.21.65355: Flags [P.], seq 9596:9760, ack 1, win 313, length 164
20:37:56.241454 IP ubuntu-s-1vcpu-1gb-tor1-01.ssh > 198.96.85.21.65355: Flags [P.], seq 9760:9924, ack 1, win 313, length 164
20:37:56.241602 IP ubuntu-s-1vcpu-1gb-tor1-01.ssh > 198.96.85.21.65355: Flags [P.], seq 9924:10088, ack 1, win 313, length 164
20:37:56.241738 IP ubuntu-s-1vcpu-1gb-tor1-01.ssh > 198.96.85.21.65355: Flags [P.], seq 10088:10252, ack 1, win 313, length 164
20:37:56.241891 IP ubuntu-s-1vcpu-1gb-tor1-01.ssh > 198.96.85.21.65355: Flags [P.], seq 10252:10416, ack 1, win 313, length 164
20:37:56.242055 IP ubuntu-s-1vcpu-1gb-tor1-01.ssh > 198.96.85.21.65355: Flags [P.], seq 10416:10580, ack 1, win 313, length 164
20:37:56.242239 IP ubuntu-s-1vcpu-1gb-tor1-01.ssh > 198.96.85.21.65355: Flags [P.], seq 10580:10744, ack 1, win 313, length 164
20:37:56.242422 IP ubuntu-s-1vcpu-1gb-tor1-01.ssh > 198.96.85.21.65355: Flags [P.], seq 10744:10908, ack 1, win 313, length 164
20:37:56.242586 IP ubuntu-s-1vcpu-1gb-tor1-01.ssh > 198.96.85.21.65355: Flags [P.], seq 10908:11072, ack 1, win 313, length 164
20:37:56.242784 IP ubuntu-s-1vcpu-1gb-tor1-01.ssh > 198.96.85.21.65355: Flags [P.], seq 11072:11236, ack 1, win 313, length 164
20:37:56.242968 IP ubuntu-s-1vcpu-1gb-tor1-01.ssh > 198.96.85.21.65355: Flags [P.], seq 11236:11400, ack 1, win 313, length 164
20:37:56.243156 IP ubuntu-s-1vcpu-1gb-tor1-01.ssh > 198.96.85.21.65355: Flags [P.], seq 11400:11564, ack 1, win 313, length 164
20:37:56.243331 IP ubuntu-s-1vcpu-1gb-tor1-01.ssh > 198.96.85.21.65355: Flags [P.], seq 11564:11728, ack 1, win 313, length 164
20:37:56.243490 IP ubuntu-s-1vcpu-1gb-tor1-01.ssh > 198.96.85.21.65355: Flags [P.], seq 11728:11892, ack 1, win 313, length 164
20:37:56.243660 IP ubuntu-s-1vcpu-1gb-tor1-01.ssh > 198.96.85.21.65355: Flags [P.], seq 11892:12056, ack 1, win 313, length 164
20:37:56.243794 IP ubuntu-s-1vcpu-1gb-tor1-01.ssh > 198.96.85.21.65355: Flags [P.], seq 12056:12220, ack 1, win 313, length 164
20:37:56.243930 IP ubuntu-s-1vcpu-1gb-tor1-01.ssh > 198.96.85.21.65355: Flags [P.], seq 12220:12384, ack 1, win 313, length 164
20:37:56.244099 IP ubuntu-s-1vcpu-1gb-tor1-01.ssh > 198.96.85.21.65355: Flags [P.], seq 12384:12548, ack 1, win 313, length 164
20:37:56.244297 IP ubuntu-s-1vcpu-1gb-tor1-01.ssh > 198.96.85.21.65355: Flags [P.], seq 12548:12712, ack 1, win 313, length 164
20:37:56.244465 IP ubuntu-s-1vcpu-1gb-tor1-01.ssh > 198.96.85.21.65355: Flags [P.], seq 12712:12876, ack 1, win 313, length 164
20:37:56.244622 IP ubuntu-s-1vcpu-1gb-tor1-01.ssh > 198.96.85.21.65355: Flags [P.], seq 12876:13040, ack 1, win 313, length 164
20:37:56.244783 IP ubuntu-s-1vcpu-1gb-tor1-01.ssh > 198.96.85.21.65355: Flags [P.], seq 13040:13204, ack 1, win 313, length 164
20:37:56.244921 IP ubuntu-s-1vcpu-1gb-tor1-01.ssh > 198.96.85.21.65355: Flags [P.], seq 13204:13368, ack 1, win 313, length 164
20:37:56.245076 IP ubuntu-s-1vcpu-1gb-tor1-01.ssh > 198.96.85.21.65355: Flags [P.], seq 13368:13532, ack 1, win 313, length 164
20:37:56.245252 IP ubuntu-s-1vcpu-1gb-tor1-01.ssh > 198.96.85.21.65355: Flags [P.], seq 13532:13696, ack 1, win 313, length 164
20:37:56.245434 IP ubuntu-s-1vcpu-1gb-tor1-01.ssh > 198.96.85.21.65355: Flags [P.], seq 13696:13860, ack 1, win 313, length 164
20:37:56.245609 IP ubuntu-s-1vcpu-1gb-tor1-01.ssh > 198.96.85.21.65355: Flags [P.], seq 13860:14024, ack 1, win 313, length 164
20:37:56.245761 IP ubuntu-s-1vcpu-1gb-tor1-01.ssh > 198.96.85.21.65355: Flags [P.], seq 14024:14188, ack 1, win 313, length 164
20:37:56.245899 IP ubuntu-s-1vcpu-1gb-tor1-01.ssh > 198.96.85.21.65355: Flags [P.], seq 14188:14352, ack 1, win 313, length 164
20:37:56.246037 IP ubuntu-s-1vcpu-1gb-tor1-01.ssh > 198.96.85.21.65355: Flags [P.], seq 14352:14516, ack 1, win 313, length 164
20:37:56.246201 IP ubuntu-s-1vcpu-1gb-tor1-01.ssh > 198.96.85.21.65355: Flags [P.], seq 14516:14680, ack 1, win 313, length 164
20:37:56.246366 IP ubuntu-s-1vcpu-1gb-tor1-01.ssh > 198.96.85.21.65355: Flags [P.], seq 14680:14844, ack 1, win 313, length 164
20:37:56.246515 IP ubuntu-s-1vcpu-1gb-tor1-01.ssh > 198.96.85.21.65355: Flags [P.], seq 14844:15008, ack 1, win 313, length 164
20:37:56.246702 IP ubuntu-s-1vcpu-1gb-tor1-01.ssh > 198.96.85.21.65355: Flags [P.], seq 15008:15172, ack 1, win 313, length 164
20:37:56.246838 IP ubuntu-s-1vcpu-1gb-tor1-01.ssh > 198.96.85.21.65355: Flags [P.], seq 15172:15336, ack 1, win 313, length 164
20:37:56.247020 IP ubuntu-s-1vcpu-1gb-tor1-01.ssh > 198.96.85.21.65355: Flags [P.], seq 15336:15500, ack 1, win 313, length 164
20:37:56.247204 IP ubuntu-s-1vcpu-1gb-tor1-01.ssh > 198.96.85.21.65355: Flags [P.], seq 15500:15664, ack 1, win 313, length 164
20:37:56.247376 IP ubuntu-s-1vcpu-1gb-tor1-01.ssh > 198.96.85.21.65355: Flags [P.], seq 15664:15828, ack 1, win 313, length 164
20:37:56.247551 IP ubuntu-s-1vcpu-1gb-tor1-01.ssh > 198.96.85.21.65355: Flags [P.], seq 15828:15992, ack 1, win 313, length 164
20:37:56.252958 IP 198.96.85.21.65355 > ubuntu-s-1vcpu-1gb-tor1-01.ssh: Flags [.], ack 7512, win 3839, length 0
20:37:56.253004 IP ubuntu-s-1vcpu-1gb-tor1-01.ssh > 198.96.85.21.65355: Flags [P.], seq 15992:16156, ack 1, win 313, length 164
20:37:56.253090 IP 198.96.85.21.65355 > ubuntu-s-1vcpu-1gb-tor1-01.ssh: Flags [.], ack 7712, win 3838, length 0
20:37:56.253103 IP 198.96.85.21.65355 > ubuntu-s-1vcpu-1gb-tor1-01.ssh: Flags [.], ack 7896, win 3837, length 0
20:37:56.253309 IP ubuntu-s-1vcpu-1gb-tor1-01.ssh > 198.96.85.21.65355: Flags [P.], seq 16156:16664, ack 1, win 313, length 508
20:37:56.253406 IP 198.96.85.21.65355 > ubuntu-s-1vcpu-1gb-tor1-01.ssh: Flags [.], ack 8080, win 3836, length 0
20:37:56.253506 IP ubuntu-s-1vcpu-1gb-tor1-01.ssh > 198.96.85.21.65355: Flags [P.], seq 16664:16940, ack 1, win 313, length 276
20:37:56.253619 IP ubuntu-s-1vcpu-1gb-tor1-01.ssh > 198.96.85.21.65355: Flags [P.], seq 16940:17104, ack 1, win 313, length 164
20:37:56.253718 IP 198.96.85.21.65355 > ubuntu-s-1vcpu-1gb-tor1-01.ssh: Flags [.], ack 8880, win 3839, length 0
20:37:56.253730 IP 198.96.85.21.65355 > ubuntu-s-1vcpu-1gb-tor1-01.ssh: Flags [.], ack 9432, win 3836, length 0
20:37:56.253735 IP 198.96.85.21.65355 > ubuntu-s-1vcpu-1gb-tor1-01.ssh: Flags [.], ack 9760, win 3835, length 0
20:37:56.253761 IP 198.96.85.21.65355 > ubuntu-s-1vcpu-1gb-tor1-01.ssh: Flags [.], ack 10088, win 3834, length 0
20:37:56.253906 IP ubuntu-s-1vcpu-1gb-tor1-01.ssh > 198.96.85.21.65355: Flags [P.], seq 17104:17268, ack 1, win 313, length 164
20:37:56.253959 IP ubuntu-s-1vcpu-1gb-tor1-01.ssh > 198.96.85.21.65355: Flags [P.], seq 17268:17760, ack 1, win 313, length 492
20:37:56.254076 IP 198.96.85.21.65355 > ubuntu-s-1vcpu-1gb-tor1-01.ssh: Flags [.], ack 10416, win 3839, length 0
20:37:56.254090 IP 198.96.85.21.65355 > ubuntu-s-1vcpu-1gb-tor1-01.ssh: Flags [.], ack 10744, win 3837, length 0
20:37:56.254185 IP ubuntu-s-1vcpu-1gb-tor1-01.ssh > 198.96.85.21.65355: Flags [P.], seq 17760:18052, ack 1, win 313, length 292
20:37:56.254287 IP ubuntu-s-1vcpu-1gb-tor1-01.ssh > 198.96.85.21.65355: Flags [P.], seq 18052:18320, ack 1, win 313, length 268
20:37:56.254309 IP 198.96.85.21.65355 > ubuntu-s-1vcpu-1gb-tor1-01.ssh: Flags [.], ack 11072, win 3836, length 0
20:37:56.254422 IP ubuntu-s-1vcpu-1gb-tor1-01.ssh > 198.96.85.21.65355: Flags [P.], seq 18320:18484, ack 1, win 313, length 164
20:37:56.254469 IP ubuntu-s-1vcpu-1gb-tor1-01.ssh > 198.96.85.21.65355: Flags [P.], seq 18484:18768, ack 1, win 313, length 284
20:37:56.254608 IP ubuntu-s-1vcpu-1gb-tor1-01.ssh > 198.96.85.21.65355: Flags [P.], seq 18768:19060, ack 1, win 313, length 292
20:37:56.254689 IP 198.96.85.21.65355 > ubuntu-s-1vcpu-1gb-tor1-01.ssh: Flags [.], ack 11400, win 3835, length 0
20:37:56.254701 IP 198.96.85.21.65355 > ubuntu-s-1vcpu-1gb-tor1-01.ssh: Flags [.], ack 11728, win 3839, length 0
20:37:56.254706 IP 198.96.85.21.65355 > ubuntu-s-1vcpu-1gb-tor1-01.ssh: Flags [.], ack 12056, win 3837, length 0
20:37:56.254710 IP 198.96.85.21.65355 > ubuntu-s-1vcpu-1gb-tor1-01.ssh: Flags [.], ack 12384, win 3836, length 0
20:37:56.254852 IP ubuntu-s-1vcpu-1gb-tor1-01.ssh > 198.96.85.21.65355: Flags [P.], seq 19060:19680, ack 1, win 313, length 620
20:37:56.254989 IP ubuntu-s-1vcpu-1gb-tor1-01.ssh > 198.96.85.21.65355: Flags [P.], seq 19680:19844, ack 1, win 313, length 164
20:37:56.255068 IP ubuntu-s-1vcpu-1gb-tor1-01.ssh > 198.96.85.21.65355: Flags [P.], seq 19844:20008, ack 1, win 313, length 164
20:37:56.255147 IP 198.96.85.21.65355 > ubuntu-s-1vcpu-1gb-tor1-01.ssh: Flags [.], ack 12712, win 3835, length 0
20:37:56.255159 IP 198.96.85.21.65355 > ubuntu-s-1vcpu-1gb-tor1-01.ssh: Flags [.], ack 13040, win 3839, length 0
20:37:56.255248 IP ubuntu-s-1vcpu-1gb-tor1-01.ssh > 198.96.85.21.65355: Flags [P.], seq 20008:20172, ack 1, win 313, length 164
20:37:56.255305 IP 198.96.85.21.65355 > ubuntu-s-1vcpu-1gb-tor1-01.ssh: Flags [.], ack 13368, win 3837, length 0
20:37:56.255315 IP 198.96.85.21.65355 > ubuntu-s-1vcpu-1gb-tor1-01.ssh: Flags [.], ack 13696, win 3836, length 0
20:37:56.255418 IP ubuntu-s-1vcpu-1gb-tor1-01.ssh > 198.96.85.21.65355: Flags [P.], seq 20172:20440, ack 1, win 313, length 268
20:37:56.255466 IP ubuntu-s-1vcpu-1gb-tor1-01.ssh > 198.96.85.21.65355: Flags [P.], seq 20440:20836, ack 1, win 313, length 396
20:37:56.255583 IP ubuntu-s-1vcpu-1gb-tor1-01.ssh > 198.96.85.21.65355: Flags [P.], seq 20836:21128, ack 1, win 313, length 292
20:37:56.255642 IP 198.96.85.21.65355 > ubuntu-s-1vcpu-1gb-tor1-01.ssh: Flags [.], ack 14024, win 3835, length 0
20:37:56.255653 IP 198.96.85.21.65355 > ubuntu-s-1vcpu-1gb-tor1-01.ssh: Flags [.], ack 14352, win 3839, length 0
20:37:56.255765 IP ubuntu-s-1vcpu-1gb-tor1-01.ssh > 198.96.85.21.65355: Flags [P.], seq 21128:21524, ack 1, win 313, length 396
20:37:56.255833 IP 198.96.85.21.65355 > ubuntu-s-1vcpu-1gb-tor1-01.ssh: Flags [.], ack 14680, win 3837, length 0
20:37:56.255843 IP 198.96.85.21.65355 > ubuntu-s-1vcpu-1gb-tor1-01.ssh: Flags [.], ack 15008, win 3836, length 0
20:37:56.255847 IP 198.96.85.21.65355 > ubuntu-s-1vcpu-1gb-tor1-01.ssh: Flags [.], ack 15336, win 3835, length 0
20:37:56.255981 IP ubuntu-s-1vcpu-1gb-tor1-01.ssh > 198.96.85.21.65355: Flags [P.], seq 21524:22032, ack 1, win 313, length 508
20:37:56.256145 IP ubuntu-s-1vcpu-1gb-tor1-01.ssh > 198.96.85.21.65355: Flags [P.], seq 22032:22196, ack 1, win 313, length 164
20:37:56.256183 IP 198.96.85.21.65355 > ubuntu-s-1vcpu-1gb-tor1-01.ssh: Flags [.], ack 15664, win 3839, length 0
20:37:56.256195 IP 198.96.85.21.65355 > ubuntu-s-1vcpu-1gb-tor1-01.ssh: Flags [.], ack 15992, win 3837, length 0
20:37:56.256366 IP ubuntu-s-1vcpu-1gb-tor1-01.ssh > 198.96.85.21.65355: Flags [P.], seq 22196:22592, ack 1, win 313, length 396
20:37:56.256479 IP ubuntu-s-1vcpu-1gb-tor1-01.ssh > 198.96.85.21.65355: Flags [P.], seq 22592:22756, ack 1, win 313, length 164
20:37:56.256576 IP ubuntu-s-1vcpu-1gb-tor1-01.ssh > 198.96.85.21.65355: Flags [P.], seq 22756:22920, ack 1, win 313, length 164
20:37:56.256675 IP ubuntu-s-1vcpu-1gb-tor1-01.ssh > 198.96.85.21.65355: Flags [P.], seq 22920:23084, ack 1, win 313, length 164
20:37:56.256771 IP ubuntu-s-1vcpu-1gb-tor1-01.ssh > 198.96.85.21.65355: Flags [P.], seq 23084:23248, ack 1, win 313, length 164
20:37:56.256954 IP ubuntu-s-1vcpu-1gb-tor1-01.ssh > 198.96.85.21.65355: Flags [P.], seq 23248:23412, ack 1, win 313, length 164
20:37:56.257143 IP ubuntu-s-1vcpu-1gb-tor1-01.ssh > 198.96.85.21.65355: Flags [P.], seq 23412:23576, ack 1, win 313, length 164
20:37:56.257261 IP ubuntu-s-1vcpu-1gb-tor1-01.ssh > 198.96.85.21.65355: Flags [P.], seq 23576:23740, ack 1, win 313, length 164
20:37:56.257363 IP ubuntu-s-1vcpu-1gb-tor1-01.ssh > 198.96.85.21.65355: Flags [P.], seq 23740:23904, ack 1, win 313, length 164
20:37:56.257460 IP ubuntu-s-1vcpu-1gb-tor1-01.ssh > 198.96.85.21.65355: Flags [P.], seq 23904:24068, ack 1, win 313, length 164
20:37:56.257555 IP ubuntu-s-1vcpu-1gb-tor1-01.ssh > 198.96.85.21.65355: Flags [P.], seq 24068:24232, ack 1, win 313, length 164
20:37:56.257673 IP ubuntu-s-1vcpu-1gb-tor1-01.ssh > 198.96.85.21.65355: Flags [P.], seq 24232:24396, ack 1, win 313, length 164
20:37:56.257809 IP ubuntu-s-1vcpu-1gb-tor1-01.ssh > 198.96.85.21.65355: Flags [P.], seq 24396:24560, ack 1, win 313, length 164
20:37:56.257930 IP ubuntu-s-1vcpu-1gb-tor1-01.ssh > 198.96.85.21.65355: Flags [P.], seq 24560:24724, ack 1, win 313, length 164
20:37:56.258098 IP ubuntu-s-1vcpu-1gb-tor1-01.ssh > 198.96.85.21.65355: Flags [P.], seq 24724:24888, ack 1, win 313, length 164
20:37:56.258218 IP ubuntu-s-1vcpu-1gb-tor1-01.ssh > 198.96.85.21.65355: Flags [P.], seq 24888:25052, ack 1, win 313, length 164
20:37:56.258318 IP ubuntu-s-1vcpu-1gb-tor1-01.ssh > 198.96.85.21.65355: Flags [P.], seq 25052:25216, ack 1, win 313, length 164
20:37:56.258414 IP ubuntu-s-1vcpu-1gb-tor1-01.ssh > 198.96.85.21.65355: Flags [P.], seq 25216:25380, ack 1, win 313, length 164
20:37:56.258509 IP ubuntu-s-1vcpu-1gb-tor1-01.ssh > 198.96.85.21.65355: Flags [P.], seq 25380:25544, ack 1, win 313, length 164
20:37:56.258639 IP ubuntu-s-1vcpu-1gb-tor1-01.ssh > 198.96.85.21.65355: Flags [P.], seq 25544:25708, ack 1, win 313, length 164
20:37:56.258739 IP ubuntu-s-1vcpu-1gb-tor1-01.ssh > 198.96.85.21.65355: Flags [P.], seq 25708:25872, ack 1, win 313, length 164
20:37:56.258836 IP ubuntu-s-1vcpu-1gb-tor1-01.ssh > 198.96.85.21.65355: Flags [P.], seq 25872:26036, ack 1, win 313, length 164
20:37:56.258959 IP ubuntu-s-1vcpu-1gb-tor1-01.ssh > 198.96.85.21.65355: Flags [P.], seq 26036:26200, ack 1, win 313, length 164
20:37:56.259058 IP ubuntu-s-1vcpu-1gb-tor1-01.ssh > 198.96.85.21.65355: Flags [P.], seq 26200:26364, ack 1, win 313, length 164
20:37:56.259153 IP ubuntu-s-1vcpu-1gb-tor1-01.ssh > 198.96.85.21.65355: Flags [P.], seq 26364:26528, ack 1, win 313, length 164
20:37:56.259247 IP ubuntu-s-1vcpu-1gb-tor1-01.ssh > 198.96.85.21.65355: Flags [P.], seq 26528:26692, ack 1, win 313, length 164
20:37:56.259341 IP ubuntu-s-1vcpu-1gb-tor1-01.ssh > 198.96.85.21.65355: Flags [P.], seq 26692:26856, ack 1, win 313, length 164
20:37:56.259437 IP ubuntu-s-1vcpu-1gb-tor1-01.ssh > 198.96.85.21.65355: Flags [P.], seq 26856:27020, ack 1, win 313, length 164
20:37:56.259531 IP ubuntu-s-1vcpu-1gb-tor1-01.ssh > 198.96.85.21.65355: Flags [P.], seq 27020:27184, ack 1, win 313, length 164
20:37:56.259625 IP ubuntu-s-1vcpu-1gb-tor1-01.ssh > 198.96.85.21.65355: Flags [P.], seq 27184:27348, ack 1, win 313, length 164
20:37:56.259721 IP ubuntu-s-1vcpu-1gb-tor1-01.ssh > 198.96.85.21.65355: Flags [P.], seq 27348:27512, ack 1, win 313, length 164
20:37:56.259815 IP ubuntu-s-1vcpu-1gb-tor1-01.ssh > 198.96.85.21.65355: Flags [P.], seq 27512:27676, ack 1, win 313, length 164
20:37:56.259910 IP ubuntu-s-1vcpu-1gb-tor1-01.ssh > 198.96.85.21.65355: Flags [P.], seq 27676:27840, ack 1, win 313, length 164
20:37:56.260052 IP ubuntu-s-1vcpu-1gb-tor1-01.ssh > 198.96.85.21.65355: Flags [P.], seq 27840:28004, ack 1, win 313, length 164
20:37:56.260184 IP ubuntu-s-1vcpu-1gb-tor1-01.ssh > 198.96.85.21.65355: Flags [P.], seq 28004:28168, ack 1, win 313, length 164
20:37:56.266788 IP 198.96.85.21.65355 > ubuntu-s-1vcpu-1gb-tor1-01.ssh: Flags [.], ack 16664, win 3835, length 0
20:37:56.266828 IP ubuntu-s-1vcpu-1gb-tor1-01.ssh > 198.96.85.21.65355: Flags [P.], seq 28168:28332, ack 1, win 313, length 164
20:37:56.266851 IP 198.96.85.21.65355 > ubuntu-s-1vcpu-1gb-tor1-01.ssh: Flags [.], ack 17104, win 3839, length 0
20:37:56.267039 IP 198.96.85.21.65355 > ubuntu-s-1vcpu-1gb-tor1-01.ssh: Flags [.], ack 17760, win 3836, length 0
20:37:56.267053 IP 198.96.85.21.65355 > ubuntu-s-1vcpu-1gb-tor1-01.ssh: Flags [.], ack 18320, win 3834, length 0
20:37:56.267058 IP 198.96.85.21.65355 > ubuntu-s-1vcpu-1gb-tor1-01.ssh: Flags [.], ack 18768, win 3839, length 0
20:37:56.267063 IP 198.96.85.21.65355 > ubuntu-s-1vcpu-1gb-tor1-01.ssh: Flags [.], ack 19680, win 3835, length 0
20:37:56.267090 IP 198.96.85.21.65355 > ubuntu-s-1vcpu-1gb-tor1-01.ssh: Flags [.], ack 20008, win 3834, length 0
20:37:56.267099 IP 198.96.85.21.65355 > ubuntu-s-1vcpu-1gb-tor1-01.ssh: Flags [.], ack 20440, win 3839, length 0
20:37:56.267155 IP 198.96.85.21.65355 > ubuntu-s-1vcpu-1gb-tor1-01.ssh: Flags [.], ack 21128, win 3836, length 0
20:37:56.267246 IP 198.96.85.21.65355 > ubuntu-s-1vcpu-1gb-tor1-01.ssh: Flags [.], ack 22592, win 3836, length 0
20:37:56.267303 IP 198.96.85.21.65355 > ubuntu-s-1vcpu-1gb-tor1-01.ssh: Flags [.], ack 22920, win 3835, length 0
20:37:56.267311 IP 198.96.85.21.65355 > ubuntu-s-1vcpu-1gb-tor1-01.ssh: Flags [.], ack 23248, win 3834, length 0
20:37:56.267411 IP 198.96.85.21.65355 > ubuntu-s-1vcpu-1gb-tor1-01.ssh: Flags [.], ack 23576, win 3839, length 0
20:37:56.267417 IP 198.96.85.21.65355 > ubuntu-s-1vcpu-1gb-tor1-01.ssh: Flags [.], ack 23904, win 3837, length 0
20:37:56.267421 IP 198.96.85.21.65355 > ubuntu-s-1vcpu-1gb-tor1-01.ssh: Flags [.], ack 24232, win 3836, length 0
20:37:56.267540 IP 198.96.85.21.65355 > ubuntu-s-1vcpu-1gb-tor1-01.ssh: Flags [.], ack 24560, win 3835, length 0
20:37:56.267555 IP 198.96.85.21.65355 > ubuntu-s-1vcpu-1gb-tor1-01.ssh: Flags [.], ack 24888, win 3839, length 0
20:37:56.267559 IP 198.96.85.21.65355 > ubuntu-s-1vcpu-1gb-tor1-01.ssh: Flags [.], ack 25216, win 3837, length 0
20:37:56.267601 IP ubuntu-s-1vcpu-1gb-tor1-01.ssh > 198.96.85.21.65355: Flags [P.], seq 28332:28728, ack 1, win 313, length 396
20:37:56.267663 IP ubuntu-s-1vcpu-1gb-tor1-01.ssh > 198.96.85.21.65355: Flags [P.], seq 28728:30244, ack 1, win 313, length 1516
20:37:56.267688 IP 198.96.85.21.65355 > ubuntu-s-1vcpu-1gb-tor1-01.ssh: Flags [.], ack 25544, win 3836, length 0
20:37:56.267764 IP 198.96.85.21.65355 > ubuntu-s-1vcpu-1gb-tor1-01.ssh: Flags [.], ack 25872, win 3835, length 0
20:37:56.267773 IP 198.96.85.21.65355 > ubuntu-s-1vcpu-1gb-tor1-01.ssh: Flags [.], ack 26200, win 3839, length 0
20:37:56.267866 IP 198.96.85.21.65355 > ubuntu-s-1vcpu-1gb-tor1-01.ssh: Flags [.], ack 26856, win 3836, length 0
20:37:56.267872 IP 198.96.85.21.65355 > ubuntu-s-1vcpu-1gb-tor1-01.ssh: Flags [.], ack 27184, win 3835, length 0
20:37:56.267876 IP 198.96.85.21.65355 > ubuntu-s-1vcpu-1gb-tor1-01.ssh: Flags [.], ack 27512, win 3839, length 0
20:37:56.268082 IP 198.96.85.21.65355 > ubuntu-s-1vcpu-1gb-tor1-01.ssh: Flags [.], ack 27840, win 3837, length 0
20:37:56.268097 IP 198.96.85.21.65355 > ubuntu-s-1vcpu-1gb-tor1-01.ssh: Flags [.], ack 28168, win 3836, length 0
20:37:56.268222 IP ubuntu-s-1vcpu-1gb-tor1-01.ssh > 198.96.85.21.65355: Flags [P.], seq 30244:31792, ack 1, win 313, length 1548
20:37:56.268342 IP ubuntu-s-1vcpu-1gb-tor1-01.ssh > 198.96.85.21.65355: Flags [P.], seq 31792:31956, ack 1, win 313, length 164
20:37:56.268444 IP ubuntu-s-1vcpu-1gb-tor1-01.ssh > 198.96.85.21.65355: Flags [P.], seq 31956:32120, ack 1, win 313, length 164
20:37:56.268543 IP ubuntu-s-1vcpu-1gb-tor1-01.ssh > 198.96.85.21.65355: Flags [P.], seq 32120:32284, ack 1, win 313, length 164
20:37:56.268642 IP ubuntu-s-1vcpu-1gb-tor1-01.ssh > 198.96.85.21.65355: Flags [P.], seq 32284:32448, ack 1, win 313, length 164
20:37:56.268745 IP ubuntu-s-1vcpu-1gb-tor1-01.ssh > 198.96.85.21.65355: Flags [P.], seq 32448:32612, ack 1, win 313, length 164
20:37:56.268850 IP ubuntu-s-1vcpu-1gb-tor1-01.ssh > 198.96.85.21.65355: Flags [P.], seq 32612:32776, ack 1, win 313, length 164
20:37:56.268977 IP ubuntu-s-1vcpu-1gb-tor1-01.ssh > 198.96.85.21.65355: Flags [P.], seq 32776:32940, ack 1, win 313, length 164
20:37:56.269095 IP ubuntu-s-1vcpu-1gb-tor1-01.ssh > 198.96.85.21.65355: Flags [P.], seq 32940:33104, ack 1, win 313, length 164
20:37:56.269211 IP ubuntu-s-1vcpu-1gb-tor1-01.ssh > 198.96.85.21.65355: Flags [P.], seq 33104:33268, ack 1, win 313, length 164
20:37:56.269322 IP ubuntu-s-1vcpu-1gb-tor1-01.ssh > 198.96.85.21.65355: Flags [P.], seq 33268:33432, ack 1, win 313, length 164
20:37:56.269421 IP ubuntu-s-1vcpu-1gb-tor1-01.ssh > 198.96.85.21.65355: Flags [P.], seq 33432:33596, ack 1, win 313, length 164
20:37:56.269515 IP ubuntu-s-1vcpu-1gb-tor1-01.ssh > 198.96.85.21.65355: Flags [P.], seq 33596:33760, ack 1, win 313, length 164
20:37:56.269609 IP ubuntu-s-1vcpu-1gb-tor1-01.ssh > 198.96.85.21.65355: Flags [P.], seq 33760:33924, ack 1, win 313, length 164
20:37:56.269703 IP ubuntu-s-1vcpu-1gb-tor1-01.ssh > 198.96.85.21.65355: Flags [P.], seq 33924:34088, ack 1, win 313, length 164
20:37:56.269796 IP ubuntu-s-1vcpu-1gb-tor1-01.ssh > 198.96.85.21.65355: Flags [P.], seq 34088:34252, ack 1, win 313, length 164
20:37:56.269892 IP ubuntu-s-1vcpu-1gb-tor1-01.ssh > 198.96.85.21.65355: Flags [P.], seq 34252:34416, ack 1, win 313, length 164
20:37:56.269998 IP ubuntu-s-1vcpu-1gb-tor1-01.ssh > 198.96.85.21.65355: Flags [P.], seq 34416:34580, ack 1, win 313, length 164
20:37:56.270096 IP ubuntu-s-1vcpu-1gb-tor1-01.ssh > 198.96.85.21.65355: Flags [P.], seq 34580:34744, ack 1, win 313, length 164
20:37:56.270199 IP ubuntu-s-1vcpu-1gb-tor1-01.ssh > 198.96.85.21.65355: Flags [P.], seq 34744:34908, ack 1, win 313, length 164
20:37:56.270294 IP ubuntu-s-1vcpu-1gb-tor1-01.ssh > 198.96.85.21.65355: Flags [P.], seq 34908:35072, ack 1, win 313, length 164
20:37:56.270389 IP ubuntu-s-1vcpu-1gb-tor1-01.ssh > 198.96.85.21.65355: Flags [P.], seq 35072:35236, ack 1, win 313, length 164
20:37:56.270484 IP ubuntu-s-1vcpu-1gb-tor1-01.ssh > 198.96.85.21.65355: Flags [P.], seq 35236:35400, ack 1, win 313, length 164
20:37:56.270580 IP ubuntu-s-1vcpu-1gb-tor1-01.ssh > 198.96.85.21.65355: Flags [P.], seq 35400:35564, ack 1, win 313, length 164
20:37:56.270709 IP ubuntu-s-1vcpu-1gb-tor1-01.ssh > 198.96.85.21.65355: Flags [P.], seq 35564:35728, ack 1, win 313, length 164
20:37:56.270807 IP ubuntu-s-1vcpu-1gb-tor1-01.ssh > 198.96.85.21.65355: Flags [P.], seq 35728:35892, ack 1, win 313, length 164
20:37:56.270950 IP ubuntu-s-1vcpu-1gb-tor1-01.ssh > 198.96.85.21.65355: Flags [P.], seq 35892:36056, ack 1, win 313, length 164
20:37:56.271054 IP ubuntu-s-1vcpu-1gb-tor1-01.ssh > 198.96.85.21.65355: Flags [P.], seq 36056:36220, ack 1, win 313, length 164
20:37:56.271150 IP ubuntu-s-1vcpu-1gb-tor1-01.ssh > 198.96.85.21.65355: Flags [P.], seq 36220:36384, ack 1, win 313, length 164
20:37:56.271255 IP ubuntu-s-1vcpu-1gb-tor1-01.ssh > 198.96.85.21.65355: Flags [P.], seq 36384:36548, ack 1, win 313, length 164
20:37:56.271384 IP ubuntu-s-1vcpu-1gb-tor1-01.ssh > 198.96.85.21.65355: Flags [P.], seq 36548:36712, ack 1, win 313, length 164
20:37:56.271485 IP ubuntu-s-1vcpu-1gb-tor1-01.ssh > 198.96.85.21.65355: Flags [P.], seq 36712:36876, ack 1, win 313, length 164
20:37:56.271581 IP ubuntu-s-1vcpu-1gb-tor1-01.ssh > 198.96.85.21.65355: Flags [P.], seq 36876:37040, ack 1, win 313, length 164
20:37:56.271675 IP ubuntu-s-1vcpu-1gb-tor1-01.ssh > 198.96.85.21.65355: Flags [P.], seq 37040:37204, ack 1, win 313, length 164
20:37:56.271770 IP ubuntu-s-1vcpu-1gb-tor1-01.ssh > 198.96.85.21.65355: Flags [P.], seq 37204:37368, ack 1, win 313, length 164
20:37:56.271864 IP ubuntu-s-1vcpu-1gb-tor1-01.ssh > 198.96.85.21.65355: Flags [P.], seq 37368:37532, ack 1, win 313, length 164
20:37:56.271960 IP ubuntu-s-1vcpu-1gb-tor1-01.ssh > 198.96.85.21.65355: Flags [P.], seq 37532:37696, ack 1, win 313, length 164
20:37:56.272054 IP ubuntu-s-1vcpu-1gb-tor1-01.ssh > 198.96.85.21.65355: Flags [P.], seq 37696:37860, ack 1, win 313, length 164
20:37:56.272148 IP ubuntu-s-1vcpu-1gb-tor1-01.ssh > 198.96.85.21.65355: Flags [P.], seq 37860:38024, ack 1, win 313, length 164
20:37:56.272243 IP ubuntu-s-1vcpu-1gb-tor1-01.ssh > 198.96.85.21.65355: Flags [P.], seq 38024:38188, ack 1, win 313, length 164
20:37:56.272337 IP ubuntu-s-1vcpu-1gb-tor1-01.ssh > 198.96.85.21.65355: Flags [P.], seq 38188:38352, ack 1, win 313, length 164
20:37:56.272455 IP ubuntu-s-1vcpu-1gb-tor1-01.ssh > 198.96.85.21.65355: Flags [P.], seq 38352:38516, ack 1, win 313, length 164
20:37:56.272550 IP ubuntu-s-1vcpu-1gb-tor1-01.ssh > 198.96.85.21.65355: Flags [P.], seq 38516:38680, ack 1, win 313, length 164
20:37:56.272645 IP ubuntu-s-1vcpu-1gb-tor1-01.ssh > 198.96.85.21.65355: Flags [P.], seq 38680:38844, ack 1, win 313, length 164
20:37:56.272781 IP ubuntu-s-1vcpu-1gb-tor1-01.ssh > 198.96.85.21.65355: Flags [P.], seq 38844:39008, ack 1, win 313, length 164
20:37:56.272893 IP ubuntu-s-1vcpu-1gb-tor1-01.ssh > 198.96.85.21.65355: Flags [P.], seq 39008:39172, ack 1, win 313, length 164
20:37:56.272997 IP ubuntu-s-1vcpu-1gb-tor1-01.ssh > 198.96.85.21.65355: Flags [P.], seq 39172:39336, ack 1, win 313, length 164
20:37:56.273118 IP ubuntu-s-1vcpu-1gb-tor1-01.ssh > 198.96.85.21.65355: Flags [P.], seq 39336:39500, ack 1, win 313, length 164
20:37:56.273220 IP ubuntu-s-1vcpu-1gb-tor1-01.ssh > 198.96.85.21.65355: Flags [P.], seq 39500:39664, ack 1, win 313, length 164
20:37:56.273317 IP ubuntu-s-1vcpu-1gb-tor1-01.ssh > 198.96.85.21.65355: Flags [P.], seq 39664:39828, ack 1, win 313, length 164
20:37:56.273416 IP ubuntu-s-1vcpu-1gb-tor1-01.ssh > 198.96.85.21.65355: Flags [P.], seq 39828:39992, ack 1, win 313, length 164
20:37:56.273520 IP ubuntu-s-1vcpu-1gb-tor1-01.ssh > 198.96.85.21.65355: Flags [P.], seq 39992:40156, ack 1, win 313, length 164
20:37:56.273616 IP ubuntu-s-1vcpu-1gb-tor1-01.ssh > 198.96.85.21.65355: Flags [P.], seq 40156:40320, ack 1, win 313, length 164
20:37:56.280792 IP 198.96.85.21.65355 > ubuntu-s-1vcpu-1gb-tor1-01.ssh: Flags [.], ack 28728, win 3834, length 0
20:37:56.280833 IP ubuntu-s-1vcpu-1gb-tor1-01.ssh > 198.96.85.21.65355: Flags [P.], seq 40320:40484, ack 1, win 313, length 164
20:37:56.281037 IP ubuntu-s-1vcpu-1gb-tor1-01.ssh > 198.96.85.21.65355: Flags [P.], seq 40484:40768, ack 1, win 313, length 284
20:37:56.281131 IP 198.96.85.21.65355 > ubuntu-s-1vcpu-1gb-tor1-01.ssh: Flags [.], ack 30244, win 3839, length 0
20:37:56.281150 IP 198.96.85.21.65355 > ubuntu-s-1vcpu-1gb-tor1-01.ssh: Flags [.], ack 31792, win 3839, length 0
20:37:56.281158 IP 198.96.85.21.65355 > ubuntu-s-1vcpu-1gb-tor1-01.ssh: Flags [.], ack 32120, win 3837, length 0
20:37:56.281163 IP 198.96.85.21.65355 > ubuntu-s-1vcpu-1gb-tor1-01.ssh: Flags [.], ack 32448, win 3836, length 0
20:37:56.281168 IP 198.96.85.21.65355 > ubuntu-s-1vcpu-1gb-tor1-01.ssh: Flags [.], ack 32776, win 3835, length 0
20:37:56.281173 IP 198.96.85.21.65355 > ubuntu-s-1vcpu-1gb-tor1-01.ssh: Flags [.], ack 33104, win 3839, length 0
20:37:56.281177 IP 198.96.85.21.65355 > ubuntu-s-1vcpu-1gb-tor1-01.ssh: Flags [.], ack 33432, win 3837, length 0
20:37:56.281389 IP ubuntu-s-1vcpu-1gb-tor1-01.ssh > 198.96.85.21.65355: Flags [P.], seq 40768:41732, ack 1, win 313, length 964
20:37:56.281457 IP 198.96.85.21.65355 > ubuntu-s-1vcpu-1gb-tor1-01.ssh: Flags [.], ack 34088, win 3835, length 0
20:37:56.281470 IP 198.96.85.21.65355 > ubuntu-s-1vcpu-1gb-tor1-01.ssh: Flags [.], ack 34416, win 3839, length 0
20:37:56.281475 IP 198.96.85.21.65355 > ubuntu-s-1vcpu-1gb-tor1-01.ssh: Flags [.], ack 34744, win 3837, length 0
20:37:56.281479 IP 198.96.85.21.65355 > ubuntu-s-1vcpu-1gb-tor1-01.ssh: Flags [.], ack 35072, win 3836, length 0
20:37:56.281483 IP 198.96.85.21.65355 > ubuntu-s-1vcpu-1gb-tor1-01.ssh: Flags [.], ack 35400, win 3835, length 0
20:37:56.281488 IP 198.96.85.21.65355 > ubuntu-s-1vcpu-1gb-tor1-01.ssh: Flags [.], ack 35728, win 3839, length 0
20:37:56.281759 IP ubuntu-s-1vcpu-1gb-tor1-01.ssh > 198.96.85.21.65355: Flags [P.], seq 41732:42584, ack 1, win 313, length 852
20:37:56.281905 IP 198.96.85.21.65355 > ubuntu-s-1vcpu-1gb-tor1-01.ssh: Flags [.], ack 36384, win 3836, length 0
20:37:56.281931 IP 198.96.85.21.65355 > ubuntu-s-1vcpu-1gb-tor1-01.ssh: Flags [.], ack 36712, win 3835, length 0
20:37:56.281939 IP 198.96.85.21.65355 > ubuntu-s-1vcpu-1gb-tor1-01.ssh: Flags [.], ack 37040, win 3839, length 0
20:37:56.281946 IP 198.96.85.21.65355 > ubuntu-s-1vcpu-1gb-tor1-01.ssh: Flags [.], ack 37368, win 3837, length 0
20:37:56.281952 IP 198.96.85.21.65355 > ubuntu-s-1vcpu-1gb-tor1-01.ssh: Flags [.], ack 37696, win 3836, length 0
20:37:56.281958 IP 198.96.85.21.65355 > ubuntu-s-1vcpu-1gb-tor1-01.ssh: Flags [.], ack 38024, win 3835, length 0
20:37:56.281999 IP ubuntu-s-1vcpu-1gb-tor1-01.ssh > 198.96.85.21.65355: Flags [P.], seq 42584:42748, ack 1, win 313, length 164
20:37:56.282180 IP 198.96.85.21.65355 > ubuntu-s-1vcpu-1gb-tor1-01.ssh: Flags [.], ack 38352, win 3839, length 0
20:37:56.282193 IP 198.96.85.21.65355 > ubuntu-s-1vcpu-1gb-tor1-01.ssh: Flags [.], ack 38680, win 3837, length 0
20:37:56.282199 IP 198.96.85.21.65355 > ubuntu-s-1vcpu-1gb-tor1-01.ssh: Flags [.], ack 39008, win 3836, length 0
20:37:56.282203 IP 198.96.85.21.65355 > ubuntu-s-1vcpu-1gb-tor1-01.ssh: Flags [.], ack 39336, win 3835, length 0
20:37:56.282245 IP 198.96.85.21.65355 > ubuntu-s-1vcpu-1gb-tor1-01.ssh: Flags [.], ack 39664, win 3839, length 0
20:37:56.282419 IP 198.96.85.21.65355 > ubuntu-s-1vcpu-1gb-tor1-01.ssh: Flags [.], ack 40320, win 3836, length 0
20:37:56.282492 IP ubuntu-s-1vcpu-1gb-tor1-01.ssh > 198.96.85.21.65355: Flags [P.], seq 42748:44168, ack 1, win 313, length 1420
20:37:56.282658 IP ubuntu-s-1vcpu-1gb-tor1-01.ssh > 198.96.85.21.65355: Flags [P.], seq 44168:44452, ack 1, win 313, length 284
20:37:56.282761 IP ubuntu-s-1vcpu-1gb-tor1-01.ssh > 198.96.85.21.65355: Flags [P.], seq 44452:44616, ack 1, win 313, length 164
20:37:56.282886 IP ubuntu-s-1vcpu-1gb-tor1-01.ssh > 198.96.85.21.65355: Flags [P.], seq 44616:44780, ack 1, win 313, length 164
20:37:56.282991 IP ubuntu-s-1vcpu-1gb-tor1-01.ssh > 198.96.85.21.65355: Flags [P.], seq 44780:44944, ack 1, win 313, length 164
20:37:56.283088 IP ubuntu-s-1vcpu-1gb-tor1-01.ssh > 198.96.85.21.65355: Flags [P.], seq 44944:45108, ack 1, win 313, length 164
20:37:56.283191 IP ubuntu-s-1vcpu-1gb-tor1-01.ssh > 198.96.85.21.65355: Flags [P.], seq 45108:45272, ack 1, win 313, length 164
20:37:56.283291 IP ubuntu-s-1vcpu-1gb-tor1-01.ssh > 198.96.85.21.65355: Flags [P.], seq 45272:45436, ack 1, win 313, length 164
20:37:56.283385 IP ubuntu-s-1vcpu-1gb-tor1-01.ssh > 198.96.85.21.65355: Flags [P.], seq 45436:45600, ack 1, win 313, length 164
20:37:56.283480 IP ubuntu-s-1vcpu-1gb-tor1-01.ssh > 198.96.85.21.65355: Flags [P.], seq 45600:45764, ack 1, win 313, length 164
20:37:56.283581 IP ubuntu-s-1vcpu-1gb-tor1-01.ssh > 198.96.85.21.65355: Flags [P.], seq 45764:45928, ack 1, win 313, length 164
20:37:56.283676 IP ubuntu-s-1vcpu-1gb-tor1-01.ssh > 198.96.85.21.65355: Flags [P.], seq 45928:46092, ack 1, win 313, length 164
20:37:56.283770 IP ubuntu-s-1vcpu-1gb-tor1-01.ssh > 198.96.85.21.65355: Flags [P.], seq 46092:46256, ack 1, win 313, length 164
20:37:56.283864 IP ubuntu-s-1vcpu-1gb-tor1-01.ssh > 198.96.85.21.65355: Flags [P.], seq 46256:46420, ack 1, win 313, length 164
20:37:56.283958 IP ubuntu-s-1vcpu-1gb-tor1-01.ssh > 198.96.85.21.65355: Flags [P.], seq 46420:46584, ack 1, win 313, length 164
20:37:56.284052 IP ubuntu-s-1vcpu-1gb-tor1-01.ssh > 198.96.85.21.65355: Flags [P.], seq 46584:46748, ack 1, win 313, length 164
20:37:56.284146 IP ubuntu-s-1vcpu-1gb-tor1-01.ssh > 198.96.85.21.65355: Flags [P.], seq 46748:46912, ack 1, win 313, length 164
20:37:56.284239 IP ubuntu-s-1vcpu-1gb-tor1-01.ssh > 198.96.85.21.65355: Flags [P.], seq 46912:47076, ack 1, win 313, length 164
20:37:56.284332 IP ubuntu-s-1vcpu-1gb-tor1-01.ssh > 198.96.85.21.65355: Flags [P.], seq 47076:47240, ack 1, win 313, length 164
20:37:56.284425 IP ubuntu-s-1vcpu-1gb-tor1-01.ssh > 198.96.85.21.65355: Flags [P.], seq 47240:47404, ack 1, win 313, length 164
20:37:56.284532 IP ubuntu-s-1vcpu-1gb-tor1-01.ssh > 198.96.85.21.65355: Flags [P.], seq 47404:47568, ack 1, win 313, length 164
20:37:56.284630 IP ubuntu-s-1vcpu-1gb-tor1-01.ssh > 198.96.85.21.65355: Flags [P.], seq 47568:47732, ack 1, win 313, length 164
20:37:56.284725 IP ubuntu-s-1vcpu-1gb-tor1-01.ssh > 198.96.85.21.65355: Flags [P.], seq 47732:47896, ack 1, win 313, length 164
20:37:56.284819 IP ubuntu-s-1vcpu-1gb-tor1-01.ssh > 198.96.85.21.65355: Flags [P.], seq 47896:48060, ack 1, win 313, length 164
20:37:56.284912 IP ubuntu-s-1vcpu-1gb-tor1-01.ssh > 198.96.85.21.65355: Flags [P.], seq 48060:48224, ack 1, win 313, length 164
20:37:56.285031 IP ubuntu-s-1vcpu-1gb-tor1-01.ssh > 198.96.85.21.65355: Flags [P.], seq 48224:48388, ack 1, win 313, length 164
20:37:56.285159 IP ubuntu-s-1vcpu-1gb-tor1-01.ssh > 198.96.85.21.65355: Flags [P.], seq 48388:48552, ack 1, win 313, length 164
20:37:56.285334 IP ubuntu-s-1vcpu-1gb-tor1-01.ssh > 198.96.85.21.65355: Flags [P.], seq 48552:48716, ack 1, win 313, length 164
20:37:56.285492 IP ubuntu-s-1vcpu-1gb-tor1-01.ssh > 198.96.85.21.65355: Flags [P.], seq 48716:48880, ack 1, win 313, length 164
20:37:56.285630 IP ubuntu-s-1vcpu-1gb-tor1-01.ssh > 198.96.85.21.65355: Flags [P.], seq 48880:49044, ack 1, win 313, length 164
20:37:56.285754 IP ubuntu-s-1vcpu-1gb-tor1-01.ssh > 198.96.85.21.65355: Flags [P.], seq 49044:49208, ack 1, win 313, length 164
20:37:56.285890 IP ubuntu-s-1vcpu-1gb-tor1-01.ssh > 198.96.85.21.65355: Flags [P.], seq 49208:49372, ack 1, win 313, length 164
20:37:56.285992 IP ubuntu-s-1vcpu-1gb-tor1-01.ssh > 198.96.85.21.65355: Flags [P.], seq 49372:49536, ack 1, win 313, length 164
20:37:56.286088 IP ubuntu-s-1vcpu-1gb-tor1-01.ssh > 198.96.85.21.65355: Flags [P.], seq 49536:49700, ack 1, win 313, length 164
20:37:56.286204 IP ubuntu-s-1vcpu-1gb-tor1-01.ssh > 198.96.85.21.65355: Flags [P.], seq 49700:49864, ack 1, win 313, length 164
20:37:56.286305 IP ubuntu-s-1vcpu-1gb-tor1-01.ssh > 198.96.85.21.65355: Flags [P.], seq 49864:50028, ack 1, win 313, length 164
20:37:56.286415 IP ubuntu-s-1vcpu-1gb-tor1-01.ssh > 198.96.85.21.65355: Flags [P.], seq 50028:50192, ack 1, win 313, length 164
20:37:56.286521 IP ubuntu-s-1vcpu-1gb-tor1-01.ssh > 198.96.85.21.65355: Flags [P.], seq 50192:50356, ack 1, win 313, length 164
20:37:56.286650 IP ubuntu-s-1vcpu-1gb-tor1-01.ssh > 198.96.85.21.65355: Flags [P.], seq 50356:50520, ack 1, win 313, length 164
20:37:56.286749 IP ubuntu-s-1vcpu-1gb-tor1-01.ssh > 198.96.85.21.65355: Flags [P.], seq 50520:50684, ack 1, win 313, length 164
20:37:56.286846 IP ubuntu-s-1vcpu-1gb-tor1-01.ssh > 198.96.85.21.65355: Flags [P.], seq 50684:50848, ack 1, win 313, length 164
20:37:56.286974 IP ubuntu-s-1vcpu-1gb-tor1-01.ssh > 198.96.85.21.65355: Flags [P.], seq 50848:51012, ack 1, win 313, length 164
20:37:56.287078 IP ubuntu-s-1vcpu-1gb-tor1-01.ssh > 198.96.85.21.65355: Flags [P.], seq 51012:51176, ack 1, win 313, length 164
20:37:56.287175 IP ubuntu-s-1vcpu-1gb-tor1-01.ssh > 198.96.85.21.65355: Flags [P.], seq 51176:51340, ack 1, win 313, length 164
20:37:56.287269 IP ubuntu-s-1vcpu-1gb-tor1-01.ssh > 198.96.85.21.65355: Flags [P.], seq 51340:51504, ack 1, win 313, length 164
20:37:56.287363 IP ubuntu-s-1vcpu-1gb-tor1-01.ssh > 198.96.85.21.65355: Flags [P.], seq 51504:51668, ack 1, win 313, length 164
20:37:56.287458 IP ubuntu-s-1vcpu-1gb-tor1-01.ssh > 198.96.85.21.65355: Flags [P.], seq 51668:51832, ack 1, win 313, length 164
20:37:56.287552 IP ubuntu-s-1vcpu-1gb-tor1-01.ssh > 198.96.85.21.65355: Flags [P.], seq 51832:51996, ack 1, win 313, length 164
20:37:56.287649 IP ubuntu-s-1vcpu-1gb-tor1-01.ssh > 198.96.85.21.65355: Flags [P.], seq 51996:52160, ack 1, win 313, length 164
20:37:56.287746 IP ubuntu-s-1vcpu-1gb-tor1-01.ssh > 198.96.85.21.65355: Flags [P.], seq 52160:52324, ack 1, win 313, length 164
20:37:56.287841 IP ubuntu-s-1vcpu-1gb-tor1-01.ssh > 198.96.85.21.65355: Flags [P.], seq 52324:52488, ack 1, win 313, length 164
20:37:56.287975 IP ubuntu-s-1vcpu-1gb-tor1-01.ssh > 198.96.85.21.65355: Flags [P.], seq 52488:52652, ack 1, win 313, length 164
20:37:56.295179 IP 198.96.85.21.65355 > ubuntu-s-1vcpu-1gb-tor1-01.ssh: Flags [.], ack 40768, win 3834, length 0
20:37:56.295219 IP ubuntu-s-1vcpu-1gb-tor1-01.ssh > 198.96.85.21.65355: Flags [P.], seq 52652:52816, ack 1, win 313, length 164
20:37:56.295244 IP 198.96.85.21.65355 > ubuntu-s-1vcpu-1gb-tor1-01.ssh: Flags [.], ack 42584, win 3839, length 0
20:37:56.295252 IP 198.96.85.21.65355 > ubuntu-s-1vcpu-1gb-tor1-01.ssh: Flags [.], ack 44048, win 3839, length 0
20:37:56.295258 IP 198.96.85.21.65355 > ubuntu-s-1vcpu-1gb-tor1-01.ssh: Flags [.], ack 44452, win 3837, length 0
20:37:56.295262 IP 198.96.85.21.65355 > ubuntu-s-1vcpu-1gb-tor1-01.ssh: Flags [.], ack 44780, win 3836, length 0
20:37:56.295267 IP 198.96.85.21.65355 > ubuntu-s-1vcpu-1gb-tor1-01.ssh: Flags [.], ack 45108, win 3834, length 0
20:37:56.295424 IP 198.96.85.21.65355 > ubuntu-s-1vcpu-1gb-tor1-01.ssh: Flags [.], ack 46420, win 3835, length 0
20:37:56.295436 IP 198.96.85.21.65355 > ubuntu-s-1vcpu-1gb-tor1-01.ssh: Flags [.], ack 46748, win 3839, length 0
20:37:56.295620 IP 198.96.85.21.65355 > ubuntu-s-1vcpu-1gb-tor1-01.ssh: Flags [.], ack 47732, win 3835, length 0
20:37:56.295634 IP 198.96.85.21.65355 > ubuntu-s-1vcpu-1gb-tor1-01.ssh: Flags [.], ack 48060, win 3839, length 0
20:37:56.295639 IP 198.96.85.21.65355 > ubuntu-s-1vcpu-1gb-tor1-01.ssh: Flags [.], ack 48388, win 3837, length 0
20:37:56.295703 IP ubuntu-s-1vcpu-1gb-tor1-01.ssh > 198.96.85.21.65355: Flags [P.], seq 52816:53892, ack 1, win 313, length 1076
20:37:56.295896 IP 198.96.85.21.65355 > ubuntu-s-1vcpu-1gb-tor1-01.ssh: Flags [.], ack 48716, win 3836, length 0
20:37:56.295910 IP 198.96.85.21.65355 > ubuntu-s-1vcpu-1gb-tor1-01.ssh: Flags [.], ack 49044, win 3835, length 0
20:37:56.295914 IP 198.96.85.21.65355 > ubuntu-s-1vcpu-1gb-tor1-01.ssh: Flags [.], ack 49372, win 3839, length 0
20:37:56.295919 IP 198.96.85.21.65355 > ubuntu-s-1vcpu-1gb-tor1-01.ssh: Flags [.], ack 49700, win 3837, length 0
20:37:56.295923 IP 198.96.85.21.65355 > ubuntu-s-1vcpu-1gb-tor1-01.ssh: Flags [.], ack 50028, win 3836, length 0
20:37:56.296014 IP 198.96.85.21.65355 > ubuntu-s-1vcpu-1gb-tor1-01.ssh: Flags [.], ack 50356, win 3835, length 0
20:37:56.296026 IP 198.96.85.21.65355 > ubuntu-s-1vcpu-1gb-tor1-01.ssh: Flags [.], ack 50684, win 3839, length 0
20:37:56.296048 IP 198.96.85.21.65355 > ubuntu-s-1vcpu-1gb-tor1-01.ssh: Flags [.], ack 51012, win 3837, length 0
20:37:56.296291 IP ubuntu-s-1vcpu-1gb-tor1-01.ssh > 198.96.85.21.65355: Flags [P.], seq 53892:54400, ack 1, win 313, length 508
20:37:56.296356 IP ubuntu-s-1vcpu-1gb-tor1-01.ssh > 198.96.85.21.65355: Flags [P.], seq 54400:55348, ack 1, win 313, length 948
20:37:56.296407 IP 198.96.85.21.65355 > ubuntu-s-1vcpu-1gb-tor1-01.ssh: Flags [.], ack 51668, win 3835, length 0
20:37:56.296419 IP 198.96.85.21.65355 > ubuntu-s-1vcpu-1gb-tor1-01.ssh: Flags [.], ack 51996, win 3839, length 0
20:37:56.296424 IP 198.96.85.21.65355 > ubuntu-s-1vcpu-1gb-tor1-01.ssh: Flags [.], ack 52324, win 3837, length 0
20:37:56.296428 IP 198.96.85.21.65355 > ubuntu-s-1vcpu-1gb-tor1-01.ssh: Flags [.], ack 52652, win 3836, length 0
20:37:56.296646 IP ubuntu-s-1vcpu-1gb-tor1-01.ssh > 198.96.85.21.65355: Flags [P.], seq 55348:56096, ack 1, win 313, length 748
20:37:56.296758 IP ubuntu-s-1vcpu-1gb-tor1-01.ssh > 198.96.85.21.65355: Flags [P.], seq 56096:56260, ack 1, win 313, length 164
20:37:56.296860 IP ubuntu-s-1vcpu-1gb-tor1-01.ssh > 198.96.85.21.65355: Flags [P.], seq 56260:56424, ack 1, win 313, length 164
20:37:56.296960 IP ubuntu-s-1vcpu-1gb-tor1-01.ssh > 198.96.85.21.65355: Flags [P.], seq 56424:56588, ack 1, win 313, length 164
20:37:56.297059 IP ubuntu-s-1vcpu-1gb-tor1-01.ssh > 198.96.85.21.65355: Flags [P.], seq 56588:56752, ack 1, win 313, length 164
20:37:56.297158 IP ubuntu-s-1vcpu-1gb-tor1-01.ssh > 198.96.85.21.65355: Flags [P.], seq 56752:56916, ack 1, win 313, length 164
20:37:56.297253 IP ubuntu-s-1vcpu-1gb-tor1-01.ssh > 198.96.85.21.65355: Flags [P.], seq 56916:57080, ack 1, win 313, length 164
20:37:56.297370 IP ubuntu-s-1vcpu-1gb-tor1-01.ssh > 198.96.85.21.65355: Flags [P.], seq 57080:57244, ack 1, win 313, length 164
20:37:56.297470 IP ubuntu-s-1vcpu-1gb-tor1-01.ssh > 198.96.85.21.65355: Flags [P.], seq 57244:57408, ack 1, win 313, length 164
20:37:56.297564 IP ubuntu-s-1vcpu-1gb-tor1-01.ssh > 198.96.85.21.65355: Flags [P.], seq 57408:57572, ack 1, win 313, length 164
20:37:56.297658 IP ubuntu-s-1vcpu-1gb-tor1-01.ssh > 198.96.85.21.65355: Flags [P.], seq 57572:57736, ack 1, win 313, length 164
20:37:56.297752 IP ubuntu-s-1vcpu-1gb-tor1-01.ssh > 198.96.85.21.65355: Flags [P.], seq 57736:57900, ack 1, win 313, length 164
20:37:56.297846 IP ubuntu-s-1vcpu-1gb-tor1-01.ssh > 198.96.85.21.65355: Flags [P.], seq 57900:58064, ack 1, win 313, length 164
20:37:56.297973 IP ubuntu-s-1vcpu-1gb-tor1-01.ssh > 198.96.85.21.65355: Flags [P.], seq 58064:58228, ack 1, win 313, length 164
20:37:56.298139 IP ubuntu-s-1vcpu-1gb-tor1-01.ssh > 198.96.85.21.65355: Flags [P.], seq 58228:58392, ack 1, win 313, length 164
20:37:56.298247 IP ubuntu-s-1vcpu-1gb-tor1-01.ssh > 198.96.85.21.65355: Flags [P.], seq 58392:58556, ack 1, win 313, length 164
20:37:56.298366 IP ubuntu-s-1vcpu-1gb-tor1-01.ssh > 198.96.85.21.65355: Flags [P.], seq 58556:58720, ack 1, win 313, length 164
20:37:56.298490 IP ubuntu-s-1vcpu-1gb-tor1-01.ssh > 198.96.85.21.65355: Flags [P.], seq 58720:58884, ack 1, win 313, length 164
20:37:56.298619 IP ubuntu-s-1vcpu-1gb-tor1-01.ssh > 198.96.85.21.65355: Flags [P.], seq 58884:59048, ack 1, win 313, length 164
20:37:56.298723 IP ubuntu-s-1vcpu-1gb-tor1-01.ssh > 198.96.85.21.65355: Flags [P.], seq 59048:59212, ack 1, win 313, length 164
20:37:56.298821 IP ubuntu-s-1vcpu-1gb-tor1-01.ssh > 198.96.85.21.65355: Flags [P.], seq 59212:59376, ack 1, win 313, length 164
20:37:56.298952 IP ubuntu-s-1vcpu-1gb-tor1-01.ssh > 198.96.85.21.65355: Flags [P.], seq 59376:59540, ack 1, win 313, length 164
20:37:56.299074 IP ubuntu-s-1vcpu-1gb-tor1-01.ssh > 198.96.85.21.65355: Flags [P.], seq 59540:59704, ack 1, win 313, length 164
20:37:56.299255 IP ubuntu-s-1vcpu-1gb-tor1-01.ssh > 198.96.85.21.65355: Flags [P.], seq 59704:59868, ack 1, win 313, length 164
20:37:56.299400 IP ubuntu-s-1vcpu-1gb-tor1-01.ssh > 198.96.85.21.65355: Flags [P.], seq 59868:60032, ack 1, win 313, length 164
20:37:56.299508 IP ubuntu-s-1vcpu-1gb-tor1-01.ssh > 198.96.85.21.65355: Flags [P.], seq 60032:60196, ack 1, win 313, length 164
20:37:56.299620 IP ubuntu-s-1vcpu-1gb-tor1-01.ssh > 198.96.85.21.65355: Flags [P.], seq 60196:60360, ack 1, win 313, length 164
20:37:56.299718 IP ubuntu-s-1vcpu-1gb-tor1-01.ssh > 198.96.85.21.65355: Flags [P.], seq 60360:60524, ack 1, win 313, length 164
20:37:56.299843 IP ubuntu-s-1vcpu-1gb-tor1-01.ssh > 198.96.85.21.65355: Flags [P.], seq 60524:60688, ack 1, win 313, length 164
20:37:56.299976 IP ubuntu-s-1vcpu-1gb-tor1-01.ssh > 198.96.85.21.65355: Flags [P.], seq 60688:60852, ack 1, win 313, length 164
20:37:56.300097 IP ubuntu-s-1vcpu-1gb-tor1-01.ssh > 198.96.85.21.65355: Flags [P.], seq 60852:61016, ack 1, win 313, length 164
20:37:56.300196 IP ubuntu-s-1vcpu-1gb-tor1-01.ssh > 198.96.85.21.65355: Flags [P.], seq 61016:61180, ack 1, win 313, length 164
20:37:56.300292 IP ubuntu-s-1vcpu-1gb-tor1-01.ssh > 198.96.85.21.65355: Flags [P.], seq 61180:61344, ack 1, win 313, length 164
20:37:56.300387 IP ubuntu-s-1vcpu-1gb-tor1-01.ssh > 198.96.85.21.65355: Flags [P.], seq 61344:61508, ack 1, win 313, length 164
20:37:56.300481 IP ubuntu-s-1vcpu-1gb-tor1-01.ssh > 198.96.85.21.65355: Flags [P.], seq 61508:61672, ack 1, win 313, length 164
20:37:56.300577 IP ubuntu-s-1vcpu-1gb-tor1-01.ssh > 198.96.85.21.65355: Flags [P.], seq 61672:61836, ack 1, win 313, length 164
20:37:56.300685 IP ubuntu-s-1vcpu-1gb-tor1-01.ssh > 198.96.85.21.65355: Flags [P.], seq 61836:62000, ack 1, win 313, length 164
20:37:56.300783 IP ubuntu-s-1vcpu-1gb-tor1-01.ssh > 198.96.85.21.65355: Flags [P.], seq 62000:62164, ack 1, win 313, length 164
20:37:56.300894 IP ubuntu-s-1vcpu-1gb-tor1-01.ssh > 198.96.85.21.65355: Flags [P.], seq 62164:62328, ack 1, win 313, length 164
20:37:56.300992 IP ubuntu-s-1vcpu-1gb-tor1-01.ssh > 198.96.85.21.65355: Flags [P.], seq 62328:62492, ack 1, win 313, length 164
20:37:56.301091 IP ubuntu-s-1vcpu-1gb-tor1-01.ssh > 198.96.85.21.65355: Flags [P.], seq 62492:62656, ack 1, win 313, length 164
20:37:56.301185 IP ubuntu-s-1vcpu-1gb-tor1-01.ssh > 198.96.85.21.65355: Flags [P.], seq 62656:62820, ack 1, win 313, length 164
20:37:56.301280 IP ubuntu-s-1vcpu-1gb-tor1-01.ssh > 198.96.85.21.65355: Flags [P.], seq 62820:62984, ack 1, win 313, length 164
20:37:56.301376 IP ubuntu-s-1vcpu-1gb-tor1-01.ssh > 198.96.85.21.65355: Flags [P.], seq 62984:63148, ack 1, win 313, length 164
20:37:56.301470 IP ubuntu-s-1vcpu-1gb-tor1-01.ssh > 198.96.85.21.65355: Flags [P.], seq 63148:63312, ack 1, win 313, length 164
20:37:56.301568 IP ubuntu-s-1vcpu-1gb-tor1-01.ssh > 198.96.85.21.65355: Flags [P.], seq 63312:63476, ack 1, win 313, length 164
20:37:56.301663 IP ubuntu-s-1vcpu-1gb-tor1-01.ssh > 198.96.85.21.65355: Flags [P.], seq 63476:63640, ack 1, win 313, length 164
20:37:56.301757 IP ubuntu-s-1vcpu-1gb-tor1-01.ssh > 198.96.85.21.65355: Flags [P.], seq 63640:63804, ack 1, win 313, length 164
20:37:56.301852 IP ubuntu-s-1vcpu-1gb-tor1-01.ssh > 198.96.85.21.65355: Flags [P.], seq 63804:63968, ack 1, win 313, length 164
20:37:56.301981 IP ubuntu-s-1vcpu-1gb-tor1-01.ssh > 198.96.85.21.65355: Flags [P.], seq 63968:64132, ack 1, win 313, length 164
20:37:56.302155 IP ubuntu-s-1vcpu-1gb-tor1-01.ssh > 198.96.85.21.65355: Flags [P.], seq 64132:64296, ack 1, win 313, length 164
20:37:56.302294 IP ubuntu-s-1vcpu-1gb-tor1-01.ssh > 198.96.85.21.65355: Flags [P.], seq 64296:64460, ack 1, win 313, length 164
20:37:56.302399 IP ubuntu-s-1vcpu-1gb-tor1-01.ssh > 198.96.85.21.65355: Flags [P.], seq 64460:64624, ack 1, win 313, length 164
20:37:56.302496 IP ubuntu-s-1vcpu-1gb-tor1-01.ssh > 198.96.85.21.65355: Flags [P.], seq 64624:64788, ack 1, win 313, length 164
20:37:56.312802 IP 198.96.85.21.65355 > ubuntu-s-1vcpu-1gb-tor1-01.ssh: Flags [.], ack 53892, win 3839, length 0
20:37:56.312859 IP ubuntu-s-1vcpu-1gb-tor1-01.ssh > 198.96.85.21.65355: Flags [P.], seq 64788:64952, ack 1, win 313, length 164
20:37:56.312893 IP 198.96.85.21.65355 > ubuntu-s-1vcpu-1gb-tor1-01.ssh: Flags [.], ack 55348, win 3839, length 0
20:37:56.312903 IP 198.96.85.21.65355 > ubuntu-s-1vcpu-1gb-tor1-01.ssh: Flags [.], ack 56260, win 3835, length 0
20:37:56.312910 IP 198.96.85.21.65355 > ubuntu-s-1vcpu-1gb-tor1-01.ssh: Flags [.], ack 56588, win 3834, length 0
20:37:56.313132 IP 198.96.85.21.65355 > ubuntu-s-1vcpu-1gb-tor1-01.ssh: Flags [.], ack 56916, win 3839, length 0
20:37:56.313155 IP 198.96.85.21.65355 > ubuntu-s-1vcpu-1gb-tor1-01.ssh: Flags [.], ack 57244, win 3837, length 0
20:37:56.313163 IP 198.96.85.21.65355 > ubuntu-s-1vcpu-1gb-tor1-01.ssh: Flags [.], ack 57572, win 3836, length 0
20:37:56.313169 IP 198.96.85.21.65355 > ubuntu-s-1vcpu-1gb-tor1-01.ssh: Flags [.], ack 57900, win 3835, length 0
20:37:56.313569 IP 198.96.85.21.65355 > ubuntu-s-1vcpu-1gb-tor1-01.ssh: Flags [.], ack 59212, win 3835, length 0
20:37:56.313586 IP 198.96.85.21.65355 > ubuntu-s-1vcpu-1gb-tor1-01.ssh: Flags [.], ack 59540, win 3839, length 0
20:37:56.313590 IP 198.96.85.21.65355 > ubuntu-s-1vcpu-1gb-tor1-01.ssh: Flags [.], ack 59868, win 3837, length 0
20:37:56.313594 IP 198.96.85.21.65355 > ubuntu-s-1vcpu-1gb-tor1-01.ssh: Flags [.], ack 60196, win 3836, length 0
20:37:56.313598 IP 198.96.85.21.65355 > ubuntu-s-1vcpu-1gb-tor1-01.ssh: Flags [.], ack 60524, win 3835, length 0
20:37:56.313601 IP 198.96.85.21.65355 > ubuntu-s-1vcpu-1gb-tor1-01.ssh: Flags [.], ack 60852, win 3839, length 0
20:37:56.313605 IP 198.96.85.21.65355 > ubuntu-s-1vcpu-1gb-tor1-01.ssh: Flags [.], ack 61180, win 3837, length 0
20:37:56.314122 IP ubuntu-s-1vcpu-1gb-tor1-01.ssh > 198.96.85.21.65355: Flags [P.], seq 66028:66864, ack 1, win 313, length 836
20:37:56.314176 IP 198.96.85.21.65355 > ubuntu-s-1vcpu-1gb-tor1-01.ssh: Flags [.], ack 62820, win 3836, length 0
20:37:56.314187 IP 198.96.85.21.65355 > ubuntu-s-1vcpu-1gb-tor1-01.ssh: Flags [.], ack 63148, win 3835, length 0
20:37:56.314194 IP 198.96.85.21.65355 > ubuntu-s-1vcpu-1gb-tor1-01.ssh: Flags [P.], seq 1:37, ack 63312, win 3834, length 36
20:37:56.314200 IP 198.96.85.21.65355 > ubuntu-s-1vcpu-1gb-tor1-01.ssh: Flags [.], ack 63640, win 3839, length 0
20:37:56.314204 IP 198.96.85.21.65355 > ubuntu-s-1vcpu-1gb-tor1-01.ssh: Flags [.], ack 63968, win 3837, length 0
20:37:56.314208 IP 198.96.85.21.65355 > ubuntu-s-1vcpu-1gb-tor1-01.ssh: Flags [.], ack 64296, win 3836, length 0
20:37:56.314709 IP ubuntu-s-1vcpu-1gb-tor1-01.ssh > 198.96.85.21.65355: Flags [P.], seq 66864:67724, ack 37, win 313, length 860
20:37:56.314907 IP ubuntu-s-1vcpu-1gb-tor1-01.ssh > 198.96.85.21.65355: Flags [P.], seq 67724:67888, ack 37, win 313, length 164
20:37:56.315053 IP ubuntu-s-1vcpu-1gb-tor1-01.ssh > 198.96.85.21.65355: Flags [P.], seq 67888:68052, ack 37, win 313, length 164
20:37:56.315240 IP ubuntu-s-1vcpu-1gb-tor1-01.ssh > 198.96.85.21.65355: Flags [P.], seq 68052:68216, ack 37, win 313, length 164
20:37:56.315417 IP ubuntu-s-1vcpu-1gb-tor1-01.ssh > 198.96.85.21.65355: Flags [P.], seq 68216:68380, ack 37, win 313, length 164
20:37:56.315595 IP ubuntu-s-1vcpu-1gb-tor1-01.ssh > 198.96.85.21.65355: Flags [P.], seq 68380:68544, ack 37, win 313, length 164
20:37:56.315817 IP ubuntu-s-1vcpu-1gb-tor1-01.ssh > 198.96.85.21.65355: Flags [P.], seq 68544:68708, ack 37, win 313, length 164
20:37:56.315995 IP ubuntu-s-1vcpu-1gb-tor1-01.ssh > 198.96.85.21.65355: Flags [P.], seq 68708:68872, ack 37, win 313, length 164
20:37:56.316176 IP ubuntu-s-1vcpu-1gb-tor1-01.ssh > 198.96.85.21.65355: Flags [P.], seq 68872:69036, ack 37, win 313, length 164
20:37:56.316332 IP ubuntu-s-1vcpu-1gb-tor1-01.ssh > 198.96.85.21.65355: Flags [P.], seq 69036:69200, ack 37, win 313, length 164
20:37:56.316441 IP ubuntu-s-1vcpu-1gb-tor1-01.ssh > 198.96.85.21.65355: Flags [P.], seq 69200:69364, ack 37, win 313, length 164
20:37:56.316538 IP ubuntu-s-1vcpu-1gb-tor1-01.ssh > 198.96.85.21.65355: Flags [P.], seq 69364:69528, ack 37, win 313, length 164
20:37:56.316634 IP ubuntu-s-1vcpu-1gb-tor1-01.ssh > 198.96.85.21.65355: Flags [P.], seq 69528:69692, ack 37, win 313, length 164
20:37:56.316729 IP ubuntu-s-1vcpu-1gb-tor1-01.ssh > 198.96.85.21.65355: Flags [P.], seq 69692:69856, ack 37, win 313, length 164
20:37:56.316824 IP ubuntu-s-1vcpu-1gb-tor1-01.ssh > 198.96.85.21.65355: Flags [P.], seq 69856:70020, ack 37, win 313, length 164
20:37:56.316918 IP ubuntu-s-1vcpu-1gb-tor1-01.ssh > 198.96.85.21.65355: Flags [P.], seq 70020:70184, ack 37, win 313, length 164
20:37:56.317012 IP ubuntu-s-1vcpu-1gb-tor1-01.ssh > 198.96.85.21.65355: Flags [P.], seq 70184:70348, ack 37, win 313, length 164
20:37:56.317108 IP ubuntu-s-1vcpu-1gb-tor1-01.ssh > 198.96.85.21.65355: Flags [P.], seq 70348:70512, ack 37, win 313, length 164
20:37:56.317202 IP ubuntu-s-1vcpu-1gb-tor1-01.ssh > 198.96.85.21.65355: Flags [P.], seq 70512:70676, ack 37, win 313, length 164
20:37:56.317297 IP ubuntu-s-1vcpu-1gb-tor1-01.ssh > 198.96.85.21.65355: Flags [P.], seq 70676:70840, ack 37, win 313, length 164
20:37:56.317391 IP ubuntu-s-1vcpu-1gb-tor1-01.ssh > 198.96.85.21.65355: Flags [P.], seq 70840:71004, ack 37, win 313, length 164
20:37:56.317489 IP ubuntu-s-1vcpu-1gb-tor1-01.ssh > 198.96.85.21.65355: Flags [P.], seq 71004:71168, ack 37, win 313, length 164
20:37:56.317583 IP ubuntu-s-1vcpu-1gb-tor1-01.ssh > 198.96.85.21.65355: Flags [P.], seq 71168:71332, ack 37, win 313, length 164
20:37:56.317677 IP ubuntu-s-1vcpu-1gb-tor1-01.ssh > 198.96.85.21.65355: Flags [P.], seq 71332:71496, ack 37, win 313, length 164
20:37:56.317771 IP ubuntu-s-1vcpu-1gb-tor1-01.ssh > 198.96.85.21.65355: Flags [P.], seq 71496:71660, ack 37, win 313, length 164
20:37:56.317865 IP ubuntu-s-1vcpu-1gb-tor1-01.ssh > 198.96.85.21.65355: Flags [P.], seq 71660:71824, ack 37, win 313, length 164
20:37:56.317980 IP ubuntu-s-1vcpu-1gb-tor1-01.ssh > 198.96.85.21.65355: Flags [P.], seq 71824:71988, ack 37, win 313, length 164
20:37:56.318140 IP ubuntu-s-1vcpu-1gb-tor1-01.ssh > 198.96.85.21.65355: Flags [P.], seq 71988:72152, ack 37, win 313, length 164
20:37:56.318264 IP ubuntu-s-1vcpu-1gb-tor1-01.ssh > 198.96.85.21.65355: Flags [P.], seq 72152:72316, ack 37, win 313, length 164
20:37:56.318366 IP ubuntu-s-1vcpu-1gb-tor1-01.ssh > 198.96.85.21.65355: Flags [P.], seq 72316:72480, ack 37, win 313, length 164
20:37:56.318463 IP ubuntu-s-1vcpu-1gb-tor1-01.ssh > 198.96.85.21.65355: Flags [P.], seq 72480:72644, ack 37, win 313, length 164
20:37:56.318558 IP ubuntu-s-1vcpu-1gb-tor1-01.ssh > 198.96.85.21.65355: Flags [P.], seq 72644:72808, ack 37, win 313, length 164
20:37:56.318692 IP ubuntu-s-1vcpu-1gb-tor1-01.ssh > 198.96.85.21.65355: Flags [P.], seq 72808:72972, ack 37, win 313, length 164
20:37:56.318800 IP ubuntu-s-1vcpu-1gb-tor1-01.ssh > 198.96.85.21.65355: Flags [P.], seq 72972:73136, ack 37, win 313, length 164
20:37:56.318925 IP ubuntu-s-1vcpu-1gb-tor1-01.ssh > 198.96.85.21.65355: Flags [P.], seq 73136:73300, ack 37, win 313, length 164
20:37:56.319036 IP ubuntu-s-1vcpu-1gb-tor1-01.ssh > 198.96.85.21.65355: Flags [P.], seq 73300:73464, ack 37, win 313, length 164
20:37:56.319227 IP ubuntu-s-1vcpu-1gb-tor1-01.ssh > 198.96.85.21.65355: Flags [P.], seq 73464:73628, ack 37, win 313, length 164
20:37:56.319398 IP ubuntu-s-1vcpu-1gb-tor1-01.ssh > 198.96.85.21.65355: Flags [P.], seq 73628:73792, ack 37, win 313, length 164
20:37:56.319542 IP ubuntu-s-1vcpu-1gb-tor1-01.ssh > 198.96.85.21.65355: Flags [P.], seq 73792:73956, ack 37, win 313, length 164
20:37:56.319642 IP ubuntu-s-1vcpu-1gb-tor1-01.ssh > 198.96.85.21.65355: Flags [P.], seq 73956:74120, ack 37, win 313, length 164
20:37:56.319739 IP ubuntu-s-1vcpu-1gb-tor1-01.ssh > 198.96.85.21.65355: Flags [P.], seq 74120:74284, ack 37, win 313, length 164
20:37:56.319842 IP ubuntu-s-1vcpu-1gb-tor1-01.ssh > 198.96.85.21.65355: Flags [P.], seq 74284:74448, ack 37, win 313, length 164
20:37:56.319940 IP ubuntu-s-1vcpu-1gb-tor1-01.ssh > 198.96.85.21.65355: Flags [P.], seq 74448:74612, ack 37, win 313, length 164
20:37:56.320035 IP ubuntu-s-1vcpu-1gb-tor1-01.ssh > 198.96.85.21.65355: Flags [P.], seq 74612:74776, ack 37, win 313, length 164
20:37:56.320129 IP ubuntu-s-1vcpu-1gb-tor1-01.ssh > 198.96.85.21.65355: Flags [P.], seq 74776:74940, ack 37, win 313, length 164
20:37:56.320225 IP ubuntu-s-1vcpu-1gb-tor1-01.ssh > 198.96.85.21.65355: Flags [P.], seq 74940:75104, ack 37, win 313, length 164
20:37:56.320320 IP ubuntu-s-1vcpu-1gb-tor1-01.ssh > 198.96.85.21.65355: Flags [P.], seq 75104:75268, ack 37, win 313, length 164
20:37:56.320414 IP ubuntu-s-1vcpu-1gb-tor1-01.ssh > 198.96.85.21.65355: Flags [P.], seq 75268:75432, ack 37, win 313, length 164
20:37:56.320513 IP ubuntu-s-1vcpu-1gb-tor1-01.ssh > 198.96.85.21.65355: Flags [P.], seq 75432:75596, ack 37, win 313, length 164
20:37:56.320608 IP ubuntu-s-1vcpu-1gb-tor1-01.ssh > 198.96.85.21.65355: Flags [P.], seq 75596:75760, ack 37, win 313, length 164
20:37:56.320705 IP ubuntu-s-1vcpu-1gb-tor1-01.ssh > 198.96.85.21.65355: Flags [P.], seq 75760:75924, ack 37, win 313, length 164
20:37:56.320800 IP ubuntu-s-1vcpu-1gb-tor1-01.ssh > 198.96.85.21.65355: Flags [P.], seq 75924:76088, ack 37, win 313, length 164
20:37:56.320894 IP ubuntu-s-1vcpu-1gb-tor1-01.ssh > 198.96.85.21.65355: Flags [P.], seq 76088:76252, ack 37, win 313, length 164
20:37:56.320996 IP ubuntu-s-1vcpu-1gb-tor1-01.ssh > 198.96.85.21.65355: Flags [P.], seq 76252:76416, ack 37, win 313, length 164
20:37:56.321094 IP ubuntu-s-1vcpu-1gb-tor1-01.ssh > 198.96.85.21.65355: Flags [P.], seq 76416:76580, ack 37, win 313, length 164
20:37:56.321195 IP ubuntu-s-1vcpu-1gb-tor1-01.ssh > 198.96.85.21.65355: Flags [P.], seq 76580:76744, ack 37, win 313, length 164
20:37:56.326788 IP 198.96.85.21.65355 > ubuntu-s-1vcpu-1gb-tor1-01.ssh: Flags [.], ack 64952, win 3839, length 0
20:37:56.326828 IP ubuntu-s-1vcpu-1gb-tor1-01.ssh > 198.96.85.21.65355: Flags [P.], seq 76744:76908, ack 37, win 313, length 164
20:37:56.326889 IP 198.96.85.21.65355 > ubuntu-s-1vcpu-1gb-tor1-01.ssh: Flags [.], ack 66864, win 3839, length 0
20:37:56.326974 IP 198.96.85.21.65355 > ubuntu-s-1vcpu-1gb-tor1-01.ssh: Flags [.], ack 67888, win 3835, length 0
20:37:56.326995 IP 198.96.85.21.65355 > ubuntu-s-1vcpu-1gb-tor1-01.ssh: Flags [.], ack 68216, win 3839, length 0
20:37:56.327003 IP 198.96.85.21.65355 > ubuntu-s-1vcpu-1gb-tor1-01.ssh: Flags [.], ack 68544, win 3837, length 0
20:37:56.327009 IP 198.96.85.21.65355 > ubuntu-s-1vcpu-1gb-tor1-01.ssh: Flags [.], ack 68872, win 3836, length 0
20:37:56.327336 IP 198.96.85.21.65355 > ubuntu-s-1vcpu-1gb-tor1-01.ssh: Flags [.], ack 69200, win 3835, length 0
20:37:56.327361 IP 198.96.85.21.65355 > ubuntu-s-1vcpu-1gb-tor1-01.ssh: Flags [.], ack 69528, win 3839, length 0
20:37:56.327368 IP 198.96.85.21.65355 > ubuntu-s-1vcpu-1gb-tor1-01.ssh: Flags [.], ack 69856, win 3837, length 0
20:37:56.327375 IP 198.96.85.21.65355 > ubuntu-s-1vcpu-1gb-tor1-01.ssh: Flags [.], ack 70184, win 3836, length 0
20:37:56.327382 IP 198.96.85.21.65355 > ubuntu-s-1vcpu-1gb-tor1-01.ssh: Flags [.], ack 70512, win 3835, length 0
20:37:56.327476 IP ubuntu-s-1vcpu-1gb-tor1-01.ssh > 198.96.85.21.65355: Flags [P.], seq 76908:77760, ack 37, win 313, length 852
20:37:56.327626 IP 198.96.85.21.65355 > ubuntu-s-1vcpu-1gb-tor1-01.ssh: Flags [.], ack 70840, win 3839, length 0
20:37:56.327704 IP 198.96.85.21.65355 > ubuntu-s-1vcpu-1gb-tor1-01.ssh: Flags [.], ack 72480, win 3837, length 0
20:37:56.327782 IP 198.96.85.21.65355 > ubuntu-s-1vcpu-1gb-tor1-01.ssh: Flags [.], ack 72808, win 3836, length 0
20:37:56.328006 IP 198.96.85.21.65355 > ubuntu-s-1vcpu-1gb-tor1-01.ssh: Flags [.], ack 74776, win 3839, length 0
20:37:56.328020 IP 198.96.85.21.65355 > ubuntu-s-1vcpu-1gb-tor1-01.ssh: Flags [.], ack 75104, win 3837, length 0
20:37:56.328099 IP 198.96.85.21.65355 > ubuntu-s-1vcpu-1gb-tor1-01.ssh: Flags [.], ack 75432, win 3836, length 0
20:37:56.328219 IP 198.96.85.21.65355 > ubuntu-s-1vcpu-1gb-tor1-01.ssh: Flags [.], ack 76088, win 3839, length 0
20:37:56.328387 IP 198.96.85.21.65355 > ubuntu-s-1vcpu-1gb-tor1-01.ssh: Flags [.], ack 76744, win 3836, length 0
20:37:56.328655 IP ubuntu-s-1vcpu-1gb-tor1-01.ssh > 198.96.85.21.65355: Flags [P.], seq 77760:79412, ack 37, win 313, length 1652
20:37:56.328862 IP ubuntu-s-1vcpu-1gb-tor1-01.ssh > 198.96.85.21.65355: Flags [P.], seq 79412:79584, ack 37, win 313, length 172
20:37:56.329063 IP ubuntu-s-1vcpu-1gb-tor1-01.ssh > 198.96.85.21.65355: Flags [P.], seq 79584:79748, ack 37, win 313, length 164
20:37:56.329191 IP ubuntu-s-1vcpu-1gb-tor1-01.ssh > 198.96.85.21.65355: Flags [P.], seq 79748:79912, ack 37, win 313, length 164
20:37:56.329294 IP ubuntu-s-1vcpu-1gb-tor1-01.ssh > 198.96.85.21.65355: Flags [P.], seq 79912:80076, ack 37, win 313, length 164
20:37:56.329393 IP ubuntu-s-1vcpu-1gb-tor1-01.ssh > 198.96.85.21.65355: Flags [P.], seq 80076:80240, ack 37, win 313, length 164
20:37:56.329564 IP ubuntu-s-1vcpu-1gb-tor1-01.ssh > 198.96.85.21.65355: Flags [P.], seq 80240:80404, ack 37, win 313, length 164
20:37:56.329749 IP ubuntu-s-1vcpu-1gb-tor1-01.ssh > 198.96.85.21.65355: Flags [P.], seq 80404:80568, ack 37, win 313, length 164
20:37:56.329897 IP ubuntu-s-1vcpu-1gb-tor1-01.ssh > 198.96.85.21.65355: Flags [P.], seq 80568:80732, ack 37, win 313, length 164
20:37:56.330005 IP ubuntu-s-1vcpu-1gb-tor1-01.ssh > 198.96.85.21.65355: Flags [P.], seq 80732:80896, ack 37, win 313, length 164
20:37:56.330125 IP ubuntu-s-1vcpu-1gb-tor1-01.ssh > 198.96.85.21.65355: Flags [P.], seq 80896:81060, ack 37, win 313, length 164
20:37:56.330226 IP ubuntu-s-1vcpu-1gb-tor1-01.ssh > 198.96.85.21.65355: Flags [P.], seq 81060:81224, ack 37, win 313, length 164
20:37:56.330410 IP ubuntu-s-1vcpu-1gb-tor1-01.ssh > 198.96.85.21.65355: Flags [P.], seq 81224:81388, ack 37, win 313, length 164
20:37:56.330637 IP ubuntu-s-1vcpu-1gb-tor1-01.ssh > 198.96.85.21.65355: Flags [P.], seq 81388:81552, ack 37, win 313, length 164
20:37:56.330805 IP ubuntu-s-1vcpu-1gb-tor1-01.ssh > 198.96.85.21.65355: Flags [P.], seq 81552:81716, ack 37, win 313, length 164
20:37:56.331017 IP ubuntu-s-1vcpu-1gb-tor1-01.ssh > 198.96.85.21.65355: Flags [P.], seq 81716:81880, ack 37, win 313, length 164
20:37:56.331201 IP ubuntu-s-1vcpu-1gb-tor1-01.ssh > 198.96.85.21.65355: Flags [P.], seq 81880:82044, ack 37, win 313, length 164
20:37:56.331371 IP ubuntu-s-1vcpu-1gb-tor1-01.ssh > 198.96.85.21.65355: Flags [P.], seq 82044:82208, ack 37, win 313, length 164
20:37:56.331555 IP ubuntu-s-1vcpu-1gb-tor1-01.ssh > 198.96.85.21.65355: Flags [P.], seq 82208:82372, ack 37, win 313, length 164
20:37:56.331739 IP ubuntu-s-1vcpu-1gb-tor1-01.ssh > 198.96.85.21.65355: Flags [P.], seq 82372:82536, ack 37, win 313, length 164
20:37:56.331912 IP ubuntu-s-1vcpu-1gb-tor1-01.ssh > 198.96.85.21.65355: Flags [P.], seq 82536:82700, ack 37, win 313, length 164
20:37:56.332076 IP ubuntu-s-1vcpu-1gb-tor1-01.ssh > 198.96.85.21.65355: Flags [P.], seq 82700:82864, ack 37, win 313, length 164
20:37:56.332196 IP ubuntu-s-1vcpu-1gb-tor1-01.ssh > 198.96.85.21.65355: Flags [P.], seq 82864:83028, ack 37, win 313, length 164
20:37:56.332296 IP ubuntu-s-1vcpu-1gb-tor1-01.ssh > 198.96.85.21.65355: Flags [P.], seq 83028:83192, ack 37, win 313, length 164
20:37:56.332392 IP ubuntu-s-1vcpu-1gb-tor1-01.ssh > 198.96.85.21.65355: Flags [P.], seq 83192:83356, ack 37, win 313, length 164
20:37:56.332487 IP ubuntu-s-1vcpu-1gb-tor1-01.ssh > 198.96.85.21.65355: Flags [P.], seq 83356:83520, ack 37, win 313, length 164
20:37:56.332637 IP ubuntu-s-1vcpu-1gb-tor1-01.ssh > 198.96.85.21.65355: Flags [P.], seq 83520:83684, ack 37, win 313, length 164
20:37:56.332820 IP ubuntu-s-1vcpu-1gb-tor1-01.ssh > 198.96.85.21.65355: Flags [P.], seq 83684:83848, ack 37, win 313, length 164
20:37:56.332973 IP ubuntu-s-1vcpu-1gb-tor1-01.ssh > 198.96.85.21.65355: Flags [P.], seq 83848:84012, ack 37, win 313, length 164
20:37:56.333094 IP ubuntu-s-1vcpu-1gb-tor1-01.ssh > 198.96.85.21.65355: Flags [P.], seq 84012:84176, ack 37, win 313, length 164
20:37:56.333214 IP ubuntu-s-1vcpu-1gb-tor1-01.ssh > 198.96.85.21.65355: Flags [P.], seq 84176:84340, ack 37, win 313, length 164
20:37:56.333337 IP ubuntu-s-1vcpu-1gb-tor1-01.ssh > 198.96.85.21.65355: Flags [P.], seq 84340:84504, ack 37, win 313, length 164
20:37:56.333460 IP ubuntu-s-1vcpu-1gb-tor1-01.ssh > 198.96.85.21.65355: Flags [P.], seq 84504:84668, ack 37, win 313, length 164
20:37:56.333606 IP ubuntu-s-1vcpu-1gb-tor1-01.ssh > 198.96.85.21.65355: Flags [P.], seq 84668:84832, ack 37, win 313, length 164
20:37:56.333761 IP ubuntu-s-1vcpu-1gb-tor1-01.ssh > 198.96.85.21.65355: Flags [P.], seq 84832:84996, ack 37, win 313, length 164
20:37:56.333956 IP ubuntu-s-1vcpu-1gb-tor1-01.ssh > 198.96.85.21.65355: Flags [P.], seq 84996:85160, ack 37, win 313, length 164
20:37:56.334117 IP ubuntu-s-1vcpu-1gb-tor1-01.ssh > 198.96.85.21.65355: Flags [P.], seq 85160:85324, ack 37, win 313, length 164
20:37:56.334267 IP ubuntu-s-1vcpu-1gb-tor1-01.ssh > 198.96.85.21.65355: Flags [P.], seq 85324:85488, ack 37, win 313, length 164
20:37:56.334413 IP ubuntu-s-1vcpu-1gb-tor1-01.ssh > 198.96.85.21.65355: Flags [P.], seq 85488:85652, ack 37, win 313, length 164
20:37:56.334561 IP ubuntu-s-1vcpu-1gb-tor1-01.ssh > 198.96.85.21.65355: Flags [P.], seq 85652:85816, ack 37, win 313, length 164
20:37:56.334745 IP ubuntu-s-1vcpu-1gb-tor1-01.ssh > 198.96.85.21.65355: Flags [P.], seq 85816:85980, ack 37, win 313, length 164
20:37:56.334932 IP ubuntu-s-1vcpu-1gb-tor1-01.ssh > 198.96.85.21.65355: Flags [P.], seq 85980:86144, ack 37, win 313, length 164
20:37:56.335090 IP ubuntu-s-1vcpu-1gb-tor1-01.ssh > 198.96.85.21.65355: Flags [P.], seq 86144:86308, ack 37, win 313, length 164
20:37:56.335240 IP ubuntu-s-1vcpu-1gb-tor1-01.ssh > 198.96.85.21.65355: Flags [P.], seq 86308:86472, ack 37, win 313, length 164
20:37:56.335391 IP ubuntu-s-1vcpu-1gb-tor1-01.ssh > 198.96.85.21.65355: Flags [P.], seq 86472:86636, ack 37, win 313, length 164
20:37:56.335537 IP ubuntu-s-1vcpu-1gb-tor1-01.ssh > 198.96.85.21.65355: Flags [P.], seq 86636:86800, ack 37, win 313, length 164
20:37:56.335687 IP ubuntu-s-1vcpu-1gb-tor1-01.ssh > 198.96.85.21.65355: Flags [P.], seq 86800:86964, ack 37, win 313, length 164
20:37:56.335851 IP ubuntu-s-1vcpu-1gb-tor1-01.ssh > 198.96.85.21.65355: Flags [P.], seq 86964:87128, ack 37, win 313, length 164
20:37:56.336009 IP ubuntu-s-1vcpu-1gb-tor1-01.ssh > 198.96.85.21.65355: Flags [P.], seq 87128:87292, ack 37, win 313, length 164
20:37:56.336182 IP ubuntu-s-1vcpu-1gb-tor1-01.ssh > 198.96.85.21.65355: Flags [P.], seq 87292:87456, ack 37, win 313, length 164
20:37:56.336336 IP ubuntu-s-1vcpu-1gb-tor1-01.ssh > 198.96.85.21.65355: Flags [P.], seq 87456:87620, ack 37, win 313, length 164
20:37:56.336500 IP ubuntu-s-1vcpu-1gb-tor1-01.ssh > 198.96.85.21.65355: Flags [P.], seq 87620:87784, ack 37, win 313, length 164
20:37:56.336659 IP ubuntu-s-1vcpu-1gb-tor1-01.ssh > 198.96.85.21.65355: Flags [P.], seq 87784:87948, ack 37, win 313, length 164
20:37:56.336811 IP ubuntu-s-1vcpu-1gb-tor1-01.ssh > 198.96.85.21.65355: Flags [P.], seq 87948:88112, ack 37, win 313, length 164
20:37:56.336960 IP ubuntu-s-1vcpu-1gb-tor1-01.ssh > 198.96.85.21.65355: Flags [P.], seq 88112:88276, ack 37, win 313, length 164
20:37:56.337115 IP ubuntu-s-1vcpu-1gb-tor1-01.ssh > 198.96.85.21.65355: Flags [P.], seq 88276:88440, ack 37, win 313, length 164
20:37:56.337280 IP ubuntu-s-1vcpu-1gb-tor1-01.ssh > 198.96.85.21.65355: Flags [P.], seq 88440:88604, ack 37, win 313, length 164
20:37:56.341003 IP 198.96.85.21.65355 > ubuntu-s-1vcpu-1gb-tor1-01.ssh: Flags [.], ack 77760, win 3839, length 0
20:37:56.341043 IP ubuntu-s-1vcpu-1gb-tor1-01.ssh > 198.96.85.21.65355: Flags [P.], seq 88604:88768, ack 37, win 313, length 164
20:37:56.341077 IP 198.96.85.21.65355 > ubuntu-s-1vcpu-1gb-tor1-01.ssh: Flags [.], ack 79412, win 3839, length 0
20:37:56.341087 IP 198.96.85.21.65355 > ubuntu-s-1vcpu-1gb-tor1-01.ssh: Flags [.], ack 79748, win 3837, length 0
20:37:56.341389 IP 198.96.85.21.65355 > ubuntu-s-1vcpu-1gb-tor1-01.ssh: Flags [.], ack 80076, win 3836, length 0
20:37:56.341413 IP 198.96.85.21.65355 > ubuntu-s-1vcpu-1gb-tor1-01.ssh: Flags [.], ack 80404, win 3835, length 0
20:37:56.341422 IP 198.96.85.21.65355 > ubuntu-s-1vcpu-1gb-tor1-01.ssh: Flags [P.], seq 37:73, ack 80404, win 3835, length 36
20:37:56.341430 IP 198.96.85.21.65355 > ubuntu-s-1vcpu-1gb-tor1-01.ssh: Flags [.], ack 80896, win 3839, length 0
20:37:56.341438 IP 198.96.85.21.65355 > ubuntu-s-1vcpu-1gb-tor1-01.ssh: Flags [.], ack 81060, win 3838, length 0
20:37:56.341444 IP 198.96.85.21.65355 > ubuntu-s-1vcpu-1gb-tor1-01.ssh: Flags [.], ack 81388, win 3837, length 0
20:37:56.341476 IP 198.96.85.21.65355 > ubuntu-s-1vcpu-1gb-tor1-01.ssh: Flags [.], ack 81716, win 3835, length 0
^C
589 packets captured
662 packets received by filter
66 packets dropped by kernel
