root@ubuntu-s-1vcpu-1gb-tor1-01:~# tcpdump -i eth0 tcp
tcpdump: verbose output suppressed, use -v or -vv for full protocol decode
listening on eth0, link-type EN10MB (Ethernet), capture size 262144 bytes
20:36:42.255346 IP ubuntu-s-1vcpu-1gb-tor1-01.ssh > 198.96.85.21.65355: Flags [P.], seq 2053227854:2053227962, ack 3366063118, win 313, length 108
20:36:42.255476 IP ubuntu-s-1vcpu-1gb-tor1-01.ssh > 198.96.85.21.65355: Flags [P.], seq 108:144, ack 1, win 313, length 36
20:36:42.255594 IP ubuntu-s-1vcpu-1gb-tor1-01.ssh > 198.96.85.21.65355: Flags [P.], seq 144:252, ack 1, win 313, length 108
20:36:42.255684 IP ubuntu-s-1vcpu-1gb-tor1-01.ssh > 198.96.85.21.65355: Flags [P.], seq 252:288, ack 1, win 313, length 36
20:36:42.257511 IP ubuntu-s-1vcpu-1gb-tor1-01.ssh > 198.96.85.21.65355: Flags [P.], seq 288:468, ack 1, win 313, length 180
20:36:42.257636 IP ubuntu-s-1vcpu-1gb-tor1-01.ssh > 198.96.85.21.65355: Flags [P.], seq 468:504, ack 1, win 313, length 36
20:36:42.257767 IP ubuntu-s-1vcpu-1gb-tor1-01.ssh > 198.96.85.21.65355: Flags [P.], seq 504:660, ack 1, win 313, length 156
20:36:42.257859 IP ubuntu-s-1vcpu-1gb-tor1-01.ssh > 198.96.85.21.65355: Flags [P.], seq 660:696, ack 1, win 313, length 36
20:36:42.257976 IP ubuntu-s-1vcpu-1gb-tor1-01.ssh > 198.96.85.21.65355: Flags [P.], seq 696:860, ack 1, win 313, length 164
20:36:42.266110 IP 198.96.85.21.65355 > ubuntu-s-1vcpu-1gb-tor1-01.ssh: Flags [.], ack 108, win 3834, length 0
20:36:42.266150 IP ubuntu-s-1vcpu-1gb-tor1-01.ssh > 198.96.85.21.65355: Flags [P.], seq 860:2072, ack 1, win 313, length 1212
20:36:42.266191 IP 198.96.85.21.65355 > ubuntu-s-1vcpu-1gb-tor1-01.ssh: Flags [.], ack 252, win 3839, length 0
20:36:42.266352 IP ubuntu-s-1vcpu-1gb-tor1-01.ssh > 198.96.85.21.65355: Flags [P.], seq 2072:2220, ack 1, win 313, length 148
20:36:42.266448 IP ubuntu-s-1vcpu-1gb-tor1-01.ssh > 198.96.85.21.65355: Flags [P.], seq 2220:2256, ack 1, win 313, length 36
20:36:42.266555 IP ubuntu-s-1vcpu-1gb-tor1-01.ssh > 198.96.85.21.65355: Flags [P.], seq 2256:2420, ack 1, win 313, length 164
20:36:42.266688 IP ubuntu-s-1vcpu-1gb-tor1-01.ssh > 198.96.85.21.65355: Flags [P.], seq 2420:2456, ack 1, win 313, length 36
20:36:42.266837 IP ubuntu-s-1vcpu-1gb-tor1-01.ssh > 198.96.85.21.65355: Flags [P.], seq 2456:2604, ack 1, win 313, length 148
20:36:42.266912 IP ubuntu-s-1vcpu-1gb-tor1-01.ssh > 198.96.85.21.65355: Flags [P.], seq 2604:2640, ack 1, win 313, length 36
20:36:42.267034 IP ubuntu-s-1vcpu-1gb-tor1-01.ssh > 198.96.85.21.65355: Flags [P.], seq 2640:2804, ack 1, win 313, length 164
20:36:42.277920 IP 198.96.85.21.65355 > ubuntu-s-1vcpu-1gb-tor1-01.ssh: Flags [.], ack 468, win 3838, length 0
20:36:42.277955 IP ubuntu-s-1vcpu-1gb-tor1-01.ssh > 198.96.85.21.65355: Flags [P.], seq 2804:4040, ack 1, win 313, length 1236
20:36:42.277980 IP 198.96.85.21.65355 > ubuntu-s-1vcpu-1gb-tor1-01.ssh: Flags [.], ack 660, win 3837, length 0
20:36:42.278149 IP ubuntu-s-1vcpu-1gb-tor1-01.ssh > 198.96.85.21.65355: Flags [P.], seq 4040:4188, ack 1, win 313, length 148
20:36:42.278171 IP 198.96.85.21.65355 > ubuntu-s-1vcpu-1gb-tor1-01.ssh: Flags [.], ack 860, win 3836, length 0
20:36:42.278179 IP 198.96.85.21.65355 > ubuntu-s-1vcpu-1gb-tor1-01.ssh: Flags [.], ack 2220, win 3839, length 0
20:36:42.278290 IP ubuntu-s-1vcpu-1gb-tor1-01.ssh > 198.96.85.21.65355: Flags [P.], seq 4188:4224, ack 1, win 313, length 36
20:36:42.278406 IP ubuntu-s-1vcpu-1gb-tor1-01.ssh > 198.96.85.21.65355: Flags [P.], seq 4224:4388, ack 1, win 313, length 164
20:36:42.278643 IP ubuntu-s-1vcpu-1gb-tor1-01.ssh > 198.96.85.21.65355: Flags [P.], seq 4424:4572, ack 1, win 313, length 148
20:36:42.278776 IP 198.96.85.21.65355 > ubuntu-s-1vcpu-1gb-tor1-01.ssh: Flags [.], ack 2804, win 3836, length 0
20:36:42.279036 IP ubuntu-s-1vcpu-1gb-tor1-01.ssh > 198.96.85.21.65355: Flags [P.], seq 4808:4956, ack 1, win 313, length 148
20:36:42.279283 IP ubuntu-s-1vcpu-1gb-tor1-01.ssh > 198.96.85.21.65355: Flags [P.], seq 4992:5140, ack 1, win 313, length 148
20:36:42.279488 IP ubuntu-s-1vcpu-1gb-tor1-01.ssh > 198.96.85.21.65355: Flags [P.], seq 5176:5340, ack 1, win 313, length 164
20:36:42.279644 IP ubuntu-s-1vcpu-1gb-tor1-01.ssh > 198.96.85.21.65355: Flags [P.], seq 5376:5540, ack 1, win 313, length 164
20:36:42.279859 IP ubuntu-s-1vcpu-1gb-tor1-01.ssh > 198.96.85.21.65355: Flags [P.], seq 5576:5740, ack 1, win 313, length 164
20:36:42.280127 IP ubuntu-s-1vcpu-1gb-tor1-01.ssh > 198.96.85.21.65355: Flags [P.], seq 5776:5924, ack 1, win 313, length 148
20:36:42.280296 IP ubuntu-s-1vcpu-1gb-tor1-01.ssh > 198.96.85.21.65355: Flags [P.], seq 5960:6124, ack 1, win 313, length 164
20:36:42.280451 IP ubuntu-s-1vcpu-1gb-tor1-01.ssh > 198.96.85.21.65355: Flags [P.], seq 6160:6324, ack 1, win 313, length 164
20:36:42.280603 IP ubuntu-s-1vcpu-1gb-tor1-01.ssh > 198.96.85.21.65355: Flags [P.], seq 6360:6524, ack 1, win 313, length 164
20:36:42.280757 IP ubuntu-s-1vcpu-1gb-tor1-01.ssh > 198.96.85.21.65355: Flags [P.], seq 6560:6724, ack 1, win 313, length 164
20:36:42.291389 IP 198.96.85.21.65355 > ubuntu-s-1vcpu-1gb-tor1-01.ssh: Flags [.], ack 4188, win 3839, length 0
20:36:42.291431 IP ubuntu-s-1vcpu-1gb-tor1-01.ssh > 198.96.85.21.65355: Flags [P.], seq 6724:7960, ack 1, win 313, length 1236
20:36:42.291458 IP 198.96.85.21.65355 > ubuntu-s-1vcpu-1gb-tor1-01.ssh: Flags [.], ack 4388, win 3838, length 0
20:36:42.291625 IP ubuntu-s-1vcpu-1gb-tor1-01.ssh > 198.96.85.21.65355: Flags [P.], seq 7960:8108, ack 1, win 313, length 148
20:36:42.291666 IP 198.96.85.21.65355 > ubuntu-s-1vcpu-1gb-tor1-01.ssh: Flags [.], ack 4572, win 3837, length 0
20:36:42.291679 IP 198.96.85.21.65355 > ubuntu-s-1vcpu-1gb-tor1-01.ssh: Flags [.], ack 4772, win 3836, length 0
20:36:42.291911 IP ubuntu-s-1vcpu-1gb-tor1-01.ssh > 198.96.85.21.65355: Flags [P.], seq 8108:8744, ack 1, win 313, length 636
20:36:42.292012 IP 198.96.85.21.65355 > ubuntu-s-1vcpu-1gb-tor1-01.ssh: Flags [.], ack 4956, win 3836, length 0
20:36:42.292024 IP 198.96.85.21.65355 > ubuntu-s-1vcpu-1gb-tor1-01.ssh: Flags [.], ack 5140, win 3835, length 0
20:36:42.292029 IP 198.96.85.21.65355 > ubuntu-s-1vcpu-1gb-tor1-01.ssh: Flags [.], ack 5340, win 3834, length 0
20:36:42.292075 IP ubuntu-s-1vcpu-1gb-tor1-01.ssh > 198.96.85.21.65355: Flags [P.], seq 8744:8908, ack 1, win 313, length 164
20:36:42.292311 IP 198.96.85.21.65355 > ubuntu-s-1vcpu-1gb-tor1-01.ssh: Flags [.], ack 5540, win 3839, length 0
20:36:42.292333 IP 198.96.85.21.65355 > ubuntu-s-1vcpu-1gb-tor1-01.ssh: Flags [.], ack 5740, win 3838, length 0
20:36:42.292370 IP ubuntu-s-1vcpu-1gb-tor1-01.ssh > 198.96.85.21.65355: Flags [P.], seq 8908:9408, ack 1, win 313, length 500
20:36:42.292530 IP ubuntu-s-1vcpu-1gb-tor1-01.ssh > 198.96.85.21.65355: Flags [P.], seq 9408:9796, ack 1, win 313, length 388
20:36:42.292621 IP 198.96.85.21.65355 > ubuntu-s-1vcpu-1gb-tor1-01.ssh: Flags [.], ack 5924, win 3837, length 0
20:36:42.292633 IP 198.96.85.21.65355 > ubuntu-s-1vcpu-1gb-tor1-01.ssh: Flags [.], ack 6124, win 3836, length 0
20:36:42.292637 IP 198.96.85.21.65355 > ubuntu-s-1vcpu-1gb-tor1-01.ssh: Flags [.], ack 6324, win 3836, length 0
20:36:42.292677 IP ubuntu-s-1vcpu-1gb-tor1-01.ssh > 198.96.85.21.65355: Flags [P.], seq 9796:9960, ack 1, win 313, length 164
20:36:42.292871 IP ubuntu-s-1vcpu-1gb-tor1-01.ssh > 198.96.85.21.65355: Flags [P.], seq 9960:10460, ack 1, win 313, length 500
20:36:42.292954 IP 198.96.85.21.65355 > ubuntu-s-1vcpu-1gb-tor1-01.ssh: Flags [.], ack 6524, win 3835, length 0
20:36:42.292967 IP 198.96.85.21.65355 > ubuntu-s-1vcpu-1gb-tor1-01.ssh: Flags [.], ack 6724, win 3834, length 0
20:36:42.293090 IP ubuntu-s-1vcpu-1gb-tor1-01.ssh > 198.96.85.21.65355: Flags [P.], seq 10460:10848, ack 1, win 313, length 388
20:36:42.293252 IP ubuntu-s-1vcpu-1gb-tor1-01.ssh > 198.96.85.21.65355: Flags [P.], seq 10848:11012, ack 1, win 313, length 164
20:36:42.293411 IP ubuntu-s-1vcpu-1gb-tor1-01.ssh > 198.96.85.21.65355: Flags [P.], seq 11012:11176, ack 1, win 313, length 164
20:36:42.293539 IP ubuntu-s-1vcpu-1gb-tor1-01.ssh > 198.96.85.21.65355: Flags [P.], seq 11176:11340, ack 1, win 313, length 164
20:36:42.293661 IP ubuntu-s-1vcpu-1gb-tor1-01.ssh > 198.96.85.21.65355: Flags [P.], seq 11340:11504, ack 1, win 313, length 164
20:36:42.293777 IP ubuntu-s-1vcpu-1gb-tor1-01.ssh > 198.96.85.21.65355: Flags [P.], seq 11504:11668, ack 1, win 313, length 164
20:36:42.293908 IP ubuntu-s-1vcpu-1gb-tor1-01.ssh > 198.96.85.21.65355: Flags [P.], seq 11668:11832, ack 1, win 313, length 164
20:36:42.294017 IP ubuntu-s-1vcpu-1gb-tor1-01.ssh > 198.96.85.21.65355: Flags [P.], seq 11832:11996, ack 1, win 313, length 164
20:36:42.294120 IP ubuntu-s-1vcpu-1gb-tor1-01.ssh > 198.96.85.21.65355: Flags [P.], seq 11996:12160, ack 1, win 313, length 164
20:36:42.294222 IP ubuntu-s-1vcpu-1gb-tor1-01.ssh > 198.96.85.21.65355: Flags [P.], seq 12160:12324, ack 1, win 313, length 164
20:36:42.294330 IP ubuntu-s-1vcpu-1gb-tor1-01.ssh > 198.96.85.21.65355: Flags [P.], seq 12324:12488, ack 1, win 313, length 164
20:36:42.294434 IP ubuntu-s-1vcpu-1gb-tor1-01.ssh > 198.96.85.21.65355: Flags [P.], seq 12488:12652, ack 1, win 313, length 164
20:36:42.294538 IP ubuntu-s-1vcpu-1gb-tor1-01.ssh > 198.96.85.21.65355: Flags [P.], seq 12652:12816, ack 1, win 313, length 164
20:36:42.294681 IP ubuntu-s-1vcpu-1gb-tor1-01.ssh > 198.96.85.21.65355: Flags [P.], seq 12816:12980, ack 1, win 313, length 164
20:36:42.294789 IP ubuntu-s-1vcpu-1gb-tor1-01.ssh > 198.96.85.21.65355: Flags [P.], seq 12980:13144, ack 1, win 313, length 164
20:36:42.294892 IP ubuntu-s-1vcpu-1gb-tor1-01.ssh > 198.96.85.21.65355: Flags [P.], seq 13144:13308, ack 1, win 313, length 164
20:36:42.295049 IP ubuntu-s-1vcpu-1gb-tor1-01.ssh > 198.96.85.21.65355: Flags [P.], seq 13308:13472, ack 1, win 313, length 164
20:36:42.295162 IP ubuntu-s-1vcpu-1gb-tor1-01.ssh > 198.96.85.21.65355: Flags [P.], seq 13472:13636, ack 1, win 313, length 164
20:36:42.295260 IP ubuntu-s-1vcpu-1gb-tor1-01.ssh > 198.96.85.21.65355: Flags [P.], seq 13636:13800, ack 1, win 313, length 164
20:36:42.295358 IP ubuntu-s-1vcpu-1gb-tor1-01.ssh > 198.96.85.21.65355: Flags [P.], seq 13800:13964, ack 1, win 313, length 164
20:36:42.295459 IP ubuntu-s-1vcpu-1gb-tor1-01.ssh > 198.96.85.21.65355: Flags [P.], seq 13964:14128, ack 1, win 313, length 164
20:36:42.295555 IP ubuntu-s-1vcpu-1gb-tor1-01.ssh > 198.96.85.21.65355: Flags [P.], seq 14128:14292, ack 1, win 313, length 164
20:36:42.295651 IP ubuntu-s-1vcpu-1gb-tor1-01.ssh > 198.96.85.21.65355: Flags [P.], seq 14292:14456, ack 1, win 313, length 164
20:36:42.295746 IP ubuntu-s-1vcpu-1gb-tor1-01.ssh > 198.96.85.21.65355: Flags [P.], seq 14456:14620, ack 1, win 313, length 164
20:36:42.295842 IP ubuntu-s-1vcpu-1gb-tor1-01.ssh > 198.96.85.21.65355: Flags [P.], seq 14620:14784, ack 1, win 313, length 164
20:36:42.295937 IP ubuntu-s-1vcpu-1gb-tor1-01.ssh > 198.96.85.21.65355: Flags [P.], seq 14784:14948, ack 1, win 313, length 164
20:36:42.296032 IP ubuntu-s-1vcpu-1gb-tor1-01.ssh > 198.96.85.21.65355: Flags [P.], seq 14948:15112, ack 1, win 313, length 164
20:36:42.296141 IP ubuntu-s-1vcpu-1gb-tor1-01.ssh > 198.96.85.21.65355: Flags [P.], seq 15112:15276, ack 1, win 313, length 164
20:36:42.296238 IP ubuntu-s-1vcpu-1gb-tor1-01.ssh > 198.96.85.21.65355: Flags [P.], seq 15276:15440, ack 1, win 313, length 164
20:36:42.296334 IP ubuntu-s-1vcpu-1gb-tor1-01.ssh > 198.96.85.21.65355: Flags [P.], seq 15440:15604, ack 1, win 313, length 164
20:36:42.296430 IP ubuntu-s-1vcpu-1gb-tor1-01.ssh > 198.96.85.21.65355: Flags [P.], seq 15604:15768, ack 1, win 313, length 164
20:36:42.296526 IP ubuntu-s-1vcpu-1gb-tor1-01.ssh > 198.96.85.21.65355: Flags [P.], seq 15768:15932, ack 1, win 313, length 164
20:36:42.296666 IP ubuntu-s-1vcpu-1gb-tor1-01.ssh > 198.96.85.21.65355: Flags [P.], seq 15932:16096, ack 1, win 313, length 164
20:36:42.296839 IP ubuntu-s-1vcpu-1gb-tor1-01.ssh > 198.96.85.21.65355: Flags [P.], seq 16096:16260, ack 1, win 313, length 164
20:36:42.305789 IP 198.96.85.21.65355 > ubuntu-s-1vcpu-1gb-tor1-01.ssh: Flags [.], ack 8108, win 3839, length 0
20:36:42.305828 IP ubuntu-s-1vcpu-1gb-tor1-01.ssh > 198.96.85.21.65355: Flags [P.], seq 16260:16424, ack 1, win 313, length 164
20:36:42.305946 IP 198.96.85.21.65355 > ubuntu-s-1vcpu-1gb-tor1-01.ssh: Flags [.], ack 8908, win 3835, length 0
20:36:42.305958 IP 198.96.85.21.65355 > ubuntu-s-1vcpu-1gb-tor1-01.ssh: Flags [.], ack 9796, win 3839, length 0
20:36:42.306114 IP ubuntu-s-1vcpu-1gb-tor1-01.ssh > 198.96.85.21.65355: Flags [P.], seq 16424:16932, ack 1, win 313, length 508
20:36:42.306237 IP ubuntu-s-1vcpu-1gb-tor1-01.ssh > 198.96.85.21.65355: Flags [P.], seq 16932:17096, ack 1, win 313, length 164
20:36:42.306339 IP ubuntu-s-1vcpu-1gb-tor1-01.ssh > 198.96.85.21.65355: Flags [P.], seq 17096:17260, ack 1, win 313, length 164
20:36:42.306422 IP 198.96.85.21.65355 > ubuntu-s-1vcpu-1gb-tor1-01.ssh: Flags [.], ack 10460, win 3836, length 0
20:36:42.306433 IP 198.96.85.21.65355 > ubuntu-s-1vcpu-1gb-tor1-01.ssh: Flags [P.], seq 1:37, ack 10848, win 3834, length 36
20:36:42.306440 IP 198.96.85.21.65355 > ubuntu-s-1vcpu-1gb-tor1-01.ssh: Flags [.], ack 11176, win 3839, length 0
20:36:42.306469 IP 198.96.85.21.65355 > ubuntu-s-1vcpu-1gb-tor1-01.ssh: Flags [.], ack 11504, win 3837, length 0
20:36:42.306666 IP ubuntu-s-1vcpu-1gb-tor1-01.ssh > 198.96.85.21.65355: Flags [P.], seq 17260:17896, ack 37, win 313, length 636
20:36:42.306773 IP 198.96.85.21.65355 > ubuntu-s-1vcpu-1gb-tor1-01.ssh: Flags [.], ack 11832, win 3836, length 0
20:36:42.306785 IP 198.96.85.21.65355 > ubuntu-s-1vcpu-1gb-tor1-01.ssh: Flags [.], ack 12160, win 3835, length 0
20:36:42.306847 IP ubuntu-s-1vcpu-1gb-tor1-01.ssh > 198.96.85.21.65355: Flags [P.], seq 17896:18060, ack 37, win 313, length 164
20:36:42.307003 IP ubuntu-s-1vcpu-1gb-tor1-01.ssh > 198.96.85.21.65355: Flags [P.], seq 18060:18456, ack 37, win 313, length 396
20:36:42.307138 IP 198.96.85.21.65355 > ubuntu-s-1vcpu-1gb-tor1-01.ssh: Flags [.], ack 12488, win 3839, length 0
20:36:42.307159 IP 198.96.85.21.65355 > ubuntu-s-1vcpu-1gb-tor1-01.ssh: Flags [.], ack 12816, win 3837, length 0
20:36:42.307189 IP 198.96.85.21.65355 > ubuntu-s-1vcpu-1gb-tor1-01.ssh: Flags [.], ack 13144, win 3836, length 0
20:36:42.307343 IP ubuntu-s-1vcpu-1gb-tor1-01.ssh > 198.96.85.21.65355: Flags [P.], seq 18456:18964, ack 37, win 313, length 508
20:36:42.307424 IP 198.96.85.21.65355 > ubuntu-s-1vcpu-1gb-tor1-01.ssh: Flags [.], ack 13472, win 3835, length 0
20:36:42.307436 IP 198.96.85.21.65355 > ubuntu-s-1vcpu-1gb-tor1-01.ssh: Flags [.], ack 13800, win 3839, length 0
20:36:42.307566 IP ubuntu-s-1vcpu-1gb-tor1-01.ssh > 198.96.85.21.65355: Flags [P.], seq 18964:19360, ack 37, win 313, length 396
20:36:42.307676 IP ubuntu-s-1vcpu-1gb-tor1-01.ssh > 198.96.85.21.65355: Flags [P.], seq 19360:19524, ack 37, win 313, length 164
20:36:42.307711 IP 198.96.85.21.65355 > ubuntu-s-1vcpu-1gb-tor1-01.ssh: Flags [.], ack 14128, win 3837, length 0
20:36:42.307721 IP 198.96.85.21.65355 > ubuntu-s-1vcpu-1gb-tor1-01.ssh: Flags [.], ack 14456, win 3836, length 0
20:36:42.307849 IP ubuntu-s-1vcpu-1gb-tor1-01.ssh > 198.96.85.21.65355: Flags [P.], seq 19524:19920, ack 37, win 313, length 396
20:36:42.307959 IP ubuntu-s-1vcpu-1gb-tor1-01.ssh > 198.96.85.21.65355: Flags [P.], seq 19920:20084, ack 37, win 313, length 164
20:36:42.308058 IP ubuntu-s-1vcpu-1gb-tor1-01.ssh > 198.96.85.21.65355: Flags [P.], seq 20084:20248, ack 37, win 313, length 164
20:36:42.308238 IP 198.96.85.21.65355 > ubuntu-s-1vcpu-1gb-tor1-01.ssh: Flags [.], ack 14784, win 3835, length 0
20:36:42.308255 IP 198.96.85.21.65355 > ubuntu-s-1vcpu-1gb-tor1-01.ssh: Flags [.], ack 15112, win 3839, length 0
20:36:42.308260 IP 198.96.85.21.65355 > ubuntu-s-1vcpu-1gb-tor1-01.ssh: Flags [.], ack 15440, win 3837, length 0
20:36:42.308361 IP 198.96.85.21.65355 > ubuntu-s-1vcpu-1gb-tor1-01.ssh: Flags [.], ack 15768, win 3836, length 0
20:36:42.308371 IP 198.96.85.21.65355 > ubuntu-s-1vcpu-1gb-tor1-01.ssh: Flags [.], ack 16096, win 3835, length 0
20:36:42.308474 IP ubuntu-s-1vcpu-1gb-tor1-01.ssh > 198.96.85.21.65355: Flags [P.], seq 20248:20412, ack 37, win 313, length 164
20:36:42.308561 IP ubuntu-s-1vcpu-1gb-tor1-01.ssh > 198.96.85.21.65355: Flags [P.], seq 20412:21016, ack 37, win 313, length 604
20:36:42.308722 IP ubuntu-s-1vcpu-1gb-tor1-01.ssh > 198.96.85.21.65355: Flags [P.], seq 21016:21316, ack 37, win 313, length 300
20:36:42.308852 IP ubuntu-s-1vcpu-1gb-tor1-01.ssh > 198.96.85.21.65355: Flags [P.], seq 21316:21480, ack 37, win 313, length 164
20:36:42.308987 IP ubuntu-s-1vcpu-1gb-tor1-01.ssh > 198.96.85.21.65355: Flags [P.], seq 21480:21644, ack 37, win 313, length 164
20:36:42.309138 IP ubuntu-s-1vcpu-1gb-tor1-01.ssh > 198.96.85.21.65355: Flags [P.], seq 21644:21808, ack 37, win 313, length 164
20:36:42.309285 IP ubuntu-s-1vcpu-1gb-tor1-01.ssh > 198.96.85.21.65355: Flags [P.], seq 21808:21972, ack 37, win 313, length 164
20:36:42.309419 IP ubuntu-s-1vcpu-1gb-tor1-01.ssh > 198.96.85.21.65355: Flags [P.], seq 21972:22136, ack 37, win 313, length 164
20:36:42.309520 IP ubuntu-s-1vcpu-1gb-tor1-01.ssh > 198.96.85.21.65355: Flags [P.], seq 22136:22300, ack 37, win 313, length 164
20:36:42.309617 IP ubuntu-s-1vcpu-1gb-tor1-01.ssh > 198.96.85.21.65355: Flags [P.], seq 22300:22464, ack 37, win 313, length 164
20:36:42.309739 IP ubuntu-s-1vcpu-1gb-tor1-01.ssh > 198.96.85.21.65355: Flags [P.], seq 22464:22628, ack 37, win 313, length 164
20:36:42.309835 IP ubuntu-s-1vcpu-1gb-tor1-01.ssh > 198.96.85.21.65355: Flags [P.], seq 22628:22792, ack 37, win 313, length 164
20:36:42.309930 IP ubuntu-s-1vcpu-1gb-tor1-01.ssh > 198.96.85.21.65355: Flags [P.], seq 22792:22956, ack 37, win 313, length 164
20:36:42.310024 IP ubuntu-s-1vcpu-1gb-tor1-01.ssh > 198.96.85.21.65355: Flags [P.], seq 22956:23120, ack 37, win 313, length 164
20:36:42.310119 IP ubuntu-s-1vcpu-1gb-tor1-01.ssh > 198.96.85.21.65355: Flags [P.], seq 23120:23284, ack 37, win 313, length 164
20:36:42.310213 IP ubuntu-s-1vcpu-1gb-tor1-01.ssh > 198.96.85.21.65355: Flags [P.], seq 23284:23448, ack 37, win 313, length 164
20:36:42.310307 IP ubuntu-s-1vcpu-1gb-tor1-01.ssh > 198.96.85.21.65355: Flags [P.], seq 23448:23612, ack 37, win 313, length 164
20:36:42.310427 IP ubuntu-s-1vcpu-1gb-tor1-01.ssh > 198.96.85.21.65355: Flags [P.], seq 23612:23776, ack 37, win 313, length 164
20:36:42.310524 IP ubuntu-s-1vcpu-1gb-tor1-01.ssh > 198.96.85.21.65355: Flags [P.], seq 23776:23940, ack 37, win 313, length 164
20:36:42.310653 IP ubuntu-s-1vcpu-1gb-tor1-01.ssh > 198.96.85.21.65355: Flags [P.], seq 23940:24104, ack 37, win 313, length 164
20:36:42.310753 IP ubuntu-s-1vcpu-1gb-tor1-01.ssh > 198.96.85.21.65355: Flags [P.], seq 24104:24268, ack 37, win 313, length 164
20:36:42.310849 IP ubuntu-s-1vcpu-1gb-tor1-01.ssh > 198.96.85.21.65355: Flags [P.], seq 24268:24432, ack 37, win 313, length 164
20:36:42.310944 IP ubuntu-s-1vcpu-1gb-tor1-01.ssh > 198.96.85.21.65355: Flags [P.], seq 24432:24596, ack 37, win 313, length 164
20:36:42.311097 IP ubuntu-s-1vcpu-1gb-tor1-01.ssh > 198.96.85.21.65355: Flags [P.], seq 24596:24760, ack 37, win 313, length 164
20:36:42.311261 IP ubuntu-s-1vcpu-1gb-tor1-01.ssh > 198.96.85.21.65355: Flags [P.], seq 24760:24924, ack 37, win 313, length 164
20:36:42.311401 IP ubuntu-s-1vcpu-1gb-tor1-01.ssh > 198.96.85.21.65355: Flags [P.], seq 24924:25088, ack 37, win 313, length 164
20:36:42.311501 IP ubuntu-s-1vcpu-1gb-tor1-01.ssh > 198.96.85.21.65355: Flags [P.], seq 25088:25252, ack 37, win 313, length 164
20:36:42.311598 IP ubuntu-s-1vcpu-1gb-tor1-01.ssh > 198.96.85.21.65355: Flags [P.], seq 25252:25416, ack 37, win 313, length 164
20:36:42.311694 IP ubuntu-s-1vcpu-1gb-tor1-01.ssh > 198.96.85.21.65355: Flags [P.], seq 25416:25580, ack 37, win 313, length 164
20:36:42.319509 IP 198.96.85.21.65355 > ubuntu-s-1vcpu-1gb-tor1-01.ssh: Flags [.], ack 16424, win 3839, length 0
20:36:42.319546 IP ubuntu-s-1vcpu-1gb-tor1-01.ssh > 198.96.85.21.65355: Flags [P.], seq 25580:25744, ack 37, win 313, length 164
20:36:42.319579 IP 198.96.85.21.65355 > ubuntu-s-1vcpu-1gb-tor1-01.ssh: Flags [.], ack 17096, win 3836, length 0
20:36:42.319590 IP 198.96.85.21.65355 > ubuntu-s-1vcpu-1gb-tor1-01.ssh: Flags [.], ack 17896, win 3839, length 0
20:36:42.319597 IP 198.96.85.21.65355 > ubuntu-s-1vcpu-1gb-tor1-01.ssh: Flags [.], ack 18456, win 3836, length 0
20:36:42.319604 IP 198.96.85.21.65355 > ubuntu-s-1vcpu-1gb-tor1-01.ssh: Flags [.], ack 19360, win 3839, length 0
20:36:42.319611 IP 198.96.85.21.65355 > ubuntu-s-1vcpu-1gb-tor1-01.ssh: Flags [.], ack 19920, win 3836, length 0
20:36:42.319762 IP 198.96.85.21.65355 > ubuntu-s-1vcpu-1gb-tor1-01.ssh: Flags [.], ack 21808, win 3835, length 0
20:36:42.319772 IP 198.96.85.21.65355 > ubuntu-s-1vcpu-1gb-tor1-01.ssh: Flags [.], ack 22136, win 3834, length 0
20:36:42.319886 IP 198.96.85.21.65355 > ubuntu-s-1vcpu-1gb-tor1-01.ssh: Flags [.], ack 22792, win 3837, length 0
20:36:42.319893 IP 198.96.85.21.65355 > ubuntu-s-1vcpu-1gb-tor1-01.ssh: Flags [.], ack 23120, win 3836, length 0
20:36:42.319896 IP 198.96.85.21.65355 > ubuntu-s-1vcpu-1gb-tor1-01.ssh: Flags [.], ack 23448, win 3835, length 0
20:36:42.320039 IP 198.96.85.21.65355 > ubuntu-s-1vcpu-1gb-tor1-01.ssh: Flags [.], ack 23776, win 3839, length 0
20:36:42.320052 IP 198.96.85.21.65355 > ubuntu-s-1vcpu-1gb-tor1-01.ssh: Flags [.], ack 24104, win 3837, length 0
20:36:42.320193 IP 198.96.85.21.65355 > ubuntu-s-1vcpu-1gb-tor1-01.ssh: Flags [.], ack 24432, win 3836, length 0
20:36:42.320215 IP 198.96.85.21.65355 > ubuntu-s-1vcpu-1gb-tor1-01.ssh: Flags [.], ack 24760, win 3835, length 0
20:36:42.320265 IP 198.96.85.21.65355 > ubuntu-s-1vcpu-1gb-tor1-01.ssh: Flags [.], ack 25088, win 3839, length 0
20:36:42.320273 IP 198.96.85.21.65355 > ubuntu-s-1vcpu-1gb-tor1-01.ssh: Flags [.], ack 25416, win 3837, length 0
20:36:42.320422 IP ubuntu-s-1vcpu-1gb-tor1-01.ssh > 198.96.85.21.65355: Flags [P.], seq 25744:27164, ack 37, win 313, length 1420
20:36:42.320487 IP ubuntu-s-1vcpu-1gb-tor1-01.ssh > 198.96.85.21.65355: Flags [P.], seq 27164:27432, ack 37, win 313, length 268
20:36:42.320525 IP ubuntu-s-1vcpu-1gb-tor1-01.ssh > 198.96.85.21.65355: Flags [P.], seq 27432:27924, ack 37, win 313, length 492
20:36:42.320676 IP ubuntu-s-1vcpu-1gb-tor1-01.ssh > 198.96.85.21.65355: Flags [P.], seq 27924:28352, ack 37, win 313, length 428
20:36:42.320819 IP ubuntu-s-1vcpu-1gb-tor1-01.ssh > 198.96.85.21.65355: Flags [P.], seq 28352:28516, ack 37, win 313, length 164
20:36:42.320935 IP ubuntu-s-1vcpu-1gb-tor1-01.ssh > 198.96.85.21.65355: Flags [P.], seq 28516:28680, ack 37, win 313, length 164
20:36:42.321033 IP ubuntu-s-1vcpu-1gb-tor1-01.ssh > 198.96.85.21.65355: Flags [P.], seq 28680:28844, ack 37, win 313, length 164
20:36:42.321150 IP ubuntu-s-1vcpu-1gb-tor1-01.ssh > 198.96.85.21.65355: Flags [P.], seq 28844:29008, ack 37, win 313, length 164
20:36:42.321251 IP ubuntu-s-1vcpu-1gb-tor1-01.ssh > 198.96.85.21.65355: Flags [P.], seq 29008:29172, ack 37, win 313, length 164
20:36:42.321374 IP ubuntu-s-1vcpu-1gb-tor1-01.ssh > 198.96.85.21.65355: Flags [P.], seq 29172:29336, ack 37, win 313, length 164
20:36:42.321551 IP ubuntu-s-1vcpu-1gb-tor1-01.ssh > 198.96.85.21.65355: Flags [P.], seq 29336:29500, ack 37, win 313, length 164
20:36:42.321733 IP ubuntu-s-1vcpu-1gb-tor1-01.ssh > 198.96.85.21.65355: Flags [P.], seq 29500:29664, ack 37, win 313, length 164
20:36:42.321933 IP ubuntu-s-1vcpu-1gb-tor1-01.ssh > 198.96.85.21.65355: Flags [P.], seq 29664:29828, ack 37, win 313, length 164
20:36:42.322103 IP ubuntu-s-1vcpu-1gb-tor1-01.ssh > 198.96.85.21.65355: Flags [P.], seq 29828:29992, ack 37, win 313, length 164
20:36:42.322277 IP ubuntu-s-1vcpu-1gb-tor1-01.ssh > 198.96.85.21.65355: Flags [P.], seq 29992:30156, ack 37, win 313, length 164
20:36:42.322481 IP ubuntu-s-1vcpu-1gb-tor1-01.ssh > 198.96.85.21.65355: Flags [P.], seq 30156:30320, ack 37, win 313, length 164
20:36:42.322691 IP ubuntu-s-1vcpu-1gb-tor1-01.ssh > 198.96.85.21.65355: Flags [P.], seq 30320:30484, ack 37, win 313, length 164
20:36:42.322867 IP ubuntu-s-1vcpu-1gb-tor1-01.ssh > 198.96.85.21.65355: Flags [P.], seq 30484:30648, ack 37, win 313, length 164
20:36:42.323069 IP ubuntu-s-1vcpu-1gb-tor1-01.ssh > 198.96.85.21.65355: Flags [P.], seq 30648:30812, ack 37, win 313, length 164
20:36:42.323237 IP ubuntu-s-1vcpu-1gb-tor1-01.ssh > 198.96.85.21.65355: Flags [P.], seq 30812:30976, ack 37, win 313, length 164
20:36:42.323433 IP ubuntu-s-1vcpu-1gb-tor1-01.ssh > 198.96.85.21.65355: Flags [P.], seq 30976:31140, ack 37, win 313, length 164
20:36:42.323615 IP ubuntu-s-1vcpu-1gb-tor1-01.ssh > 198.96.85.21.65355: Flags [P.], seq 31140:31304, ack 37, win 313, length 164
20:36:42.323772 IP ubuntu-s-1vcpu-1gb-tor1-01.ssh > 198.96.85.21.65355: Flags [P.], seq 31304:31468, ack 37, win 313, length 164
20:36:42.323955 IP ubuntu-s-1vcpu-1gb-tor1-01.ssh > 198.96.85.21.65355: Flags [P.], seq 31468:31632, ack 37, win 313, length 164
20:36:42.324072 IP ubuntu-s-1vcpu-1gb-tor1-01.ssh > 198.96.85.21.65355: Flags [P.], seq 31632:31796, ack 37, win 313, length 164
20:36:42.324174 IP ubuntu-s-1vcpu-1gb-tor1-01.ssh > 198.96.85.21.65355: Flags [P.], seq 31796:31960, ack 37, win 313, length 164
20:36:42.324271 IP ubuntu-s-1vcpu-1gb-tor1-01.ssh > 198.96.85.21.65355: Flags [P.], seq 31960:32124, ack 37, win 313, length 164
20:36:42.324395 IP ubuntu-s-1vcpu-1gb-tor1-01.ssh > 198.96.85.21.65355: Flags [P.], seq 32124:32288, ack 37, win 313, length 164
20:36:42.324493 IP ubuntu-s-1vcpu-1gb-tor1-01.ssh > 198.96.85.21.65355: Flags [P.], seq 32288:32452, ack 37, win 313, length 164
20:36:42.324589 IP ubuntu-s-1vcpu-1gb-tor1-01.ssh > 198.96.85.21.65355: Flags [P.], seq 32452:32616, ack 37, win 313, length 164
20:36:42.324686 IP ubuntu-s-1vcpu-1gb-tor1-01.ssh > 198.96.85.21.65355: Flags [P.], seq 32616:32780, ack 37, win 313, length 164
20:36:42.324784 IP ubuntu-s-1vcpu-1gb-tor1-01.ssh > 198.96.85.21.65355: Flags [P.], seq 32780:32944, ack 37, win 313, length 164
20:36:42.324878 IP ubuntu-s-1vcpu-1gb-tor1-01.ssh > 198.96.85.21.65355: Flags [P.], seq 32944:33108, ack 37, win 313, length 164
20:36:42.324972 IP ubuntu-s-1vcpu-1gb-tor1-01.ssh > 198.96.85.21.65355: Flags [P.], seq 33108:33272, ack 37, win 313, length 164
20:36:42.325067 IP ubuntu-s-1vcpu-1gb-tor1-01.ssh > 198.96.85.21.65355: Flags [P.], seq 33272:33436, ack 37, win 313, length 164
20:36:42.325161 IP ubuntu-s-1vcpu-1gb-tor1-01.ssh > 198.96.85.21.65355: Flags [P.], seq 33436:33600, ack 37, win 313, length 164
20:36:42.325255 IP ubuntu-s-1vcpu-1gb-tor1-01.ssh > 198.96.85.21.65355: Flags [P.], seq 33600:33764, ack 37, win 313, length 164
20:36:42.325374 IP ubuntu-s-1vcpu-1gb-tor1-01.ssh > 198.96.85.21.65355: Flags [P.], seq 33764:33928, ack 37, win 313, length 164
20:36:42.325473 IP ubuntu-s-1vcpu-1gb-tor1-01.ssh > 198.96.85.21.65355: Flags [P.], seq 33928:34092, ack 37, win 313, length 164
20:36:42.325570 IP ubuntu-s-1vcpu-1gb-tor1-01.ssh > 198.96.85.21.65355: Flags [P.], seq 34092:34256, ack 37, win 313, length 164
20:36:42.325665 IP ubuntu-s-1vcpu-1gb-tor1-01.ssh > 198.96.85.21.65355: Flags [P.], seq 34256:34420, ack 37, win 313, length 164
20:36:42.333152 IP 198.96.85.21.65355 > ubuntu-s-1vcpu-1gb-tor1-01.ssh: Flags [.], ack 25744, win 3836, length 0
20:36:42.333187 IP ubuntu-s-1vcpu-1gb-tor1-01.ssh > 198.96.85.21.65355: Flags [P.], seq 34420:34584, ack 37, win 313, length 164
20:36:42.333218 IP 198.96.85.21.65355 > ubuntu-s-1vcpu-1gb-tor1-01.ssh: Flags [.], ack 27164, win 3839, length 0
20:36:42.333228 IP 198.96.85.21.65355 > ubuntu-s-1vcpu-1gb-tor1-01.ssh: Flags [.], ack 27924, win 3836, length 0
20:36:42.333410 IP 198.96.85.21.65355 > ubuntu-s-1vcpu-1gb-tor1-01.ssh: Flags [.], ack 28516, win 3839, length 0
20:36:42.333424 IP 198.96.85.21.65355 > ubuntu-s-1vcpu-1gb-tor1-01.ssh: Flags [.], ack 28844, win 3837, length 0
20:36:42.333430 IP 198.96.85.21.65355 > ubuntu-s-1vcpu-1gb-tor1-01.ssh: Flags [.], ack 29172, win 3836, length 0
20:36:42.333434 IP 198.96.85.21.65355 > ubuntu-s-1vcpu-1gb-tor1-01.ssh: Flags [.], ack 29500, win 3835, length 0
20:36:42.333438 IP 198.96.85.21.65355 > ubuntu-s-1vcpu-1gb-tor1-01.ssh: Flags [.], ack 29828, win 3839, length 0
20:36:42.333651 IP 198.96.85.21.65355 > ubuntu-s-1vcpu-1gb-tor1-01.ssh: Flags [.], ack 30156, win 3837, length 0
20:36:42.333668 IP 198.96.85.21.65355 > ubuntu-s-1vcpu-1gb-tor1-01.ssh: Flags [.], ack 30484, win 3836, length 0
20:36:42.333673 IP 198.96.85.21.65355 > ubuntu-s-1vcpu-1gb-tor1-01.ssh: Flags [.], ack 30812, win 3835, length 0
20:36:42.333771 IP ubuntu-s-1vcpu-1gb-tor1-01.ssh > 198.96.85.21.65355: Flags [P.], seq 34584:35660, ack 37, win 313, length 1076
20:36:42.333864 IP 198.96.85.21.65355 > ubuntu-s-1vcpu-1gb-tor1-01.ssh: Flags [.], ack 31140, win 3839, length 0
20:36:42.333875 IP 198.96.85.21.65355 > ubuntu-s-1vcpu-1gb-tor1-01.ssh: Flags [.], ack 31468, win 3837, length 0
20:36:42.333879 IP 198.96.85.21.65355 > ubuntu-s-1vcpu-1gb-tor1-01.ssh: Flags [.], ack 31796, win 3836, length 0
20:36:42.333884 IP 198.96.85.21.65355 > ubuntu-s-1vcpu-1gb-tor1-01.ssh: Flags [.], ack 32124, win 3835, length 0
20:36:42.333890 IP 198.96.85.21.65355 > ubuntu-s-1vcpu-1gb-tor1-01.ssh: Flags [.], ack 32452, win 3839, length 0
20:36:42.333952 IP 198.96.85.21.65355 > ubuntu-s-1vcpu-1gb-tor1-01.ssh: Flags [.], ack 32780, win 3837, length 0
20:36:42.333964 IP 198.96.85.21.65355 > ubuntu-s-1vcpu-1gb-tor1-01.ssh: Flags [.], ack 33108, win 3836, length 0
20:36:42.334058 IP 198.96.85.21.65355 > ubuntu-s-1vcpu-1gb-tor1-01.ssh: Flags [.], ack 34092, win 3837, length 0
20:36:42.334068 IP 198.96.85.21.65355 > ubuntu-s-1vcpu-1gb-tor1-01.ssh: Flags [.], ack 34420, win 3836, length 0
20:36:42.334240 IP ubuntu-s-1vcpu-1gb-tor1-01.ssh > 198.96.85.21.65355: Flags [P.], seq 35660:37200, ack 37, win 313, length 1540
20:36:42.334391 IP ubuntu-s-1vcpu-1gb-tor1-01.ssh > 198.96.85.21.65355: Flags [P.], seq 37200:37372, ack 37, win 313, length 172
20:36:42.334500 IP ubuntu-s-1vcpu-1gb-tor1-01.ssh > 198.96.85.21.65355: Flags [P.], seq 37372:37536, ack 37, win 313, length 164
20:36:42.334659 IP ubuntu-s-1vcpu-1gb-tor1-01.ssh > 198.96.85.21.65355: Flags [P.], seq 37536:37700, ack 37, win 313, length 164
20:36:42.334786 IP ubuntu-s-1vcpu-1gb-tor1-01.ssh > 198.96.85.21.65355: Flags [P.], seq 37700:37864, ack 37, win 313, length 164
20:36:42.334890 IP ubuntu-s-1vcpu-1gb-tor1-01.ssh > 198.96.85.21.65355: Flags [P.], seq 37864:38028, ack 37, win 313, length 164
20:36:42.335002 IP ubuntu-s-1vcpu-1gb-tor1-01.ssh > 198.96.85.21.65355: Flags [P.], seq 38028:38192, ack 37, win 313, length 164
20:36:42.335175 IP ubuntu-s-1vcpu-1gb-tor1-01.ssh > 198.96.85.21.65355: Flags [P.], seq 38192:38356, ack 37, win 313, length 164
20:36:42.335285 IP ubuntu-s-1vcpu-1gb-tor1-01.ssh > 198.96.85.21.65355: Flags [P.], seq 38356:38520, ack 37, win 313, length 164
20:36:42.335435 IP ubuntu-s-1vcpu-1gb-tor1-01.ssh > 198.96.85.21.65355: Flags [P.], seq 38520:38684, ack 37, win 313, length 164
20:36:42.335539 IP ubuntu-s-1vcpu-1gb-tor1-01.ssh > 198.96.85.21.65355: Flags [P.], seq 38684:38848, ack 37, win 313, length 164
20:36:42.335645 IP ubuntu-s-1vcpu-1gb-tor1-01.ssh > 198.96.85.21.65355: Flags [P.], seq 38848:39012, ack 37, win 313, length 164
20:36:42.335825 IP ubuntu-s-1vcpu-1gb-tor1-01.ssh > 198.96.85.21.65355: Flags [P.], seq 39012:39176, ack 37, win 313, length 164
20:36:42.335974 IP ubuntu-s-1vcpu-1gb-tor1-01.ssh > 198.96.85.21.65355: Flags [P.], seq 39176:39340, ack 37, win 313, length 164
20:36:42.336089 IP ubuntu-s-1vcpu-1gb-tor1-01.ssh > 198.96.85.21.65355: Flags [P.], seq 39340:39504, ack 37, win 313, length 164
20:36:42.336205 IP ubuntu-s-1vcpu-1gb-tor1-01.ssh > 198.96.85.21.65355: Flags [P.], seq 39504:39668, ack 37, win 313, length 164
20:36:42.336308 IP ubuntu-s-1vcpu-1gb-tor1-01.ssh > 198.96.85.21.65355: Flags [P.], seq 39668:39832, ack 37, win 313, length 164
20:36:42.336452 IP ubuntu-s-1vcpu-1gb-tor1-01.ssh > 198.96.85.21.65355: Flags [P.], seq 39832:39996, ack 37, win 313, length 164
20:36:42.336564 IP ubuntu-s-1vcpu-1gb-tor1-01.ssh > 198.96.85.21.65355: Flags [P.], seq 39996:40160, ack 37, win 313, length 164
20:36:42.336661 IP ubuntu-s-1vcpu-1gb-tor1-01.ssh > 198.96.85.21.65355: Flags [P.], seq 40160:40324, ack 37, win 313, length 164
20:36:42.336759 IP ubuntu-s-1vcpu-1gb-tor1-01.ssh > 198.96.85.21.65355: Flags [P.], seq 40324:40488, ack 37, win 313, length 164
20:36:42.336871 IP ubuntu-s-1vcpu-1gb-tor1-01.ssh > 198.96.85.21.65355: Flags [P.], seq 40488:40652, ack 37, win 313, length 164
20:36:42.336968 IP ubuntu-s-1vcpu-1gb-tor1-01.ssh > 198.96.85.21.65355: Flags [P.], seq 40652:40816, ack 37, win 313, length 164
20:36:42.337085 IP ubuntu-s-1vcpu-1gb-tor1-01.ssh > 198.96.85.21.65355: Flags [P.], seq 40816:40980, ack 37, win 313, length 164
20:36:42.337246 IP ubuntu-s-1vcpu-1gb-tor1-01.ssh > 198.96.85.21.65355: Flags [P.], seq 40980:41144, ack 37, win 313, length 164
20:36:42.337389 IP ubuntu-s-1vcpu-1gb-tor1-01.ssh > 198.96.85.21.65355: Flags [P.], seq 41144:41308, ack 37, win 313, length 164
20:36:42.337489 IP ubuntu-s-1vcpu-1gb-tor1-01.ssh > 198.96.85.21.65355: Flags [P.], seq 41308:41472, ack 37, win 313, length 164
20:36:42.337586 IP ubuntu-s-1vcpu-1gb-tor1-01.ssh > 198.96.85.21.65355: Flags [P.], seq 41472:41636, ack 37, win 313, length 164
20:36:42.337727 IP ubuntu-s-1vcpu-1gb-tor1-01.ssh > 198.96.85.21.65355: Flags [P.], seq 41636:41800, ack 37, win 313, length 164
20:36:42.337871 IP ubuntu-s-1vcpu-1gb-tor1-01.ssh > 198.96.85.21.65355: Flags [P.], seq 41800:41964, ack 37, win 313, length 164
20:36:42.338027 IP ubuntu-s-1vcpu-1gb-tor1-01.ssh > 198.96.85.21.65355: Flags [P.], seq 41964:42128, ack 37, win 313, length 164
20:36:42.338136 IP ubuntu-s-1vcpu-1gb-tor1-01.ssh > 198.96.85.21.65355: Flags [P.], seq 42128:42292, ack 37, win 313, length 164
20:36:42.338237 IP ubuntu-s-1vcpu-1gb-tor1-01.ssh > 198.96.85.21.65355: Flags [P.], seq 42292:42456, ack 37, win 313, length 164
20:36:42.338434 IP ubuntu-s-1vcpu-1gb-tor1-01.ssh > 198.96.85.21.65355: Flags [P.], seq 42456:42620, ack 37, win 313, length 164
20:36:42.338656 IP ubuntu-s-1vcpu-1gb-tor1-01.ssh > 198.96.85.21.65355: Flags [P.], seq 42620:42784, ack 37, win 313, length 164
20:36:42.338817 IP ubuntu-s-1vcpu-1gb-tor1-01.ssh > 198.96.85.21.65355: Flags [P.], seq 42784:42948, ack 37, win 313, length 164
20:36:42.338980 IP ubuntu-s-1vcpu-1gb-tor1-01.ssh > 198.96.85.21.65355: Flags [P.], seq 42948:43112, ack 37, win 313, length 164
20:36:42.339184 IP ubuntu-s-1vcpu-1gb-tor1-01.ssh > 198.96.85.21.65355: Flags [P.], seq 43112:43276, ack 37, win 313, length 164
20:36:42.339402 IP ubuntu-s-1vcpu-1gb-tor1-01.ssh > 198.96.85.21.65355: Flags [P.], seq 43276:43440, ack 37, win 313, length 164
20:36:42.339587 IP ubuntu-s-1vcpu-1gb-tor1-01.ssh > 198.96.85.21.65355: Flags [P.], seq 43440:43604, ack 37, win 313, length 164
20:36:42.339754 IP ubuntu-s-1vcpu-1gb-tor1-01.ssh > 198.96.85.21.65355: Flags [P.], seq 43604:43768, ack 37, win 313, length 164
20:36:42.339931 IP ubuntu-s-1vcpu-1gb-tor1-01.ssh > 198.96.85.21.65355: Flags [P.], seq 43768:43932, ack 37, win 313, length 164
20:36:42.347334 IP 198.96.85.21.65355 > ubuntu-s-1vcpu-1gb-tor1-01.ssh: Flags [.], ack 35660, win 3839, length 0
20:36:42.347370 IP ubuntu-s-1vcpu-1gb-tor1-01.ssh > 198.96.85.21.65355: Flags [P.], seq 43932:44096, ack 37, win 313, length 164
20:36:42.347398 IP 198.96.85.21.65355 > ubuntu-s-1vcpu-1gb-tor1-01.ssh: Flags [.], ack 37200, win 3839, length 0
20:36:42.347404 IP 198.96.85.21.65355 > ubuntu-s-1vcpu-1gb-tor1-01.ssh: Flags [.], ack 37536, win 3837, length 0
20:36:42.347581 IP 198.96.85.21.65355 > ubuntu-s-1vcpu-1gb-tor1-01.ssh: Flags [.], ack 37864, win 3836, length 0
20:36:42.347617 IP 198.96.85.21.65355 > ubuntu-s-1vcpu-1gb-tor1-01.ssh: Flags [.], ack 38192, win 3835, length 0
20:36:42.347626 IP 198.96.85.21.65355 > ubuntu-s-1vcpu-1gb-tor1-01.ssh: Flags [.], ack 38520, win 3839, length 0
20:36:42.347716 IP 198.96.85.21.65355 > ubuntu-s-1vcpu-1gb-tor1-01.ssh: Flags [.], ack 38848, win 3837, length 0
20:36:42.347727 IP 198.96.85.21.65355 > ubuntu-s-1vcpu-1gb-tor1-01.ssh: Flags [.], ack 39176, win 3836, length 0
20:36:42.347788 IP ubuntu-s-1vcpu-1gb-tor1-01.ssh > 198.96.85.21.65355: Flags [P.], seq 44096:44948, ack 37, win 313, length 852
20:36:42.347949 IP ubuntu-s-1vcpu-1gb-tor1-01.ssh > 198.96.85.21.65355: Flags [P.], seq 44948:45344, ack 37, win 313, length 396
20:36:42.348057 IP ubuntu-s-1vcpu-1gb-tor1-01.ssh > 198.96.85.21.65355: Flags [P.], seq 45344:45508, ack 37, win 313, length 164
20:36:42.348111 IP 198.96.85.21.65355 > ubuntu-s-1vcpu-1gb-tor1-01.ssh: Flags [.], ack 39504, win 3835, length 0
20:36:42.348174 IP 198.96.85.21.65355 > ubuntu-s-1vcpu-1gb-tor1-01.ssh: Flags [.], ack 39832, win 3839, length 0
20:36:42.348183 IP 198.96.85.21.65355 > ubuntu-s-1vcpu-1gb-tor1-01.ssh: Flags [.], ack 40160, win 3837, length 0
20:36:42.348187 IP 198.96.85.21.65355 > ubuntu-s-1vcpu-1gb-tor1-01.ssh: Flags [.], ack 40488, win 3836, length 0
20:36:42.348190 IP 198.96.85.21.65355 > ubuntu-s-1vcpu-1gb-tor1-01.ssh: Flags [.], ack 40816, win 3835, length 0
20:36:42.348193 IP 198.96.85.21.65355 > ubuntu-s-1vcpu-1gb-tor1-01.ssh: Flags [.], ack 41144, win 3839, length 0
20:36:42.348271 IP 198.96.85.21.65355 > ubuntu-s-1vcpu-1gb-tor1-01.ssh: Flags [.], ack 41472, win 3837, length 0
20:36:42.348494 IP ubuntu-s-1vcpu-1gb-tor1-01.ssh > 198.96.85.21.65355: Flags [P.], seq 45508:46472, ack 37, win 313, length 964
20:36:42.348613 IP 198.96.85.21.65355 > ubuntu-s-1vcpu-1gb-tor1-01.ssh: Flags [.], ack 42784, win 3837, length 0
20:36:42.348625 IP 198.96.85.21.65355 > ubuntu-s-1vcpu-1gb-tor1-01.ssh: Flags [.], ack 43112, win 3836, length 0
20:36:42.348630 IP 198.96.85.21.65355 > ubuntu-s-1vcpu-1gb-tor1-01.ssh: Flags [.], ack 43440, win 3835, length 0
20:36:42.348634 IP 198.96.85.21.65355 > ubuntu-s-1vcpu-1gb-tor1-01.ssh: Flags [.], ack 43768, win 3839, length 0
20:36:42.348660 IP ubuntu-s-1vcpu-1gb-tor1-01.ssh > 198.96.85.21.65355: Flags [P.], seq 46472:46636, ack 37, win 313, length 164
20:36:42.348840 IP ubuntu-s-1vcpu-1gb-tor1-01.ssh > 198.96.85.21.65355: Flags [P.], seq 46636:47256, ack 37, win 313, length 620
20:36:42.348946 IP ubuntu-s-1vcpu-1gb-tor1-01.ssh > 198.96.85.21.65355: Flags [P.], seq 47256:47420, ack 37, win 313, length 164
20:36:42.349044 IP ubuntu-s-1vcpu-1gb-tor1-01.ssh > 198.96.85.21.65355: Flags [P.], seq 47420:47584, ack 37, win 313, length 164
20:36:42.349220 IP ubuntu-s-1vcpu-1gb-tor1-01.ssh > 198.96.85.21.65355: Flags [P.], seq 47584:47748, ack 37, win 313, length 164
20:36:42.349338 IP ubuntu-s-1vcpu-1gb-tor1-01.ssh > 198.96.85.21.65355: Flags [P.], seq 47748:47912, ack 37, win 313, length 164
20:36:42.349438 IP ubuntu-s-1vcpu-1gb-tor1-01.ssh > 198.96.85.21.65355: Flags [P.], seq 47912:48076, ack 37, win 313, length 164
20:36:42.349534 IP ubuntu-s-1vcpu-1gb-tor1-01.ssh > 198.96.85.21.65355: Flags [P.], seq 48076:48240, ack 37, win 313, length 164
20:36:42.349630 IP ubuntu-s-1vcpu-1gb-tor1-01.ssh > 198.96.85.21.65355: Flags [P.], seq 48240:48404, ack 37, win 313, length 164
20:36:42.349729 IP ubuntu-s-1vcpu-1gb-tor1-01.ssh > 198.96.85.21.65355: Flags [P.], seq 48404:48568, ack 37, win 313, length 164
20:36:42.349825 IP ubuntu-s-1vcpu-1gb-tor1-01.ssh > 198.96.85.21.65355: Flags [P.], seq 48568:48732, ack 37, win 313, length 164
20:36:42.349952 IP ubuntu-s-1vcpu-1gb-tor1-01.ssh > 198.96.85.21.65355: Flags [P.], seq 48732:48896, ack 37, win 313, length 164
20:36:42.350133 IP ubuntu-s-1vcpu-1gb-tor1-01.ssh > 198.96.85.21.65355: Flags [P.], seq 48896:49060, ack 37, win 313, length 164
20:36:42.350249 IP ubuntu-s-1vcpu-1gb-tor1-01.ssh > 198.96.85.21.65355: Flags [P.], seq 49060:49224, ack 37, win 313, length 164
20:36:42.350347 IP ubuntu-s-1vcpu-1gb-tor1-01.ssh > 198.96.85.21.65355: Flags [P.], seq 49224:49388, ack 37, win 313, length 164
20:36:42.350446 IP ubuntu-s-1vcpu-1gb-tor1-01.ssh > 198.96.85.21.65355: Flags [P.], seq 49388:49552, ack 37, win 313, length 164
20:36:42.350542 IP ubuntu-s-1vcpu-1gb-tor1-01.ssh > 198.96.85.21.65355: Flags [P.], seq 49552:49716, ack 37, win 313, length 164
20:36:42.350677 IP ubuntu-s-1vcpu-1gb-tor1-01.ssh > 198.96.85.21.65355: Flags [P.], seq 49716:49880, ack 37, win 313, length 164
20:36:42.350780 IP ubuntu-s-1vcpu-1gb-tor1-01.ssh > 198.96.85.21.65355: Flags [P.], seq 49880:50044, ack 37, win 313, length 164
20:36:42.350887 IP ubuntu-s-1vcpu-1gb-tor1-01.ssh > 198.96.85.21.65355: Flags [P.], seq 50044:50208, ack 37, win 313, length 164
20:36:42.351057 IP ubuntu-s-1vcpu-1gb-tor1-01.ssh > 198.96.85.21.65355: Flags [P.], seq 50208:50372, ack 37, win 313, length 164
20:36:42.351162 IP ubuntu-s-1vcpu-1gb-tor1-01.ssh > 198.96.85.21.65355: Flags [P.], seq 50372:50536, ack 37, win 313, length 164
20:36:42.351261 IP ubuntu-s-1vcpu-1gb-tor1-01.ssh > 198.96.85.21.65355: Flags [P.], seq 50536:50700, ack 37, win 313, length 164
20:36:42.351447 IP ubuntu-s-1vcpu-1gb-tor1-01.ssh > 198.96.85.21.65355: Flags [P.], seq 50700:50864, ack 37, win 313, length 164
20:36:42.351558 IP ubuntu-s-1vcpu-1gb-tor1-01.ssh > 198.96.85.21.65355: Flags [P.], seq 50864:51028, ack 37, win 313, length 164
20:36:42.351660 IP ubuntu-s-1vcpu-1gb-tor1-01.ssh > 198.96.85.21.65355: Flags [P.], seq 51028:51192, ack 37, win 313, length 164
20:36:42.351757 IP ubuntu-s-1vcpu-1gb-tor1-01.ssh > 198.96.85.21.65355: Flags [P.], seq 51192:51356, ack 37, win 313, length 164
20:36:42.351852 IP ubuntu-s-1vcpu-1gb-tor1-01.ssh > 198.96.85.21.65355: Flags [P.], seq 51356:51520, ack 37, win 313, length 164
20:36:42.351947 IP ubuntu-s-1vcpu-1gb-tor1-01.ssh > 198.96.85.21.65355: Flags [P.], seq 51520:51684, ack 37, win 313, length 164
20:36:42.352044 IP ubuntu-s-1vcpu-1gb-tor1-01.ssh > 198.96.85.21.65355: Flags [P.], seq 51684:51848, ack 37, win 313, length 164
20:36:42.352138 IP ubuntu-s-1vcpu-1gb-tor1-01.ssh > 198.96.85.21.65355: Flags [P.], seq 51848:52012, ack 37, win 313, length 164
20:36:42.352234 IP ubuntu-s-1vcpu-1gb-tor1-01.ssh > 198.96.85.21.65355: Flags [P.], seq 52012:52176, ack 37, win 313, length 164
20:36:42.352329 IP ubuntu-s-1vcpu-1gb-tor1-01.ssh > 198.96.85.21.65355: Flags [P.], seq 52176:52340, ack 37, win 313, length 164
20:36:42.352424 IP ubuntu-s-1vcpu-1gb-tor1-01.ssh > 198.96.85.21.65355: Flags [P.], seq 52340:52504, ack 37, win 313, length 164
20:36:42.352519 IP ubuntu-s-1vcpu-1gb-tor1-01.ssh > 198.96.85.21.65355: Flags [P.], seq 52504:52668, ack 37, win 313, length 164
20:36:42.352645 IP ubuntu-s-1vcpu-1gb-tor1-01.ssh > 198.96.85.21.65355: Flags [P.], seq 52668:52832, ack 37, win 313, length 164
20:36:42.353111 IP ubuntu-s-1vcpu-1gb-tor1-01.ssh > 198.96.85.21.65355: Flags [P.], seq 52832:52996, ack 37, win 313, length 164
20:36:42.353250 IP ubuntu-s-1vcpu-1gb-tor1-01.ssh > 198.96.85.21.65355: Flags [P.], seq 52996:53160, ack 37, win 313, length 164
20:36:42.353395 IP ubuntu-s-1vcpu-1gb-tor1-01.ssh > 198.96.85.21.65355: Flags [P.], seq 53160:53324, ack 37, win 313, length 164
20:36:42.360711 IP 198.96.85.21.65355 > ubuntu-s-1vcpu-1gb-tor1-01.ssh: Flags [.], ack 44096, win 3837, length 0
20:36:42.360744 IP ubuntu-s-1vcpu-1gb-tor1-01.ssh > 198.96.85.21.65355: Flags [P.], seq 53324:53488, ack 37, win 313, length 164
20:36:42.360945 IP 198.96.85.21.65355 > ubuntu-s-1vcpu-1gb-tor1-01.ssh: Flags [.], ack 45344, win 3839, length 0
20:36:42.360962 IP 198.96.85.21.65355 > ubuntu-s-1vcpu-1gb-tor1-01.ssh: Flags [.], ack 46472, win 3834, length 0
20:36:42.360967 IP 198.96.85.21.65355 > ubuntu-s-1vcpu-1gb-tor1-01.ssh: Flags [.], ack 47256, win 3839, length 0
20:36:42.360971 IP 198.96.85.21.65355 > ubuntu-s-1vcpu-1gb-tor1-01.ssh: Flags [.], ack 47584, win 3837, length 0
20:36:42.361114 IP ubuntu-s-1vcpu-1gb-tor1-01.ssh > 198.96.85.21.65355: Flags [P.], seq 53488:53772, ack 37, win 313, length 284
20:36:42.361235 IP ubuntu-s-1vcpu-1gb-tor1-01.ssh > 198.96.85.21.65355: Flags [P.], seq 53772:54392, ack 37, win 313, length 620
20:36:42.361353 IP 198.96.85.21.65355 > ubuntu-s-1vcpu-1gb-tor1-01.ssh: Flags [.], ack 47912, win 3836, length 0
20:36:42.361386 IP 198.96.85.21.65355 > ubuntu-s-1vcpu-1gb-tor1-01.ssh: Flags [.], ack 48240, win 3835, length 0
20:36:42.361391 IP 198.96.85.21.65355 > ubuntu-s-1vcpu-1gb-tor1-01.ssh: Flags [.], ack 48568, win 3839, length 0
20:36:42.361395 IP 198.96.85.21.65355 > ubuntu-s-1vcpu-1gb-tor1-01.ssh: Flags [.], ack 48896, win 3837, length 0
20:36:42.361398 IP 198.96.85.21.65355 > ubuntu-s-1vcpu-1gb-tor1-01.ssh: Flags [.], ack 49224, win 3836, length 0
20:36:42.361506 IP 198.96.85.21.65355 > ubuntu-s-1vcpu-1gb-tor1-01.ssh: Flags [.], ack 49552, win 3835, length 0
20:36:42.361546 IP ubuntu-s-1vcpu-1gb-tor1-01.ssh > 198.96.85.21.65355: Flags [P.], seq 54392:54556, ack 37, win 313, length 164
20:36:42.361587 IP 198.96.85.21.65355 > ubuntu-s-1vcpu-1gb-tor1-01.ssh: Flags [.], ack 49880, win 3839, length 0
20:36:42.361592 IP 198.96.85.21.65355 > ubuntu-s-1vcpu-1gb-tor1-01.ssh: Flags [.], ack 50208, win 3837, length 0
20:36:42.361594 IP 198.96.85.21.65355 > ubuntu-s-1vcpu-1gb-tor1-01.ssh: Flags [.], ack 50536, win 3836, length 0
20:36:42.361723 IP 198.96.85.21.65355 > ubuntu-s-1vcpu-1gb-tor1-01.ssh: Flags [.], ack 50864, win 3835, length 0
20:36:42.361733 IP 198.96.85.21.65355 > ubuntu-s-1vcpu-1gb-tor1-01.ssh: Flags [.], ack 51192, win 3839, length 0
20:36:42.361737 IP 198.96.85.21.65355 > ubuntu-s-1vcpu-1gb-tor1-01.ssh: Flags [.], ack 51520, win 3837, length 0
20:36:42.361742 IP 198.96.85.21.65355 > ubuntu-s-1vcpu-1gb-tor1-01.ssh: Flags [.], ack 51848, win 3836, length 0
20:36:42.361746 IP 198.96.85.21.65355 > ubuntu-s-1vcpu-1gb-tor1-01.ssh: Flags [.], ack 52176, win 3835, length 0
20:36:42.361791 IP 198.96.85.21.65355 > ubuntu-s-1vcpu-1gb-tor1-01.ssh: Flags [.], ack 52504, win 3839, length 0
20:36:42.361799 IP 198.96.85.21.65355 > ubuntu-s-1vcpu-1gb-tor1-01.ssh: Flags [.], ack 52832, win 3837, length 0
20:36:42.361989 IP ubuntu-s-1vcpu-1gb-tor1-01.ssh > 198.96.85.21.65355: Flags [P.], seq 54556:56544, ack 37, win 313, length 1988
20:36:42.362100 IP ubuntu-s-1vcpu-1gb-tor1-01.ssh > 198.96.85.21.65355: Flags [P.], seq 56544:56716, ack 37, win 313, length 172
20:36:42.362199 IP ubuntu-s-1vcpu-1gb-tor1-01.ssh > 198.96.85.21.65355: Flags [P.], seq 56716:56880, ack 37, win 313, length 164
20:36:42.362301 IP ubuntu-s-1vcpu-1gb-tor1-01.ssh > 198.96.85.21.65355: Flags [P.], seq 56880:57044, ack 37, win 313, length 164
20:36:42.362396 IP ubuntu-s-1vcpu-1gb-tor1-01.ssh > 198.96.85.21.65355: Flags [P.], seq 57044:57208, ack 37, win 313, length 164
20:36:42.362490 IP ubuntu-s-1vcpu-1gb-tor1-01.ssh > 198.96.85.21.65355: Flags [P.], seq 57208:57372, ack 37, win 313, length 164
20:36:42.362608 IP ubuntu-s-1vcpu-1gb-tor1-01.ssh > 198.96.85.21.65355: Flags [P.], seq 57372:57536, ack 37, win 313, length 164
20:36:42.362711 IP ubuntu-s-1vcpu-1gb-tor1-01.ssh > 198.96.85.21.65355: Flags [P.], seq 57536:57700, ack 37, win 313, length 164
20:36:42.362808 IP ubuntu-s-1vcpu-1gb-tor1-01.ssh > 198.96.85.21.65355: Flags [P.], seq 57700:57864, ack 37, win 313, length 164
20:36:42.362902 IP ubuntu-s-1vcpu-1gb-tor1-01.ssh > 198.96.85.21.65355: Flags [P.], seq 57864:58028, ack 37, win 313, length 164
20:36:42.362996 IP ubuntu-s-1vcpu-1gb-tor1-01.ssh > 198.96.85.21.65355: Flags [P.], seq 58028:58192, ack 37, win 313, length 164
20:36:42.363122 IP ubuntu-s-1vcpu-1gb-tor1-01.ssh > 198.96.85.21.65355: Flags [P.], seq 58192:58356, ack 37, win 313, length 164
20:36:42.363219 IP ubuntu-s-1vcpu-1gb-tor1-01.ssh > 198.96.85.21.65355: Flags [P.], seq 58356:58520, ack 37, win 313, length 164
20:36:42.363313 IP ubuntu-s-1vcpu-1gb-tor1-01.ssh > 198.96.85.21.65355: Flags [P.], seq 58520:58684, ack 37, win 313, length 164
20:36:42.363408 IP ubuntu-s-1vcpu-1gb-tor1-01.ssh > 198.96.85.21.65355: Flags [P.], seq 58684:58848, ack 37, win 313, length 164
20:36:42.363502 IP ubuntu-s-1vcpu-1gb-tor1-01.ssh > 198.96.85.21.65355: Flags [P.], seq 58848:59012, ack 37, win 313, length 164
20:36:42.363598 IP ubuntu-s-1vcpu-1gb-tor1-01.ssh > 198.96.85.21.65355: Flags [P.], seq 59012:59176, ack 37, win 313, length 164
20:36:42.363692 IP ubuntu-s-1vcpu-1gb-tor1-01.ssh > 198.96.85.21.65355: Flags [P.], seq 59176:59340, ack 37, win 313, length 164
20:36:42.363786 IP ubuntu-s-1vcpu-1gb-tor1-01.ssh > 198.96.85.21.65355: Flags [P.], seq 59340:59504, ack 37, win 313, length 164
20:36:42.363880 IP ubuntu-s-1vcpu-1gb-tor1-01.ssh > 198.96.85.21.65355: Flags [P.], seq 59504:59668, ack 37, win 313, length 164
20:36:42.363982 IP ubuntu-s-1vcpu-1gb-tor1-01.ssh > 198.96.85.21.65355: Flags [P.], seq 59668:59832, ack 37, win 313, length 164
20:36:42.364077 IP ubuntu-s-1vcpu-1gb-tor1-01.ssh > 198.96.85.21.65355: Flags [P.], seq 59832:59996, ack 37, win 313, length 164
20:36:42.364170 IP ubuntu-s-1vcpu-1gb-tor1-01.ssh > 198.96.85.21.65355: Flags [P.], seq 59996:60160, ack 37, win 313, length 164
20:36:42.364264 IP ubuntu-s-1vcpu-1gb-tor1-01.ssh > 198.96.85.21.65355: Flags [P.], seq 60160:60324, ack 37, win 313, length 164
20:36:42.364357 IP ubuntu-s-1vcpu-1gb-tor1-01.ssh > 198.96.85.21.65355: Flags [P.], seq 60324:60488, ack 37, win 313, length 164
20:36:42.364451 IP ubuntu-s-1vcpu-1gb-tor1-01.ssh > 198.96.85.21.65355: Flags [P.], seq 60488:60652, ack 37, win 313, length 164
20:36:42.364544 IP ubuntu-s-1vcpu-1gb-tor1-01.ssh > 198.96.85.21.65355: Flags [P.], seq 60652:60816, ack 37, win 313, length 164
20:36:42.364639 IP ubuntu-s-1vcpu-1gb-tor1-01.ssh > 198.96.85.21.65355: Flags [P.], seq 60816:60980, ack 37, win 313, length 164
20:36:42.364733 IP ubuntu-s-1vcpu-1gb-tor1-01.ssh > 198.96.85.21.65355: Flags [P.], seq 60980:61144, ack 37, win 313, length 164
20:36:42.364841 IP ubuntu-s-1vcpu-1gb-tor1-01.ssh > 198.96.85.21.65355: Flags [P.], seq 61144:61308, ack 37, win 313, length 164
20:36:42.364938 IP ubuntu-s-1vcpu-1gb-tor1-01.ssh > 198.96.85.21.65355: Flags [P.], seq 61308:61472, ack 37, win 313, length 164
20:36:42.365033 IP ubuntu-s-1vcpu-1gb-tor1-01.ssh > 198.96.85.21.65355: Flags [P.], seq 61472:61636, ack 37, win 313, length 164
20:36:42.365128 IP ubuntu-s-1vcpu-1gb-tor1-01.ssh > 198.96.85.21.65355: Flags [P.], seq 61636:61800, ack 37, win 313, length 164
20:36:42.365221 IP ubuntu-s-1vcpu-1gb-tor1-01.ssh > 198.96.85.21.65355: Flags [P.], seq 61800:61964, ack 37, win 313, length 164
20:36:42.365315 IP ubuntu-s-1vcpu-1gb-tor1-01.ssh > 198.96.85.21.65355: Flags [P.], seq 61964:62128, ack 37, win 313, length 164
20:36:42.365409 IP ubuntu-s-1vcpu-1gb-tor1-01.ssh > 198.96.85.21.65355: Flags [P.], seq 62128:62292, ack 37, win 313, length 164
20:36:42.365503 IP ubuntu-s-1vcpu-1gb-tor1-01.ssh > 198.96.85.21.65355: Flags [P.], seq 62292:62456, ack 37, win 313, length 164
20:36:42.365597 IP ubuntu-s-1vcpu-1gb-tor1-01.ssh > 198.96.85.21.65355: Flags [P.], seq 62456:62620, ack 37, win 313, length 164
20:36:42.365692 IP ubuntu-s-1vcpu-1gb-tor1-01.ssh > 198.96.85.21.65355: Flags [P.], seq 62620:62784, ack 37, win 313, length 164
20:36:42.366937 IP 198.96.85.21.65355 > ubuntu-s-1vcpu-1gb-tor1-01.ssh: Flags [P.], seq 37:73, ack 53324, win 3835, length 36
20:36:42.366975 IP ubuntu-s-1vcpu-1gb-tor1-01.ssh > 198.96.85.21.65355: Flags [P.], seq 62784:62948, ack 73, win 313, length 164
^C
410 packets captured
435 packets received by filter
25 packets dropped by kernel